Headlines,Time
Hire Solana Developers,1666188714
Panic time?,1666420603
ICYMI: Hivemapper - A decentralized 'Google Maps' built on Solana,1666624337
"There are countless chances to make money using Paysenger. One of them is the ability to quickly come up with ideas and communicate them to content producers for further creation and commercialization. Everyone can use the Web3 service Paysenger, which makes communication profitable!",1665440923
Sick new TikTok from BR1!,1665700903
Mandatory Royalties Petition?,1666688252
Solana can now be traded on our exchange aggregator over TOR with enhanced privacy,1665777229
What is the most important trait of an NFT project?,1665644298
US SEC launches investigation into Bored Ape Yacht Club creator Yuga Labs.,1665522309
Bitcoin Vs Solana,1665649244
Staking reward went down from 7.1% to 2.9%,1666458107
New Solana Project! Discover our Board Game and Comic Book 🔥 Discord link in comments,1665860941
All Things Solana with Anatoly | gm Podcast - Episode 20 (10.6.22),1666045070
Bring back royalties mfs!,1666683014
🚀 TODAY's SOLANA NFT DROPS! 20th OCTOBER 🚀,1666263054
NFT services,1666066838
Gm from Not Pussx NFT fam - we just landed on Solana ❤️,1666343578
sollet wallet is blank after adding hardware wallet,1666304074
Is it then difficult to understand that the project is unique?,1665605325
"""Buy-to-earn""? !",1666449802
Don't fret Solana crew. Sam Bank-MAN Friedman will get us out of this bear market. All hail Sam!,1666323806
APR in SOL pool,1665722266
NFT staking,1666094138
Crypto is the future,1666627447
How Much Will Solana Be Worth In 2025 | Solana Tokenomics,1666188178
"Guys tell me where to invest money you can buy some kind of nft? For good advice, of course, I can share a little))",1665483064
Solana Development Book,1666252722
"Check out Kippoverse, a fully integrated mobile metaverse that's live in the app stores. Land and Skin NFTs are instantly useable when you connect your phantom wallet within the app.",1666657250
An exciting story begins with a Mysterious 💥 POWER 💥,1666688760
Next 100x NFT Season,1665976657
Texture Finance?,1666095184
Join the Hubble Protocol Town Hall kicking off right now 🎙️,1665675782
New Discord Bot for WL &amp; Collab Opportunities,1666323244
Missing SOL from my wallet,1666079174
The Need for Blockchain,1665760778
Brainstorming a static analyzer for Solana programs,1665511608
Unity and Phantom wallet integration,1666299336
Have you seen this project? Is it legit?,1666529956
Question about Solana sustainability,1666175484
Solana’s 5 NFT Loan Categories Explained,1666039315
2 things I’m excited for: Raydium is running faster than ever!!!! and CLASH token (CLH). Would be a great way to earn some SOL while 1v1 at billiards!,1666123097
Has anyone actually unstaked $SLIM from Solanium? Scam or user/platform error?,1666545105
A16z Leads $14M Funding Round for New E-Commerce Platform From Twitch Co-Founder,1665620463
Blockchain Development in Social Networks,1665681042
TLDR - what really happened with the Mango $117M hack,1666524673
Pigeons of New York MINT,1666637032
Can’t see my stake?,1665839933
What's your favourite Solana DeFi?,1665937530
A list of 80+ Solana public RPC endpoints at your service,1666122318
What good Solana based games can you recommend?,1665762057
Im done with this project .,1666451405
The first unified AMM &amp; Order book Exchange built on Solana,1665474813
New profit solana project,1666636936
I hate the term Solana killers...,1666109827
Solana can now be traded in privacy-focused exchange aggregator Trocador.app,1666091540
Question,1665644869
Solana Outage (30th Sep 22) - WTF Happened? | Our second vid! Hope you enjoy,1665667050
DAO on Solcial,1665740889
Everlend implements new 'Transfer Deposit' feature,1666192862
🌟📑💻WTF is Star anyway... and why do i need an omni chain domain name service?! 🚀🔥💸,1666359186
Do anyone still uses a wallet address to dump their spam NFT or they burn them via phantom wallet,1665749658
NFT Influencer Marketing: An Effortless Way to Garner Effective Reach!,1666336617
Staking via Trust Wallet,1666581563
WHY I CAN'T SEE MY DEPOSIT,1666610608
Crypto Analyst Predicts 825% Rally for Top Ethereum (ETH) Competitor on Back of Rapid Adoption,1666693226
Weekly Thread | October 24 - 2022,1666569806
Weekly Summary | October 7 - October 14 - 2022,1665767220
Is there a way to transfer Sol from Phantom to Metamask as ETH,1666610457
Not Pussx - New Magic Eden Art,1666646231
Is there a way to view staking rewards for a deactivated stake?,1665887171
Where is the best place to stake Solana?,1666663830
Introducing Solana Core - The First Buildspace Program Designed To Turn ANYONE Into A Solana Legend,1666303471
Legacy solflare unstake issues,1666126928
Validators growth &amp; staker incentives,1665424086
Hubble/Kamino Core Contributor Marius joined Brave New Coin's most recent podcast - well worth a listen! 🔥,1665763122
Was solana a pump and dump?,1665681944
Solana's Top Marketplace Magic Eden Makes Royalties Optional,1665992535
The NFT you own can be changed by the creator without your permission.,1666602638
Hackers Targeting Solana (SOL) Wallets to Steal Crypto,1665567242
Solana Validator Multisig Management,1666307558
What we are all about,1666450965
Have you wanted to mint your artwork?,1666648943
DeLabs just launched a subreddot,1666658641
How do I become a Solana Developer?,1665533977
Solana Says Successfully Completed Cluster Restart After Outage,1665411064
Decentralization.. centralized?,1666689270
Shark Fight! 1/1 photography NFT on Solana,1665575090
DEMO: create a Solana webhook in 30 seconds | HeliusLabs,1666200190
How to check if validator goes offline with API?,1666326390
AMERICA IS GETTING WIPED OUT - Robert Kiyosaki's Last WARNING,1666394942
Mango Markets Hacker: I Had A “Profitable Trading Strategy”!,1666131936
EVERYONE Will Be TERRIFIED In 10 DAYS - CATHIE WOOD,1666133547
Do Solana NFTs have the potential to surpass ETH?,1665544123
Double snapshot,1666651021
Mirror World Smart SDK—A Solana SDK That Basically Covers Everything Your Dapp Development Needs,1666271554
READY SET GOOOO!!!!,1666509704
"Give feedback to us, please. It will help us",1665517945
"a gentle reminder - the best way to make money in crypto is to invest $50, $100 or $200 a week into a coin",1666526532
🐱‍🏍🌠💯 Exchanges&gt;ICO's&gt;DEFI&gt;NFT's&gt;? What are the biggest use-case trends in the web3 space currently? 🚀💸🔥,1666560032
How to separate the community from toxic people?,1665518938
What do you miss in the old social networks?,1665741036
We solana metaverse coming,1666400113
Solana $12.2M in NFT sales from 303K TXs in the past 24H,1665478550
Best NFT COLLECTION that will meet your desire,1665695243
What are the best SOL based applications out there?,1665762128
Cannot see and unstake SOL in my wallet,1665823386
"Today, we’re launching Glow ID - a social identity that you own.",1665654314
Which cryptocurrency do you trust the most?,1665874730
Bikini Bottom ReVersed | Mint TODAY 16.10 | Solana | NFT-Collection,1665924668
"I would like to present one really cool nft project, anyone interested?",1665614914
Does anyone have an example of how to use the ThinClient for the solana rust client library?,1666677320
Dollar Cost Average on Solana with Jupiter x Snowflake Safe Multisig,1665490598
"Mango Markets, a decentralized platform hosted on the Solana blockchain, was exploited for over US$100 million.",1665554908
2022 Solana Ecosystem Map,1665766641
Weekly Thread | October 14 - 2022,1666569733
Cryptodira $DIRA,1666663427
BE CAREFUL! This Is SERIOUS - Ray Dalio's Last WARNING,1666313167
Who Shines Brighter? Solana Beats Ethereum In This Key Are...,1665748038
Sol sent to a limbo wallet?,1666363592
Free tool to keep track of transactions and historical pricing on Solana and EVM networks,1665567562
"Check out the FAQs people ask about Solana staking - Top 5 questions compilation done by stake2earn, Solana validator 🙌",1665651682
What cool Solana based games can you recommend?,1665761985
Using the Solana Blockchain,1665563457
A Glance Through The Development Of NFTs,1666099219
"Web-3.com is Now at $4800, Own a Piece of the Web3",1666545017
Solana Nfts,1666654856
Solana create account with data,1666668138
Magic Eden Teams Up with Solana NFT Aggregator Platform Coral Cube - NFTgators,1665763098
"I have a sol domain address. However, how do I make so when I SEND some $ to someone, they can see it’s from me / my address and not the usual letters/numbers. Did a test send and it didn’t show up as ‘from’ my sol domain. Perhaps I have missed something? Or maybe this isn’t what it does… 🤷🏻‍♀️",1665754183
“zero-royalty movement” and Post-mint Monetization possibilities for Solana NFT Projects,1666549993
"Simpl3r Founder Interview - We Talk 0% Solana NFT Royalties, Scaling NFT Communities through Automation",1666453743
How long it takes to learn Solana if you know Rust?,1665508955
"Thirdweb - To Bring Their Full Stack Web3 Development Kit And Network Of 60,000 Builders To Solana.",1665671409
Working Solana faucet for fees ?,1665520140
How to retrieve art from an unminted collection?,1666551866
New social network.,1666611892
Keeping larger amount of USD on Kraken or in USDS in ledger wallet - Is it safe enough?,1665578358
Degenerate Drop Bears,1666661700
Metaplex Foundation Announcing The Candy Machine v3,1665547086
"Introducing the first instant unstake aggregator, via unstake.it's Valkyrie Update!",1665485772
"A fake Solana wallet security update aims to steal your cryptocurrency, according to reports",1665469721
What could be more important than a modern social network?,1665679274
Beta program for crypto education/trading,1665692163
Solana-Based Decentralized Finance Platform Mango Hit by $100 Million Exploit,1665565322
Pay for your user’s transaction fee,1665492024
"Decentralized NFTs representing real life jewelry, gold and gems ?",1665930605
FREE HASBRO COLLECTION MINT 🎁,1666255404
Free tool to keep track of transactions and historical pricing on Solana and EVM networks,1665464527
Missing Sol Trust Wallet,1665673821
What’s everyone’s exit price for Solona?,1666021838
https://lunaticstoken.com/nft/,1665629825
Unstake.it Launches the Valkyrie Update - the first ever Instant Unstake Aggregator for your staked SOL,1665394467
"Hottest NFT free mint (monopoly hasbro) is on ETH, not sol. LAME hasbro",1666025459
Solana Blockchain Benefits,1665427758
Solana full nodes are available on NOWNodes!,1665764505
"Validator Educational Workshop October 12th, 2022",1665683167
Write up of the Metaplex Token Entangler Program Exploit.,1666216290
Why do business people create an IDO launchpad on Solana?,1666270356
A good infrastructure provider can make your life chill,1665625301
Direct purchase of SOL for US customers is now available on Guardarian,1666100034
Recommendations for learning more about the Solana Ecosystem,1666118109
Unity and Phantom wallet integration,1666297561
Seek the fire of the spark that is already within you. 🔥,1666583945
Selling Breakpoint Ticket for Cheap,1666126689
Introducing the first ever instant unstake aggregator - via Unstake.it's Valkyrie Update,1665487451
I wanted to know what use cases are you giving solana beyond speculation and transaction fees?,1666644128
"SOLANA, we're having a Podcast and discussions open to ALL on October 18th, 2022 (Heads up)",1665965338
Solana Underdogs NFT Whitelist,1665868844
"Destroy the TechNodes with your Legendary NFT⚔️ There are only 20 units to sell for 25,000 FFL each. 🧬🧬🧬 ✅✅✅✅Buy your Legendary NFT now and get ready for Adventure Mode. https://play.battleforlife.online/shop",1665892192
Sol🙌🏼💎,1665674318
Solana staking went APY from 5.6% yesterday to 7.1% today,1666064216
"Check out the latest ""The Zeitgeist"" Phantom Podcast episode with Vibhu Norby, Solana Spaces founder and CEO!",1666020339
help(bad key size error and non-base58 character error),1666051964
How to Create a IDO Launchpad on Solana?,1665580318
Step Data Insights: Tokenomics - Star Atlas POLIS,1665776738
Social networks on Solana,1665936480
9PSAYr9cDsu4y3ScdWRXFFg597WBBWrBvmdiXfeqoAZE,1666445100
Thoughts about doxxing,1665535514
Here is a quick 🧵 that explains Everlends UI &amp; how its built-in risk management works.,1666095081
"I have SOL Wormhole on Ethereum, how to send over to Solana?",1665558723
"Zebec will be featured on billboards, posters, and buildings of Kooola city in the Realy Metaverse, the first Live-to-Earn metaverse on Solana developed with Unreal Engine.",1666207836
Solana Staking On Ledger Live: Complete Guide,1665603230
Need help,1666484201
Extra Breakpoint Ticket (Selling Cheap),1666411131
Profile of the alleged hacker behind this week’s &gt;$100 million manipulation of Mango Markets.,1665735724
You can now lend/borrow $Algo on Solana!,1666021859
DONR Creative Content Contest! You could win up to 100k - DONR! (Now on the Solana chain!),1665527585
Solana can know be traded on our exchange aggregator over TOR for enhanced privacy,1665776231
October 1 - 15 at Solana Ecosystem,1666196230
kTokens are now live on Solend 🚀,1666618983
Audius has acquired Virtual Music Experience Platform SoundStage.fm!,1666197780
Did solscan shown the nfts smart contracts like etherscan ?,1666484036
Now it's the time!,1666480745
"Let's revolutionize entertainment, one production at a time.",1665590175
"Free key phrase quiz, 0.02 sol reward",1665940715
Princess On 🔥Fire Upcoming Event Dec End Of This Year!,1666543932
How do I become a Solana Developer?,1665556774
Czym jest Binance Simple Earn? Jak zarabiać na kryptowalutach z Binance?,1666277618
How can I check/understand whether a smart contract can be edited or not?,1666696037
Solana DeFi Trading Platform Mango Markets Loses $100M in Hack,1665556548
What is Solana (SOL)? Guide to Solana Blockchain Nodes,1666206842
BETAVERSE TO THE MOON🚀,1666431107
Create account with data?,1666668259
What is the future of Web3 on Reddit,1666688393
gm,1666657852
What is the future of Redit and Web3?,1666688512
"On paysenger.com, you may earn money from your content and communicate with any influential person you choose. You can find thousands of your favorite content creators here if you value high-quality content but aren't a content creator yourself. Using paysenger, your plan is covered!",1665498023
Hello Investors if you got any Solana NFTs for sell kindly hit me up privately there will be less gas fee,1666333552
Now you can Login/Register to WordPress websites with Solana wallets using SolPress Login!,1666670375
Degenerate Ape Academy,1666660150
Russia's Economy Will Collapse In 30 Days,1666533353
Just lost 83 Sol to hackers. I think it’s time to get a hardware wallet,1665649432
Too good to believe- Try yourself! Shyft.to Web3.0,1665626348
NFT Marketplace Magic Eden Moves to Optional Royalty Model,1665944423
Gm,1666660530
anyone wanna Dropbox me solana to get started? still new to this,1666505295
Direct Validator Staking via Snowflake Multisig,1666177717
Sol Binance Staking (Beginner),1666146772
Any chance they would rename?,1666122775
The new edition of the Solana lending weekly is here!,1666013717
"Over the past year, Socean has delivered the best APR out of the stake pools on Solana!",1666349629
Do not deposit funds into Mango right now. Attack of some sort ongoing,1665531641
Weekly Thread | October 17 - 2022,1665957312
NFT Influencer Marketing: An Effortless Way to Garner Effective Reach!,1666254233
Crypto World App is The App You Need,1666654502
The new edition of the #Solana Lending Weekly is here! 🔥 All major news and stats of the Solana #lending ecosystem in one slide 👇,1665408356
I have a couple of extra ethers lying around,1666408676
"I had to reset Firefox, multiple SOL wallets?",1665901011
the mango hacker has issued a statement (OC),1665551870
"I unstaked Solana, but the validator says ""invalid""?",1665734479
Guide to Solana Blockchain,1666443873
Easy-to-Use Metaverse Builder,1666691519
Price prediction for SOL in 2025 ?,1665580203
"Tomorrow, together with our frens from Mean Finance we will have a visual walk through of the Everlend app 🔥",1665577009
Mango Markets Insolvent,1665531085
is Solana will be killed by Aptos if yes then why if No then Why I'm noob in this ecosystem so explain me like that,1666375025
Is Solana substainable?,1666175316
Hello NFT investor I will love to know if you have NFT for sale Kindly hit me up if you have NFT for sale Why you need to sell NFT for me? 1. You will use less transaction fee 2. You will avoid creators fee And lots more,1665711937
Now it's the time!,1666472749
Do you go for an NFT or a dNFT? We give you some more info here to simplify the decision. 👇🏻 NFT,1666018754
Toys R Us x Solana,1666095543
"Gothy Avatars, A 999 piece of unique Avatars collection is joining the NFT Space.",1665752201
Hurry up N buy,1666511052
I don’t think Solana gets enough credit for how much energy they save for every transactions vs competitors,1666535103
When will SOL deposits opens on Kucoin?,1665676857
Any help in getting Hubble and Kamino to appear in the Nansen Portfolio page would be appreciated!,1666091877
"Micro-Earning Site to Earn 60+ Altcoins (including SOL), &amp; Help Offer Hands-On Practice At Managing A Portfolio/Trading",1666000980
Quick &amp; easy purchase of $SOL using the StrikeX DeFi Wallet,1666308011
Help (Solana Stuck in Metamask Wallet),1665813232
"Solana is now integrated with Allbridge Core! Allbridge Core enables the cross-chain SWAPS between #Ethereum, #BNBChain, #Tron, and now #Solana.",1667316764
gm,1666787590
"I will give away 5 ETH in the comments randomly to everyone, 1 ETH each.",1667168806
Any experienced Solana techies in Amsterdam that want to participate on a panel nov 26th?,1667487161
SolBlaze partners with Jito to integrate MEV staking rewards into the BlazeStake pool! Here's how stakers and validators can get involved,1667253838
CLAIM SOLANA,1667644386
US Government Concerned - Financial Regulator Shortage due to Crypto Jobs,1666751294
What floors are we sweeping?,1666713680
How to get LIVE aggregated Solana data?,1666822101
"SquadsProtocol Introduces: Based Multisig, Immutable Version Of Squads V3",1667766491
Clash card Subscription Sale On PinkSale - 9th NOV 14:00 UTC- Play 2 Earn Game - Marketplace- SC/HC 101/197 - Massive Reward - NFTs utility - BlockSafu Audit,1667764057
Best tutorial for launching nft collection,1667653931
Which of the utilities within the blockchain do you find most exciting and promising?,1667303261
yolo update. sol. 🐳,1667692468
I had no idea that Changelly isn't really an exchange,1667496070
Question regarding post quantum crypto algorithms integration in Solana,1667145823
Can Solana really hit $1400,1667613898
"BlokHost will disrupt the flaws of the traditional web hosting space with blockchain technology. Watch this space, It's happening already.",1666778928
Star Atlas CEO Key Note in 5 Hours:,1667734482
Peacock Warrior Mint is live now...,1667487137
We Tried to Build a A Full Set Web 3 SDK,1667540282
Understanding why Proof of History is important.,1666706927
Step Data Insights: Product-First NFT Projects and Royalty Resistance,1667227222
DEGODS RAFFLE ON FAMOUSFOXES LAST 1 HOURS!!!!!!!,1667742007
zuck is handy,1667589398
Discussion,1667433275
Use this binance Halloween challenge link and win up to 300$ per person (not kidding),1666767905
"a gentle reminder - the best way to make money in crypto is to invest $50, $100 or $200 a week into a coin",1666979194
"New 6 week ""Solana Core"" developer course by Buildspace",1667613240
"Web-3.com Stands for Web3, Current Winning Bid: $5300",1666877168
Solana Co-Founder Says “We Want To Synchronize the World at the Speed of Light”,1667759363
Want to earn in bear market? Do not miss Solar Dex token in your portfolio,1666809180
Solana: A Fast Analysis Of How The Blockchain Carried out In Q3 This 12 months,1667132721
Neo Films NFT Mint details announced:,1667221790
"Incursion is a story-based Dark Fantasy MMORPG || Powered by #PlaytoOwn #NFTs || #Nidarverse (a gamified, interoperable action-adventure metaverse).",1667434842
Anyone willing to buy breakpoint 2022 ticket,1666717395
The Cross-Chain Ambassador Program,1666727063
Introducing Liquid Self-Stake by Marinade,1666730646
"Incursion is a Dark Fantasy MMORPG, powered by #NFTs | Enter the lands between and explore the Nidarverse | A Gamified, Interoperable action-adventure Metaverse.",1666865449
"Lottery on Solana, says they will airdrop earliest users their “real-yield” token",1667251067
"GameGods is a Web3 platform &amp; India's very first exclusive NFT marketplace. Grab your free badges now. Checkout the website now, link in comment section",1667725625
Help! I cannot access Solana Tech Discord,1667049090
Solana Recaptures $30 Assist; Right here Is What To Anticipate Primarily based On This Indicator,1666961072
Anatoly says Firedancer upgrade coming end of year in new Coinage interview,1667328015
Collaboration,1666728343
NEW ASSET ADDED for EXCHANGE | Swap Star Atlas (ATLAS) on Solana web/desktop wallet,1667751613
DebtHeadsDao Project is going to mint in 8 days,1667220750
How can I contact the admin of the Solana Discord?,1667386855
Let’s get it redediting !,1667168134
Get Telegram Alerts for SOL staked with Socean and Marinade with Socean Bot!,1666704812
New account because Damp Blankets was a terrible name 😂,1666736172
SOL 🚀😍,1667718164
wealthsimple staking,1666816759
Threshold for nonce,1667515960
"Twitter banned me permanently, still not gunna stop 👌🏼📈",1666824402
Solana BreakPoint - Lisbon 2022 Is Now Live,1667646956
Hello everyone if you got NFTS for sell kindly hit me up,1666735715
Introducing the Validator Liquid Self-Stake Program,1666734720
Good wake up call for the community on the importance of Decentralization,1667406684
A Full Set Web 3 SDK: Making You Forget You Are Purchasing In a Dapp,1667538422
Everlend integrates Jet Protocol,1666969861
Friktion vs Katana: which options strategy platform do you prefer?,1667321886
"Incursion is a story-based Dark Fantasy NFT #Nidarverse Soon - A gamified, interoperable, action-adventure metaverse",1667599978
Different Wallet Address by Different Wallet Provider,1667699519
Attention talentless humans. Art Gobblers are now free to mint! 31.10 4.20 EDT,1667281087
Anyone looking at Aptos? Was looking around their NFT scene and found this,1666788539
ICYMI: DEC Raises $9M to Build Decentralized Uber Rival on Solana.,1667235553
launch of our #Paiverse OFFICIAL WEBSITE,1667058174
cur8d::04 // why are vampires bad at art?,1667272845
SOLANA NFT PROJECTS,1667654413
There are some juicy lending yield rates right now on Everlend! 👀,1667395441
Solana nft contract question,1666901183
Solend Randomly Reduces Pending Rewards Days before Claim,1667163120
Google Cloud Collaborates With Solana; SOL Price Surges,1667732032
"Solana security researcher, here. My security reports are shadow-banned on /r/solana.",1666964151
Drift Protocol announces NFT airdrop registration for early access to v2,1666719707
Circle to Bring Euro Coin and Cross-Chain Transfer Protocol to Solana in Early 2023,1667763324
Facebook and Instagram Roll Out Polygon NFT Creation and Solana Support,1667488760
Fragment NFTs program,1667324271
Launch need help,1666995719
Open Source Web 3 SDK,1667541743
APY Statistical Data - a tweet.,1667087559
Art Feedback?,1666717687
Extra Breakpoint 2022 ticket,1667086843
What are the limitations for 1KB solana domains,1667163307
Solana is killing it with NFT AMMs. Check out how you can earn yield from market making with your common NFTs with a growing number of two-sided NFT pools on Solana.,1667127434
Some latency testing of Solana RPC APIs Providers I did!,1667508496
"🔥PINKSALE PRESALE LIVE🔥 Hello Apes, Your moment of salvation is here. As promised and foretold in the JigSaw Doge Bible (the ""whitepaper"" for you trapped mortals seeking your freedom, financial or otherwise), we are live on PinkSale! Now make your choice: BUY OR DIE!! Some presale rules to he",1667339921
Solana gambling,1666874560
Breakpoint Talks: Firedancer Overview 1,1667668786
"NFTs that Mutate?! They are Humans by day and Zombies by night, is this the first of it's kind?",1666980925
"Meet SpacesDAO - The World's First On-chain Retail | Now anyone, Anywhere, Can Build Their Own Solana Store.",1667654912
How-To Migrate BEP-20 project to SPL?,1667423761
#crypto everywhere! This is how Lisbon welcomed us! 😊 A day from a validator life. Solana breakpoint coming soon! 😏,1667425252
How to take off Discord Roles of NFT holders when they left the server ?,1667503953
Aptos,1666732228
"Solana Struggles Beneath Key Resistance, Can Worth Flip $30 Into Help?",1666790410
How to Stake Sol on Marinade Finance and Synthetify to Earn 80% APY,1667596578
Huge News For Solana!,1667698168
Avoiding UpdatePhantom.com scam from mobile wallet?,1667734093
SOLANA Price Analysis [ Google and Crypto Mass Adoption? ],1667751413
DebtHeadDao nft project will soon be mint,1667225055
Nitro SVM Devnet Has Officially Been Deployed,1667506293
Sol,1667672246
The next crypto bankrun?,1667795011
How do Nft scammers know who to send the scam Nfts to,1666793766
Is there any alternative to Mango Markets on Solana to trade perps? or was mango basically the only one? Thank you and would appreciate any help.,1666835021
The new edition of the Solana lending weekly is here! 🔥,1667225482
Weekly Thread | October 29 - 2022,1667178397
"Just a moment...We have some good news for those of you who want to enjoy the extremis NFT project: here you will find the sensational super powerful thriller! Each character is unique and can change history. Play, Build, Own, and Monetize your virtual experience.",1667617748
test,1667553123
The XOA Universe Collection: 4444,1666944969
