Headlines,Time
I’m getting my dick kicked in like most of us. I had 10.057 SOL at top dollar 5/24/2022 I moved it out of CB and moved to ledger staked it at 9.255 after fees and holding some back Just opened up my wallet at some point I earned a whole coin.,1667696596
Solcial brings better advantages for content creators and social media users,1667490406
Multi-Mint function in a DAPP. URGENT!,1667007602
"Hey, hey - make #solanabreakpoint your getaway from Lisbon! 🚀 Great 1st day - Networking, decentralization and crypto! 🙌🏼 Stay tunned for 2morrow! 🌜 #solana #validator",1667609532
Swap token,1667668514
Protocol / Project/ dAPP for salary payment?,1667389366
How do can I register name and metadata for a token I created?,1667485296
Thoughts on Aptos??,1667245817
"Nebulanian, [11/4/2022 8:43 PM] TOKENOMICS: 20% initial sell tax reduced 5 % per week 10% claim tax 5% of node creation cost goes to development 15% treasury 75% goes in the reward pool",1667590602
EVERYTHING what you need to know about where Solana is now 👇🏼,1667687154
Ankr on How to optimize nodes 🚀 #SolanaBreakPoint,1667737070
Good Things Take Time,1667382994
Everlend integrates Dialect's notification services! 🔥,1666703721
Good Morning Whales 🐋,1667019467
Can Twitch's Co-Founder Rule Web3 Gaming?,1666898945
libssl-1_1-x64.dll was not found error,1666818614
How to connect my Phantom wallet with my Instagram account?,1667573952
Solana Validators Workshop - a Recap. How to become a good validator?,1667250008
[NEW]Astro Society Mint date official announcement! December 1st 2022,1667474665
What’s up with the sudden price jump?,1667662836
PRISM is now the most integrated aggregator on Solana - better rates than Raydium and Jupiter,1667718202
which NFT to buy? almost unlimited budget,1667417778
How to transfer usdc from phantom wallet to bank in India?,1667235384
"BoredSpace Presale Nov 6th - GET WHITELISTED NOW! The presale whitelist is opening up for BoredSpace- the first NFT Social Protocol for Web3 and the Metaverse! PRESALE NOV 6TH @ TBA UTC 🔹No Private Sale!!! 🔹NFT &amp; SocialFi 🔹Share2Earn 🔹World Cup Fan System Make $EARN when you post articles, vi",1667733443
Joe Rogan discussing the future of Central Bank Digital Currencies with Tim Dillon,1666976389
Bought some SOL and staked some SOL,1667596384
Paiverse is on a mission,1666894501
Launching Proof of Talent,1666873384
SolPredict - Prediction Game,1667718315
Solana Foundation Games Day | #SolanaGamesDay,1667340071
Are you bullish??,1667551666
"What's your favorite Solana Project at the moment, and what are they building?",1667385738
How Do Phishing NFT Scammers Pick Sender Wallets?,1666736777
Solana Hacker House's Schedule During 2023,1667686671
Not Even Close: Why USDH is Completely Different,1666879205
"Teleport, A New Startup Raising $9 Million To Decentralize Ridesharing",1666963530
MOVE on Solana?,1667768064
"With a vicious pact, an ancient force of death is getting out of the eternal prison. The tarnished are returning to Nidar...",1666699911
What happened to Holaplex?,1667196012
Is there a STOCK Derivatives Marketplace or Exotic Options or a combination of both here in SOLANA currently existing or being built?,1667216728
Sol Staking NFT On Binance,1667406772
Solana Mobile Cannot access Saga Pass paid deposit with card,1667157268
Solana Validators Workshop - a Recap.,1667514512
Weekly Summary | October 28 - November 4 - 2022,1667581234
Who’s in Lisbon for Solana event? Let’s meet other fellow redditors!!,1667307101
Solana hater join the show....,1667214578
Killing Ethereum with the Co-Founder of Solana,1667317047
Psychodelic Vibe V1,1667714879
Solana's TPS has been doing pretty well recently,1666733880
Full house at Solana BreakPoint 2022 🚀,1667650816
End of Year prediction ? Who will control crypto markets ?,1666811290
Network Performance Report: October 2022,1667245758
🚨🚨Few more days OCT 30th The Hallowed mint🩸,1666975263
Weekly Summary | October 21 - October 28 - 2022,1666978302
"Next generation DEX built on SafeCoin - Safely is holding an AMA on Nov 6, 2022, 6PM UTC (2PM EST)",1667417061
Metaplex Auction NFT theft exploit technical write-up.,1666795300
Google cloud collaboration with Solana?,1667662592
The nerds at /r/ethDev built an open source web tool that searches through all the web3 / crypto jobs online in real time.,1667375808
"GameGods is a Web3 social media &amp; networking platform and India's very first exclusive NFT marketplace. Checkout the website now, link in comment section",1667640963
#Bearish,1667750825
"As $SOL prepares for a recovery rally, there are several Solana-based projects that can gain from the uptrend.",1667395136
Market,1667319941
An Opensource Full Set SDK Solution to Building An NFT Marketplace,1667617301
Attention talentless humans. Art Gobblers are now free to mint! 31.10 4.20 EDT,1667252837
Your friendly validator - feature suggestions.,1667771672
Not Pussx 👀 On Magic Eden 👀,1666743990
My Phantom wallet was hacked,1667755403
- First playable soccer+casino Gamefi P2E project - With World Cup betting system - Build with unity engine - 5 months of hardwork in developing - PVE with a ROI of 30 days - Win more cash prizes with seasonal PVP soccer league - OG casino games - Game beta version released - More Esport soccer leag,1666885330
Fractal is hosting a free-to-play $10k EV.IO Halloween Event right now,1666814536
twitter Ppl entering reddit be like,1666762172
Google Cloud Now a Solana Validator,1667710427
Auto-staking via Lido Finance is now live on Kamino Finance 🔥,1666884774
"Binance NFT Marketplace Celebrates Halloween with “Spooktacular Scavenger Hunt” Mystery Box Collection and 10,000 BUSD in Rewards",1666858404
How do you choose a validator?,1667339971
Check out my latest video on which blockchain is better Avax or solana,1666851804
Only the ashes remain..,1666912231
ElusivPrivacy - Add Privacy To Your DApp With Just 5 Lines Of Code 🤯,1667767157
The XOA Universe Collection: 4444,1667032384
I came across this dope NFT Collection!! Check it out and lmk ur thoughts,1667243305
Solana Conference &amp; Party in Istanbul,1667274162
"What if there was a show like Last Week Tonight, but for crypto? Well, we made it. And we had Anatoly on!",1667401928
Solana to the moon!,1667675056
"Helium aka ""The people´s network"" lol",1667475931
"Own a Piece of the Web3 Industry, Currently at: $5100",1666719149
The repository of metaplex is empty,1667255834
Thesis Survey USDT Gifted,1667464036
Firedancer - Building A New Validator Client For Solana In Order To Create A Better Network For Everyone,1667771049
"Meta just entered the Web3 space in a major way. Mainstream adoption is happening as we speak, slowly but surely.",1667443388
Minting debt effectively??,1666949921
Helium_mobile &amp; Solanamobile Are Partnering To Bring The World’s First Cryptocarrier To Saga Phones In The US,1667658156
"Reddit NFTs, Hasbro Monopoly, McDonalds? NFTs in big brand revival now?",1667087408
Instagram &amp; Facebook have integrated Support For Solana NFTs!,1667440757
Part 2 of a multi-part series on the Curve Wars and 4Pool drama (The growth of UST and its partnership with MIM in the lead-up to 4Pool) 📰,1666712544
What NFT IS NOT FOR TOMORROW?,1667060273
"Solana still NR.1! EVERY project out there is still adjusting, and will keep adjusting untill rules and regulations are set in place. No matter the outages SOL is having, they are still Nr.1 and have a great future potential.",1667557999
DEGODS RAFFLE,1667739056
yolo update. solfather.,1667246698
A Full Set Web 3 SDK: Making You Forget You Are Purchasing In a Dapp,1667615153
Paiverse #Giveaway,1667146214
Solcial's Freedom of Usage,1667646646
https://twitter.com/IncursionGameFi/status/1586764319278084096?s=20&amp;t=5Gc64sKDNokRBvq0-hIOcg,1667261800
"Helium, NOT the ""People´s network""",1667311905
What do developers think about Solana?,1666792256
Thoughts or Feedback on a Solana Synthetic Real Estate Protocol Parcl?,1667328811
"What is GameGods? its an Web3 social media &amp; networking platform. Checkout the website, link in comment section",1667551828
"So, the Porsche nft Public Free Mint has begun.. Another example of boomer brands trying to stay relevant - Ill pass, but it does show how huge NFTs have become.",1667766066
SOL Charts Look Bearish Following 9+% Price Drop In 24 Hours,1667808220
Question about Solana smart contracts,1667214483
Art Feedback?,1666717656
"Build your Solana project with talent you can trust using Freeflow. Get connected with a network of vetted, secure, blockchain developers to ensure your next launch is smooth and safe!",1666896690
DeGODS RAFFLE 1 Hours!! LFG!!!!!!!!!!,1667744556
Space Falcon - Shooter Blockchain Game for Solana,1667243086
"Incursion is a story-based Dark Fantasy MMORPG || Powered by #PlaytoOwn #NFTs || #Nidarverse (a gamified, interoperable action-adventure metaverse).",1667350190
PRISM swap aggregator now takes zero fees,1667713617
We Built An Opensource Full Set Web 3 SDK,1667660153
Weekly Shame List,1667782673
I transfer my solana coins last night around 9 pm they still didn’t arrive,1667739712
Firedancer questions,1667760619
A Web3 platform to receive crypto donations/tips,1666909489
Freeflow Web3 Project Trends Report for October 2022,1667481256
SOL or BTC purchase,1667447761
Solana (SOL) Continues To Lag In Worth; SOL Should Do This One Factor To Rally,1667658757
yolo update. 🐳,1667331590
2500 Not Pussx dancing on Solana Blockchain 👀,1666767872
This Web3 Domain Will Sell For Six-Figures in The Next Bull Market!,1667515876
Welcome to #SolanaBreakpoint It is ON for a great start! 🚀 #follow us for more!,1667569563
"Forget NFTs, Now You Can OWN WEB-3.com",1666809384
Staking help,1667415290
NFT Gaming: Points That Could Change the Future of Web3!,1666781539
Can I restore a sol wallet using my seed from ledger and then have access to my sol ??,1667677259
What are the best protocols on Solana without a token?,1667313956
Imagine getting scammed the first day,1667367543
APY Statistical Data - a thread.,1667087665
Big Anatoly Interview coming with Coinage,1667143466
APTOS TO $100,1667239235
Kryptowaluty dla początkujących - jak zacząć? Poradnik,1666708662
Everstake's Interview with Solana Summercamp winners!,1666712788
Managed to get some mSol with this dip - now what?,1667946319
Waiting,1668041457
I bought 5000 Solana,1668092035
Google Cloud operates an audit node on the Solana blockchain… what does that mean?,1667914729
Some exchanges are not allowing to make an advance order for SOL any less than $3.5. That’s so weird,1668013873
Solana to the moooon 🚀🚀🚀🚀,1668026846
SOL Short Squeeze is what we need right now #SOLShortSqueeze,1668087661
Is Alameda Research Insolvent?,1668038154
By far the best write up of the Mango Markets exploit (that I’ve seen so far),1667837091
Solana/ reached 500 solana today! What are your thoughts on the future of Solana?,1668103518
i had 10 buy order for 10 sol at 31$29$28$ down until 21$,1667968828
Weekly Thread | November 8- 2022,1667932071
7min remaining goodbye and thanks for all the failed transactions,1668068800
Bitboy Crypto... You Ruined My Life,1668029176
Any Solana Developer Dicord or Telegram rcommendations?,1667989365
WHICH PROJECTS DESERVE A HIGHER FLOOR PRICE THAN WHAT THEY ARE CURRENTLY AT?,1667899046
funny 😜,1667843377
Solana drops out of top 10,1668005191
Hate.,1668109365
Metamask trading bot 2023,1668065091
Neon EVM Set To Go Live On Mainnet: Welcome To A New Era Of Ethereum Scalability On Solana,1667828434
Solana Lab's funds are not on FTX,1668007364
1-800-273-TALK (8255) USA Suicide hotline,1668030817
Does FTX/Alameda really own 10% of the SOL supply??,1667965089
i am going all in on solana.,1668028225
"Why do you think Solana Web3 builders especially, prefer to host their websites on the centralised servers rather than hosting dApps?",1667903315
There might be a Pump soon. Are you filling your bags with SOLANA.,1667886309
Circle To Introduce Euro Coin and Cross-chain Transfer Protocol to Solana in 2023,1667836294
Things are bad but on the bright side the roster of incredible Solana NFT projects coming up is elite.,1667900413
We are closer to 1 dollar then 200.,1667975721
SOLANA SPL TOKEN BURN ADDRESS,1667876632
How to get number of wallets holding a particular SPL token?,1667828769
Don't be against CHINA.,1667983726
If you wanna leave now is the time to do so,1667961414
Flashloan Arbitrage Tutorial UPDATED - How To Earn 100+ BNB FREE With Just 0.15 BNB (FlashloanAttack),1668003812
You can help me grow the ecosystem - Target on boarding 25K users to Solana,1667839657
Tutorial: Calculate transactions per second for Solana with Rust,1667862079
How bad will it get?,1668029464
"Ok everyone, price predictions for 3 hours from now when the dump happens:",1668058265
So will FTX dump?,1668056267
Locked staking,1667997660
"SOLANA IS THE FUTURE, NEVER FORGET.",1667899577
Great SOL YouTube vid by InvestAnswers from 11/6/22,1667820463
"James is bullish; lots of improvements for the chain, and still faster and cheaper then eth.",1668038326
Unstaking postponed?,1668058744
knock knock,1667956962
Is everyone OK?,1667976271
Lost too much money to sell now tbh lol,1667991074
what will of usdc ?,1668005845
F,1668019693
Thoughts shared about SBF from a credible source.,1668052329
What’s happening with solana,1667932959
I don't care about price right now. Have you guys have problems with the chain? Want to hear technical problems.,1667972266
SOL at $20! How many SOLs should you have at this time?,1667972927
Come Join us in Solcial,1667910668
What's your next move?,1668051519
Vitalik is showing support to Solana,1668084373
"Where can I found the list of entity who fund the ecosystem, + track record of previous product / project financing and ecosystem grants ?",1668106107
The boy who cried bottom,1667856603
Free Star Atlas Comic Series on iTunes:,1667956620
RIP Solana. Come to Matic guys. it is over for shitlana,1667936379
Portals is one of Solana's Top OG Metaverse Projects that keep getting better,1667907766
Solana $ prediction,1668019310
Is this really the end guys?,1667981929
Im 53% down on my investment. Average is $33. Should i sell now and buy back in at a lower price or hodl and average down,1668051856
A friendly reminder to never trust a crypto influencer,1667983490
Who is going to stay behind with me and play the violin while the USS Solana Sinks? I’m going to ride to zero at this point as I average 178.xx per coin,1668030151
I hear a lot of bullshit about Solana let's put it straight,1668062234
This is the best coin you can have its the cheapest and fastest to move around i mean to me its priceless..,1668049900
Solana Tokens worth almost $1 billion to be released by Thursday!,1668052156
Star Atlas Keynote Speech From Breakpoint:,1667849166
Solana competing with aptos,1667986709
i am going all in on solana.,1668028320
"48 mil unlocked stake is currently deactivating, take note",1668000388
Do you invest in Solana due to your faith in the NFT market? How much of your confidence in SOL is correlated to a bullish outlook for NFTs?,1667973219
Get down! Get down! I am moving all around!,1668021550
FTX Solana Wallets,1667866500
Fuck,1667945024
solana $10?,1668095797
Raffling a Mythic Background Degod on FFF,1667858680
funny😜,1667845534
Was Solana a bad investment? (No trolling),1668043299
How to stake SOL the right way (7% to 8% APY),1667970972
"Mass ""Unstake-tion” event on the horizon? What happens if you leave SOL staked?",1668025314
With big folks unstaking will the overall staking apy rise ?,1668030361
So what's the new reason Solana crypto boys are taking it in the ass again?,1667884592
I hope everyone sells!,1668018497
I think worst is mostly over.,1668053299
Should I be worried about my on chain tokens that aren’t SOL?,1668030808
Can Solana Recover? Full Technical Analysis,1668051411
Binance not buying FTX,1668028791
DO YOU STILL TRUST NFTs?,1668081816
Your tought?,1668000543
did anyone else noticed this? - I only use webull for alerts.,1668053566
"Hey guys, it is start of an entirely new season for social media users. The Solcial social media is now live on the solana mainnet, my journey as a content creator has been smooth so far. I get to monetize using my own personal tokens and I pretty sure of no-more bans and de-platforming.",1668106928
Should we help crashed people?,1667981366
"SOL to get more decentralised, now after Alameda is gone?",1668084191
What news made SOL drop in price?,1667983336
Be trading - educated ! Solana price prediction,1668067594
The great unstaking,1668100140
Staking Solana,1667969226
can someone tell me a list of all the drag and drop metaverse builder tools currently available in the market?,1667978685
What’s going on?,1667860517
How to stake SOL the right way (7% to 8% APY),1667971157
Crypto currency,1667902627
Falling too fast,1667979738
Everyone here thinks solana is now dead. Why?,1668042808
Sol will come back stronger than ever!,1668075280
FYI - All SOL projects can be bridged to and from SafeCoin,1668016289
Worst timing ever. I’ll just leave one of the worst spells of bad luck in financial history. Sell pressure cut in half.,1668033540
Is that all over for Solano then?,1667978024
SOLANA CRYPTO price prediction 2022 - Will it dump ?,1668096803
CZ Said:,1667949529
My wife is going to divorce me,1668007164
Sentre integrates Everlend,1668006983
why is solana droppre more than others,1667950198
WHAT ARE WE BUYING TODAY?,1668081225
"Hi. Now using a decentralized wallet, such as (Trust wallet) to participate in defi mining, the maximum annualized income is 535%, the daily income is about 1.5%, and the income can be withdrawn at any time. There is even a chance to get airdrop rewards of up to 10,000 USDT. Add customer service wha",1668025874
Invest Answers the Legend,1667939597
SOL transfer failed,1667920285
How do you identify spam links,1667935430
Seems a Good Time to Post this Again: What is Dead May Never Die,1667981887
Exchanging Sol to USDC on Raydium. What blockchain is the USDC?,1667845008
Testing 1 2 3 my first post,1667912497
Solans down 30+%,1668000034
Flashloan Arbitrage Tutorial UPDATED - How To Earn 100+ BNB FREE With Just 0.15 BNB (FlashloanAttack),1668002776
Who was lucky enough to sell on time?,1668021676
Welp. It's over. Binance pulls out.,1668029088
SOL short-sell = win,1668081370
CPI report came out and inflation eased to 7.7%. 🚀🚀🚀,1668087781
Knock knock,1667957162
I saw a user from Cardano post something shitty. I'm sorry for that. I know you guys are experiencing a bunch of pain right now. If you are looking for greener pastures here's a handy video on setting up a Nami wallet for Cardano. I'm happy to answer any questions I can. GL.,1668034265
"When 53,629,399 SOL will be unstaked, OKX will ""upgrade their trading account system"" right at the same time. Coincidence? I DONT THINK SO.",1668013762
Stop investing into projects you don't believe in...,1668099126
Will we still get the solana phone?,1668019445
$164.73 ….. my timing is impeccable,1668053338
October 16 - 31 at Solana Ecosystem,1668008774
What would be the future of sol,1668053357
"Hi everyone. I’m interested in staking. Can someone plz explain the risks of slashing. I’m on a very safe trading agency, but is it still a concern?",1668112220
"I think back from summer and realize we've lost a lot of Degens along the way. Some accounts I don't see anymore... perhaps capitulated &amp; forever touching grass back in the matrix. If you still here grinding and building, you definitely GMI 📷",1667899873
How much lower before we see Zuck buy out Solana for Meta?,1668057987
Is it still worth holding right now?,1667885572
"At noon on 9/11, a Solana whale was reported to be awaiting liquidation of more than $50 million.",1667983758
Volume = Market Cap,1668010750
Jito Labs is still full steam ahead,1668036572
Falling knife I tell you…,1668020102
SOL vs stSOL,1668045037
Most underrated builders on Solana ?,1667898060
"Bitcoin drop below $20,000… here’s why!",1667919180
Clash card Subscription Sale On PinkSale - 9th NOV 14:00 UTC- 1 hours to Go Live - Marketplace- SC/HC 101/197 - Massive Reward - NFTs utility - BlockSafu Audit,1668000449
ANY SOL NFTs ACTUALLY WORTH BUYING RIGHT NOW?,1668081068
MOST UNDERRATED BUILDERS ON SOLANA?,1667898939
Can someone give me the tldr on FTX’s effects on Sol? Hard to keep up with everything this week …,1668047683
is there any bug on the network ?,1667915896
What’s your view on Solana’s future?,1667930818
When do you think it will hit $100 again? March?,1668039897
Solana on a R.I.P.,1667982801
Solana October Timeline,1667853860
What is Dead may Never Die,1667982167
"Incursion is a story based dark-fantasy NFT. #Nidarverse soon - A gamified, interoperable, action-adventure metaverse.",1668037820
Context for the large amount of unstaking Sol,1668037569
How to unwrap WBTC Sollet to Bitcoin network?,1667811284
Nerves gage been settled.,1668108630
Which project do you think has the most utility and best exhibition at the just concluded BreakPoint Lisbon 2022?,1667903451
Is this legit?,1667969658
SOL analysis (Sol searching NOW),1668004002
"When the stake deactivates, is there any chance the coin won’t actually drop much?",1668042530
Buy or die?,1668049501
After this we need a rebranding,1668073503
$SOL DOWN 20% IS THE SCARIEST SHIT I'VE SEEN IN A MINUTE,1667899300
Unverified: Solana to get rekt,1668049713
Why is sol so cheap rn? Is it to do with ftx?,1668078042
Question about sending USDC to Ledger via Solana network,1667874999
What doesn’t kill you will make you stronger 💪💪💪,1668030736
Can someone let me know if this is true or fud?,1668000696
You probably shouldn't stake on Binance or FTX unless you want Solana to become very centralized,1667926808
Breaking news: Google Investing $10B in Solana.,1667990656
Free Star Atlas Comic Book:,1667957444
"So what if SOL goes to zero, the price is irrelevant. The most important thing is that we're a community of builders. who's with me?!",1668030368
18 million predicted to be dump?,1667984514
did hubble protocol freeze accounts for solana loans ??,1668025774
Is it the end?,1668043033
Is Solana dying? $sol,1668083198
FTX Token ( FTT ) is too centralized. Risky for investors.,1667896742
I feel a shift. Solana going up?,1668022377
From the Cardano community to the Sol community,1668024635
The new edition of the Solana Lending Weekly,1667837547
How to unwrap sollet BTC without FTX?,1667961844
I am new. Convince me why Solana is worth it,1668032663
What is Solana's role?,1668099708
When will you guys start buying solana? I bought the top but I believe in the project. Thinking of buying a lot soon!,1668015505
I told it the whole time!,1668025005
Metaplex Launches Solution to Enforce NFT Royalties on Solana on-chain,1667902511
"If as a web3 builder, you're privy to build a very secured website at almost zero cost on a decentralised web server like blok.host, would you rather host on it, or you'll prefer Centralised web Hosting?",1668082401
"Hi everyone. I’m pretty new to holding Solana. Last nights drop was scary but I held. I’ve read lots of articles, but they all give me different answers. What would you say is a realistic price point Solana could be at in 1 month, 6 months, 1 year, 5 years?",1667926106
"Anyone here unfazed by the crash and or who wasn’t sold/un-staked and done this, seen this before where this is just another crazy day and comes 2025 we will laugh at it?",1668058412
Star Atlas Development Video From Keynote:,1667849092
Great positive thread on Solana by Chris Burniske (for those who need it ),1668036692
Carmaker Porsche NFT public/free Ethereum mint now live. 1000 hand drawn sketches with tangible benefits for Porsche owners. Interesting at least.,1667933817
Holy fucking shit down 20% in less than 1 hour…,1667930851
"Unstake Update: 28.5 million SOL have canceled their epoch 370 unstake, lowering total unstake volume to 29 million",1668034826
Predictions after this jump to 18$ after dropping down to 14$?,1668098002
The Graph Now Supports Solana - Easily Access Historical Solana Data With The Power Of Substreams,1667818863
So did the unstaking happening?,1668075894
"can we petition to sue Solana, ftx, and others",1668069123
☺️,1668095249
What can the devs do right now to stop the down trend?? Constructive thoughts only.,1668019722
"So, this is the CEO of Alameda Research....",1667987764
Ledger Partnering With Solanamobile To Build An Easy-to-use And Secure Web3 Experience For Solana Mobile Users,1667831296
Solana being shady AF,1668110195
BIP49 derived public key?,1668086935
Solana Whitepaper Explained,1668008372
Solana Prediction,1668018916
SOL PLEASE,1667899795
Love watching Solana going down,1667983416
"1 SOL IS 1 SOL SIMPLE, BUT NEEDED REMINDER",1667900130
Signing up on Solcial,1667868704
So will this (29M SOL) be unlocked in a few hours or not?,1668052726
Solana transfer fail,1667918889
"Solana Labs, A US Corp, Didn’t Have Any Assets On FTX Exchange",1668066933
"Moving wrapped SOL from Coinbase Wallet to Phantom, etc. Troubleshooting",1667938305
Potential purpose of unlocking Sol,1668046479
how much did y'all lose in solana or cryptos,1668058456
Why is nobody bullish on SOL?,1667939215
Google Cloud Announces It's Now A Solana Validator; Announcement Sends SOL Price Up By 15%,1667833483
Solana what is next,1667984193
Solana Price Prediction Once Epoch 370 Ends,1668019412
Unbelievable. Im just shocked at the timing,1668031921
Uh... are we broke?,1667878301
$FTT one week price?,1667912688
IS SOL DEAD?,1668081930
Why do these crypto Millionaires and Billionaires fuck up?,1668064222
"Wait, it has dropped to 28mil now. So this unstaking event doesn’t get as big as expected?",1668030361
Wagie life 4ever,1668025610
I can just cry. Never expected this.,1668056304
