Headlines,Time
"Hi, I am looking forward to building a metaverse how should I proceed further?",1667978813
What's your Preference? Centralised Web Hosting Or Decentralised Web Hosting?,1668082459
"What are the odds Solana will hit single digits, and if so can it recover? Are we thinking years for Solana to recover?",1668010455
Look at the 30m de-staking Epoch to get a window into what's about to happen.,1668014125
"Afaik, the FTX fiasco only affects SOL's price, not the actual viability of the blockchain. What's with the doomers? Am I missing something?",1668053382
A gm thread from Toly,1668004226
Solanabros…. Not like this,1668017073
Thoughts on SBF??,1668021281
HELP Unstaking Msol from Solflare,1668047871
"Incursion is a story-based Dark Fantasy NFT #Nidarverse Soon - A gamified, interoperable, action-adventure metaverse",1667816879
Short Squeeze is Coming,1668035824
Future of SOL,1668035513
how to make money in crypto even in a bear market,1667857177
Right time to buy under 20$,1668101017
System broken,1668331685
why they stop to unlocked rest of Sol which has to be unlocked is it not kind of centralised control?,1668250195
Has the mass Solana being unstaked happened yet?,1668576078
What will happen with the SOL from Alameda?,1668366241
TODAY: Hubble Protocol and Kamino Finance TOWN HALL at 3 PM UTC,1668597712
Another reminder to be very wary about centralized exchanges right now (i.e. Crypto.com),1668316704
Release?,1668125664
OpenSerum Update | Community Fork,1668409783
"Weekly Discussion | Nov 14, 2022",1668487062
What are Web3 terms? Register on GameGods and win free NFTs. Link provided in comment section,1668411734
FTX Hack Sparks Revolution at Serum DEX as Solana Devs Plot Alameda's Ouster,1668311787
pretty sure there's someone utilizing workarounds to cause transactions to fail by way of Francium protocol,1668527149
"I bought some Wormhole PAXG (Paxos Gold), and the only liquid market of that token was in serum.",1668553558
Question on Sol Future,1668273977
Is sollet wallet safe,1668245810
Solana next to…,1668440900
Get off of Crypto.com as well,1668190125
Banned if u say any truth about sol 😂,1668442820
Where is the sol army ?,1668589609
Buy now OR regret later,1668116623
Solana current Nakamoto coefficient is actually 2. This needs to improve.,1668379809
Wealthsimple staking,1668269989
Could Sol still get to 1000 in 5 years ?,1668477373
"What are some NFT projects that deserve some love and support? Check out Phantom's Twitter contest and help celebrate Solana's great art, creators, and communities together. 🤝",1668113125
Porsche NFT Public Mint,1668309356
Crypto Lottery,1668358532
"Weekly Discussion | November 14, 2022",1668486605
Looks like Kevin Bowers was shipping Firedancer code this morning,1668292625
‎NFT and Chill: FTX and the Difference Between CeFi vs DeFi on Apple Podcasts,1668545778
Is FTX US fine? Is it totally separate from the mess happening at FTX International?,1668360476
why does you logo has so many similarities with FTX's logo?,1668411233
Rumors About ProjectSerum - Head of BD + DeFi @Solana Labs Reply,1668209336
My sol and crypto brothers CRYPTO.COM might be next take your funds out of that platform before it’s too late,1668267763
AIRDROP,1668162115
'Unable to send' NFT from phantom wallet,1668498661
110 sol for 80 usd,1668550833
﻿Viasyl - Control your crypto investments in one place - Buy With Credit Card - Strong Community &amp; Marketing - Launching Now.,1668409343
Buying all your bags for $13 a piece,1668417351
Nothing has changed. Solana is Solana,1668122565
Is $SRM dead? Guys I have a shit ton of them farming on raydium together with $RAY sigh,1668223656
Why Crypto is a Dead Investment,1668215075
"Ellipsis Labs announced an upcoming devnet for what it claims to be the first on-chain limit order book DEX built on Solana, Phoenix.",1668521425
Have you been buying the blood? Or Are you waiting for more blood? 🩸🩸,1668609515
Tokenomics question,1668344265
Is there any chance here of phantom or solflare taking a dive?,1668204029
What’s going on to Serum?,1668475204
"Do not login to FTX, malware possible",1668226855
Good tweet about sol considering what's going on right now.,1668350738
﻿Viasyl - Control your crypto investments in one place - Buy With Credit Card - Strong Community &amp; Marketing - Launching Now.,1668409080
New NFT card game,1668277579
Getting Closer: The Mobile Era Of Web3 With Saga And Solana Mobile Stack,1668172810
I find it funny this is the only cripto sub that let's haters and trolls posts BS and lies.,1668114542
What is happening with the existing SRM token now that they forked it?,1668392412
Why not us?,1668472303
What's your opinion on this take ? It's D-Man from Blockchain whispers I like him but I like SOL too. Is he right or wrong ?,1668451288
"Why is Anatoly so quite, what’s his take and what exchange of messages did he have with SBF recently?",1668326902
SOLANA is a Scam? Pattern You Don't Want to See,1668512671
what exchange are you guys using to buy solana now that ftx drama happened?,1668186116
An AI-powered economy for low-liquidity commerce on Solana brought to you by NeoSwap,1668596671
Do you think I'll get these filled?,1668634234
Did serum fork?,1668548335
"If you don't believe in the tech, sell me all your coins!",1668364313
Can’t send Sol to exchanges,1668520500
Is Solana in the process of completely collapsing given Serum is collapsed?,1668627614
G O O D M O R N I N G L E G E N D S 🫡,1668162709
"So, the Porsche NFT public/free Ethereum mint now live. ""1000 hand drawn sketches with tangible benefits for Porsche owners "". Well, cool I guess; I minted an ugly boxster, anyone get a 959?",1668209515
Staking with trust wallet?,1668465292
Buying!,1668481848
WHAT'S A RUG?,1668162264
Whats happening with $USDC-&gt; $USDT on solana? https://lightecho.io/?from_asset=USDC&amp;to_asset=USDT,1668333688
"Ellipsis Labs announced an upcoming devnet for what it claims to be the first on-chain limit order book DEX built on Solana, Phoenix.",1668521564
"ftx, doj, biden ,scam, sbf.",1668266437
115 SOL coins for $76,1668440795
So much lana,1668519061
Governance,1668455437
so now what??,1668494625
Anyone thoughts on FTX bankruptcy?,1668189559
Solana based DeFi yield platform Texture has raised $5 million in a round co-led by P2P Capital and Sino Global. Their private beta is now live.,1668453017
ORCA,1668513536
lets bring attention to the fact that the network was stress tested with this event.,1668115913
Phantom staking rewards,1668619899
Some updates of the week,1668461430
SOLANA MILLIONS OF COINS ARE ENTERING THE MARKET THESE DAYS? WILL THE PR...,1668176941
"Solana yield manager Texture raises 5 million, enters private beta",1668453231
Does anyone have the wallet addresses for FTX?,1668569717
Are Wallets Entering the 'Browser Wars' Era? - Ep 75,1668532788
An AI-powered economy for low-liquidity commerce on Solana brought to you by NeoSwap,1668600913
AIRDROP SAFETY/SECURITY MEASURES,1668162967
Inflation,1668449520
"cult dao the future of defi. read the manifesto.. scan the below qr code t mo get the manifesto. In the world full of CEFI scams, this will power the future of crypto with its true decentralization. it is still under 25 MC Market cap and this is like buyijg bitcoin at 1$.. dont miss the chance.",1668230720
Is it good time to get avg. down or need to wait more? My avg. $103. I know we are not talking about price things here but I just need ideas.,1668314913
"CZ is in talks to "" reduce further cascading negative effects of FTX, Binance is forming an industry recovery fund, to help projects who are otherwise strong, but in a liquidity crisis."" Solana fits this description. Anyone from here plan to join and ask about him assisting Solana? Link here.",1668425228
Did anyone else buy in this dip?,1668209410
"UPLOAD NFT OPENSEA , BINANCE BYPASS 2CAPTCHA",1668236814
"Can we move ""Is the price going to do X?"" conversations to a daily thread?",1668438554
WrappedBTC (Sollet),1668259483
"Learn with GameGods. What are Web3 terms? For more updates, download the GameGods app. Link is provided in comment section",1668592662
Would you still have Confidence in the Ecosystem if you are sure of a Project that is building an Insane product that'll change the future of decentralisation Like BlokHost?,1668519269
Epoch 370 end date?,1668272568
Solana Name Service / Ledger Nano X,1668294162
Is there an airdrop for open serum?,1668621347
THOSE WHO KEEP GRINDING AND LEARNING.,1668599983
What is GameGods NFT ?Register on GameGods to get more updates. Link is provided in comment section,1668427831
Blockchain theoretical use vs current world applications,1668584160
I haven't received my staking rewards for staking on ledger...should I deactivate the staking??,1668125490
How it feels to trade #crypto when #FTX went jnsolvent. #SBF #viral #lol,1668370309
Get funds out of FTX US as well if you haven't,1668141474
Is Solana blockchain centralized?,1668196761
Hmm...,1668238103
I Wonder who Made Money on the FTX Trades,1668121163
Why does r/CryptoCurrency hates on SOL so much ?,1668186811
Official Solana Ecosystem updates page regarding the ongoing FTX situation,1668405037
"WHAT WOULD YOU BUY WITH $10,000 RN?",1668162507
Anyone else super excited to be accumulating at these levels?,1668127112
Millions of $$$ are getting drained out of FTX delete the app immediately,1668228834
Solana,1668142494
﻿Wokz Exchange - Decentralized Exchange Powered by Zero-Knowledge Technology - Smart Staking Featured - Utility in place - Verified Contract.,1668367014
Is SOL staking still worth it?,1668569503
NFT Ecosystem Visualizer,1668571599
"FTT token still selling for over $8.50 on some DEX , any way to make money with this?",1668665548
Step Data Insights: GenesysGo Ecosystem Overview,1668192472
Jak znaleźć NFT na Binance NFT Marketplace?,1668593200
You can still withdraw Sol from FTX US. They just filed for Bankruptcy,1668180801
Hubble / Kamino Town Hall kicking off now 🎙️,1668611093
FLASHLOAN ATTACK HOW TO EARN BNB BSC USING Flash loan ARBITRAGE,1668242999
CZ hand in solana,1668360462
Solana,1668398433
🗼🗼Solana Target Price : 32 $ 🚀🚀🚀,1668237141
Take a look at top 5 P2E games of this week. Register on GameGods to get more updates. Link is provided in comment section,1668421049
Solana based DeFi yield platform Texture has raised $5 million in a round co-led by P2P Capital and Sino Global. Their private beta is now live.,1668453634
SOLANA IS AMAZING,1668482140
Solana based DeFi yield platform Texture has raised $5 million in a round co-led by P2P Capital and Sino Global. Their private beta is now live.Solana based DeFi yield platform Texture has raised $5 million in a round co-led by P2P Capital and Sino Global. Their private beta is now live.,1668453581
BreakPoint Recap &amp; Major News Released During The Event,1668252567
'The King is dead': Inside the fall of FTX,1668347898
'Unable to send' NFT from Phantom wallet,1668498529
"Hey, i have trust wallet, and got 400$ worth of solana, its going down, can i buy more for future profit? I dont know anything about crypto sorry.",1668332677
"so, this the Solana Labs HQ....",1668357190
Crypto.com defi wallet / staking options,1668216534
Possible trick to get funds out of FTX US right now,1668132157
A billion dollars set to be unlocked in twenty four hours! What does this mean?,1668216438
Bridging wrapped Solana from Polygon to Solana,1668185986
Wine connect,1668376552
Get a reward by raising your feedback!!!,1668497995
What price are you planning to buy at?,1668250126
"Take look at top P2E games. For more updates, download the GameGods app. Link is provided in description",1668585871
Dear Solana Holders!,1668461410
what's this about?,1668127669
WTF Is Going On In Web3? - Mint One 44,1668215228
Buying SolBTC,1668270216
Solana Areas To Add 10 New Web3 Bodily Shops,1668285504
"Cryptocurrency prices today: Check rates of Bitcoin, Ethereum, Dogecoin, Solana",1668581849
﻿Viasyl - Control your crypto investments in one place - Buy With Credit Card - Strong Community &amp; Marketing - Launching Now.,1668416986
FTX impacts vs BTC decline,1668552793
No need to be so worried about Solana,1668287054
﻿Viasyl - Control your crypto investments in one place - Buy With Credit Card - Strong Community &amp; Marketing - Launching Now.,1668416037
"Last week was a horrible one for the whole Solana ecosystem and lending has been impacted quite significantly by the FTX drama as well. Nevertheless, keep calm and never stop buidling.",1668440693
DeFi yield platform Texture has raised 5 million USD in a round co-led by P2P Capital and Sino Global. Their private beta is now live.,1668453447
Can someone explain this bandwidth/latency comment by Elon?,1668456988
The Crypto King is dead. Long live the King!,1668128851
Concerned Low YouTube Views From Breakpoint,1668466169
"Don't get discouraged. As a Sol fan, you should celebrate the fall of FTX. Let us explain",1668454758
Star Atlas Impact From FTX:,1668217021
SOL Staking in Binance,1668222150
Excited to share we’ve added nearly 300 NFTs from some incredible projects in the Solana community to the Phantom Vault.,1668477817
Is raydium alive?,1668131194
iM jUsT goNnA wAiT uNTiL $SOL hiTS $2,1668412999
"""Free-to-mint NFT collection from luxury carmaker Porsche sees flurry of interest, despite crypto market chaos."" ""The adoption of NFTs is an unstoppable force"" - Bloomberg",1668530918
"After what happened to FTX, What exchanges would you rather stay away from",1668535927
Weekly Summary | November 4 - November 11 - 2022,1668184766
Wokz Exchange - Decentralized Exchange Powered by Zero-Knowledge Technology - Smart Staking Featured - Utility in place - Verified Contract.,1668349219
Solana developers at FTXs office compound,1668288018
Solana has established itself as the most adaptable and scalable solution for the growth of NFT markets.🙌 Let's see why is the Solana Blockchain Suitable for NFT Marketplace Development.👇,1668444827
Don’t worry - ETH dumped in past also around 90%. Give time to recover! Buy the Dip 😄,1668334652
FNG,1668565076
What do you do with your SOL?,1668197567
Did you know?,1668156124
Can't Withdraw from Tulip Garden,1668234782
"After FTX, is this the next kingpin to fall?",1668437941
TESTNET AIRDROP UPDATE,1668611149
Bali Fintech CZ-Binance,1668363527
"So what’s happening with the Solana testnet. It seems operational, but each time I try to send tokens it won’t send.",1668180383
""" IN SOLANA WE TRUST"" Time to support True Builders in Solana Ecosystem! Please support us as we keep on building in this cold bear run! #KeepBuilding",1668500625
115 SOL coins for $76,1668440863
Do NOT access anything from FTX,1668233355
Buy or wait for a bigger dip?,1668437633
is still solana good investment in long term?,1668136436
My thought on Solana's future,1668463842
Solana Discloses Losses From FTX Collapse - The Defiant,1668518959
And he wants to donate it all to charity! Charity being the Democratic Party.,1668530570
How safe is Staking?,1668601772
Best Place to stake sol after recent events,1668541422
Are you still optimistic about the future of Decentralisation?,1668519247
let gooo we are the best,1668432916
"Hot Take: “The Cove” is a better Solana podcast, than “The Solana Podcast”…",1668471725
Solana NFT Marketplace for the Community,1668242649
"Solana Ecosystem Updates – November 12, 2022",1668367196
Crypto For the homeless - 11-11-2022 - How Crypto enabled us to feed over 6000 homeless internationally,1668191549
Wokz Exchange - Decentralized Exchange Powered by Zero-Knowledge Technology - Smart Staking Featured - Utility in place - Verified Contract.,1668351283
"What Utility would you expect from a project you have high hopes for, and how to you build trust for their execution Plan, especially decentralised web hosting servers like BlokHost?",1668519059
Looks like we’re back to moon 🚀🚀🚀,1668133404
is it a good time to buy solana ?,1668169855
what are your expectations for the price of RAY in the next bull run?,1668226976
Solana based DeFi yield platform Texture has raised $5 million in a round co-led by P2P Capital and Sino Global. Their private beta is now live.,1668452886
is there an offline wallet that you can also stake SOL?,1668606511
Perspective of what it was like to be under SBF,1668428672
"I just noticed Google Cloud partnered with Aptos. Is that concerning for Solana, or will Google Cloud still keep the partnership with Solana?",1668198583
SOL fam WHERE YALL AT ?,1668660573
Monitor dapp execution - early adopters web3,1668444926
Another 12m unlock coming up tomorrow,1668581923
Solana DEV Interview,1668162831
"Is Solana still growing in popularity? If not, who is similar?",1668209840
What going on with media network price??,1668356091
"On Coinbase, it shows a buy rate of 92.5% for Solana, and that’s really great. Positivity is needed in these trying days.",1668402923
The wait is over now!! GameGods app is finally out on Play store. Link is provided in comment section.,1668580619
"The First Continuous Payments Protocol on Solana, Zebec Protocol has Finally Completed Bridging to the BNB Chain.",1668606796
﻿Viasyl - Control your crypto investments in one place - Buy With Credit Card - Strong Community &amp; Marketing - Launching Now.,1668408971
Crypto Lottery,1668359493
"""Peoples coins will be suddenly unlocked in two days instead of today""",1668185595
"Thought experiment on Solana ""decentralization""",1668277383
What’s happened to the current TPS?,1668373479
“They seem to be moving everything”. FTX fully hacked. All funds being drained. SOL full dump likely impending,1668229904
Is Solana a good investment?,1668142957
"I’m a sea of red, SOL is hanging on 🙌🏻🙌🏻🙌🏻",1668626422
Multicoin Capital letter to LPs regarding FTX; Lots of SOLANA Information.,1668135013
Unidouble: Amazon on Solana !,1668248937
SOL to the moon ?,1668665294
let me sell my coins NOW!,1668126973
Looking for Best Settup for staking $Sol then min-maxing lending protocols to help with validation and get highest % return,1668261253
eToro,1668122199
My favorite project on Solana,1668361795
Help with depreciated Bonfida,1668166330
Hey how do I stake my Solana coins and is it smart to stake now?,1668297546
Question,1668179250
Crypto regulations scam ?!!,1668325570
can't withdraw stSol from Tulip.garden lending?,1668628771
"New, crankless CLOB called Phoenix announced by Ellipsis Labs",1668446336
Did someone said Solana to the moon? 🗽,1668636118
﻿Viasyl - Control your crypto investments in one place - Buy With Credit Card - Strong Community &amp; Marketing - Launching Now.,1668416640
Star Atlas Impacted by FTX Insolvency:,1668216730
Phantom rewards,1668535037
Why Sol is falling today? Any new FUD?,1668328164
"UPLOAD NFT OPENSEA , BINANCE BYPASS 2CAPTCHA",1668366099
Solana based DeFi yield platform Texture has raised $5 million in a round co-led by P2P Capital and Sino Global. Their private beta is now live.,1668453128
Why is the price of wrapped ETH differ so much from ETH?,1668367684
HOW TO CLAIM YOUR SNS1 AIRDROP?,1668610372
The reason why I invest in Solana,1668498738
Solana in FTX,1668482416
Why do people think cheap fees and fast network is a strength of Solana?,1668546722
One day left! Gucci Grip Prize Pool starts in next 31 hours! / Rewards on Solana USDC,1668204326
"RIP Solana, litecoin now has a higher market cap. Another titan falling.",1668996710
How does staking APR work?,1668828934
Solana ranked #1 based on GitHub commit activity,1668868692
Adidas NFT public/free Ethereum mint now live. 1000 NFTs for the first 1000 people.,1668886259
Arrogant price prediction for Solana and brief explanation,1669001670
Porsche NFT public/free Ethereum mint now live. 1000 NFTs for the first 1000 people.,1669047718
It's time to start moderating the FUD.,1668968968
Solana USDT deposits have resumed on Binance,1668900877
🚨 OKX to delist Solana? | Manage SOL and tokens on Solana on Guarda Wallet,1668787921
How many of you are still buying and Bullish about Solana?,1668888488
Anyone else having trouble using devnet?,1668801507
"What’s the deal with Serum? My project currently uses the serum-swap-ui react component, is this still a viable option for users to perform swaps on?",1668982588
What's your favorite RPC?,1669240849
Introducing Compendex - A Solana Smart Swap UI.,1669150486
We made a NFT collection to help projects recover from the FTX collapse.,1669057563
Your being robbed,1668939430
Solana current Nakamoto coefficient is actually 2. This needs to improve.,1668728739
Everstake is rolling out extrnode’s open-source load balancer for Solana public RPC nodes.,1668715328
.. 4 hours left,1668992404
﻿CentroFi - The One-Stop Venue To Earn - Decentralisation At Your Fingertips - A Hodler's World - Launching Now - Verified Contract - Strong Community &amp; Marketing.,1669042343
Can someone login to sollet.io? It does not load and shows this loading inage,1668814326
So many things died,1668814679
What platform do you use to find info/news about Solana and interact with the community?,1669013563
Sign up for the Genomic Dao $45 Airdrop reward https://genomicdao.com?ref=TLDBICMO,1668765246
#bitcoin #solana,1669023727
Sol to the moon soon,1668907780
Which Solana Project do you think is creating a non-conventional solution to web2 shortcomings?,1669191579
Great project,1668873632
﻿Nyan Heroes - The future of battle royale rests in the paws of cats piloting robotic mechs - Embark on missions and collect Nyan Heroes Token - Launching Now - Verified Contract.,1669110271
Solana Core (BuildSpace) - Become A Solana Builder In Six Weeks,1668705735
News: Tether says it's moving 1 billion USDT from Solana to Ethereum,1668818718
1 SOL = 1 SOL 🗽,1668811027
Soccer superstar Cristiano Ronaldo's exclusive Digital Art collection launches in partnership with Binance; Minting is now live.,1668778679
First hunt coming soon,1668939462
Let's Make The Koinly Tax Report integration happen ( NFTS and swaps ),1669125316
QuickNode #Nodevember event at @Solana Embassy in Wynwood,1669050486
Hackers Laundering Hundreds Of Millions They Stole From The FTX,1669072023
﻿Toon Finance - Space Battle Grounds - Delicious Handmade Sweets - Verified Contract - Smart Staking Featured - Buy With Credit Card - Launching Now,1668865908
﻿Nyan Heroes - The future of battle royale rests in the paws of cats piloting robotic mechs - Embark on missions and collect Nyan Heroes Token - Launching Now - Verified Contract.,1669108614
Glow Wallet - Now optimized for iPadOS,1669185009
How did FTX actually support Solana?,1669207972
"So far, has everyone been able to deposit USDT and USDC through exchanges?",1668753736
Longterm - FTX no longer hanging over solana will be a good thing.,1668791145
Sika,1668880349
Soccer superstar Cristiano Ronaldo's exclusive NFT collection launches in partnership with Binance; Minting is now live.,1668710743
The FTX examiner was a company based in the metaverse.,1669191429
"Don't wait again, come join Solcial",1668689190
Decentralisation: Huge Validators vs. Huge Holders,1668687981
You deserved it,1668929813
﻿Toon Finance - Space Battle Grounds - Delicious Handmade Sweets - Verified Contract - Smart Staking Featured - Buy With Credit Card - Launching Now,1668847224
QuickNode #Nodevember event at @Solana Embassy in Wynwood,1669059830
"Let’s see where this goes 🚀🤞17,400 SOL @$13.5",1668953551
Things to be optimistic about regarding Solana's network performance + healing the network's perception faster,1668967721
Where we can get best buy zone for sol,1669145196
Why pretending and acting like all what happened in the crypto market affected only Solana ?,1669052122
"﻿NFT Art - Join the New Era of Music &amp; Art - Turn your music, art and ideas into NFTs! - Our unique NFT platform empowers creators with accessible &amp; safe tools - Launching Now.",1668761180
﻿CentroFi - The One-Stop Venue To Earn - Decentralisation At Your Fingertips - A Hodler's World - Launching Now - Verified Contract - Strong Community &amp; Marketing.,1669034162
Becoming a Blockchain Developer in Solana Community,1668681716
Does FTX/Alameda has still SOL? Or do they sold it already?,1668702788
Solana Core (BuildSpace) - Become A Solana Builder In Six Weeks,1668703888
How i recover deposited/sent USDC from Solana (SOL) network?,1669144172
How to switch staking validators?,1669182131
BUYING SOME NFTS TONIGHT,1668981638
﻿CentroFi - The One-Stop Venue To Earn - Decentralisation At Your Fingertips - A Hodler's World - Launching Now - Verified Contract - Strong Community &amp; Marketing.,1669026007
Just bought another 50 SOLS. Fingers crossed.,1669059897
Mega Black-Friday deal from Bit-Refill : 50% off $100 Amazon Gift-Cards when paying with Ethereum Web 3.0,1669145804
Crypto Winter? Star Atlas is 90 minutes away from listing a million dollar Titan spaceship for sale 🔥🔥🔥,1669217439
easiest way to get Paginated Transactions on Solana,1669198828
"With the OKX delisting, Binance taking off support of USDC, and Tether coin swapping, when do we expect daily volume to go back up? It has taken a big hit.",1668817441
Sharing my Google Sheets work template of Crypto/Forex/Stock Trading Journal &amp; Strategy Analysis for Backtesting &amp; Live Trading,1669186342
Shadow Protocol : The project providing RPC infra to Solana,1668811701
Coming months will be huge for Solana,1668775066
"Everybody in their mother calling solana the VC coin like vcs aren’t invested in BTC and ETH , the injustice at its finest, KEEP STACKING SOL",1669228662
Will regulations be made and SOLANA made an example of?,1668885459
Developer question,1668877694
"Haven’t received my sol after an ignored offer I made in OpenSea, does it take time to get back into my wallet?",1669241244
Anyone had trouble unstaking from Socean?,1668882535
Solana $40 eoy 😏,1669238988
