Headlines,Time
"Does it seem that Solana gets the most negativity, or is it just crypto in general? I’m still hodling, but it’s tough with all the negativity.",1668706291
"Why is Sollet website not working, not showing my holdings, and how to fix it?",1668783682
Let’s see where this goes 🚀,1668953001
Updating the metadata of a fungible token on the Solana Blockchain,1668889176
Is this the bottom??,1669231212
My fears for Solana.,1668791566
RPC Issue during Reveal,1669147598
Guide to make membership-based NFT dApp on Solana in a day,1669164593
"Did anyone else try to stand in front of this train? Ouch, that hurt and I learned my lesson.",1669239453
SOL nft market,1668815160
OKY stopped accepting deposits or whitdrawals,1668922716
Best cold-wallet?,1668886745
Solana Loses $1 Billion in USDT to Ethereum in Tether Chain Swap,1668930238
What are NFT player card? Get more updates on GameGods app. Download now.,1668770047
"so, this the Solana labs HQ....",1668953064
🚨 OKX to delist Solana? | Manage SOL and tokens on Solana on Guarda Wallet,1668781150
Vyper Protocol: The Solana Protocol disrupting the on-chain derivatives market,1668987216
this sub,1668884410
"Solanas's Largest NFT Provider, ""Parting Way"" with Staff",1668800645
Let’s compare: 2022 Solana to 2018 Ethereum,1668965328
You got a super cool SOL NFT for the SOL Fam let me know your thoughts ? https://twitter.com/greedyghostnft/status/1593361342748041218?s=46&amp;t=r9rt0piOAAx0kPM8_21qqw,1668741313
How much Sol to have it matter?,1668874011
phantom wallet from Apple APP store. Is it legid or fraud? Only 500 review.,1668868650
Should I consider taking a loss ? 😑😭😢,1668842811
"Build your own in-app Marketplace, no need to give 2% Tx Fee to Magic Eden/Fractal",1669164370
How many of you are hosting your own validators?,1668888093
"﻿NFT Art - Join the New Era of Music &amp; Art - Turn your music, art and ideas into NFTs! - Our unique NFT platform empowers creators with accessible &amp; safe tools - Launching Now.",1668786423
Weekly Summary | November 11 - November 18 - 2022,1668792472
Whales accumulating SOL👌,1668896013
﻿CentroFi - The One-Stop Venue To Earn - Decentralisation At Your Fingertips - A Hodler's World - Launching Now - Verified Contract - Strong Community &amp; Marketing.,1669028326
USDC on Solana,1668912715
My concerns with Solana.,1668708042
"hi everyone, I converted everything to solana, On CB says 1.10% APY earn, do you know for this amount how much Solana I recive a month? thanks",1669071511
WAGMI,1668751967
Snapshot: State of the Network,1668729920
Solana Staking in Coinbase APY,1668710056
"NFT collection with market value, link in comments",1668701222
Mainly just wanted to put this on record but Solana is going right back to prices before the FTX incident.,1669190118
Off ramp with real time payouts directly in your solana dApp :) easy KYC and bank connection via Plaid,1669197363
The Slow “Rug Pull” of Solana Ecosystem Projects,1668767741
Spin up your own RPC node quick and easy in less than 15min,1669128196
Solana Loses 70% TVL As The FTX Contagion Spreads,1668880724
A slow inevitable death.,1668803167
Diamonds are forever...,1668979323
"2-5 years from today,those who had the fortitude would look back and say,F**k i should have bought mpre..or not?",1668746858
"Have you tried to create your personal website in the past? How was the experience, and did you achieve completion?",1669192625
Why do people think sols over .. hasn’t it only launched like 3 years ago ?? Plenty of time to recover and build,1669203871
Adidas NFT public/free Ethereum mint now live. 1000 NFTs for the first 1000 people.,1668863814
Coinbase Accepts Solana USDC According To Austin Federa !,1668694690
I made an app that visualizes flow of crypto on ethereum. Should I implement this for Solana?,1668714294
Algorand had congestion issues despite only handling 16 tps. No one in R/CC posted anything about it. Looks like it confirms my theory that R/CC is heavily being brigaded by ALGO shills.,1668821575
Understanding Solana genesis block,1669013673
"QuickNode #nodevember free event at the Solana Embassy in Wynwood, Miami",1669048755
My fears about Solana.,1668802120
"Plan to buy 1 Sol every day, starting today.",1668850713
Ethereum Layer2 fee vs solana fee?,1668949764
what's the best metaverse project on Solana?,1669097330
"We Decide to Open Our Authentication, Wallet, Marketplaces/Storefronts SDK for Free for Solana Developers. Let's Make it Trough This Hard Time Together",1668668426
Soooo has anyone else seen Coinbase is only giving 1.10%apy back now? Any reasoning behind this? Are more people staking now?,1668964973
Give me a REAL REASON to keep SOLANA... Is it dead or no?,1668906913
are they rebuilding serum? Found this retweeted by the official project serum. I’m thinking of whether to just dump the rest of my $SRM holdings or wait for it to revive ?,1668676995
[FUD] Where will Solana be in 2025?,1668925094
Solana Endures 'Crucible' as FTX Connection Deletes 70% of TVL - The Defiant,1668786434
WHAT ARE YOUR TOP 3 NFTs PROJECT AND WHY?,1668719845
What can be the best marketing strategy for a metaverse and NFT-based product company on the Solana blockchain in this bear market? Open to creative discussions! 👇,1669111196
Best/safest bridge to transfer USDC from Solana to Ethereum?,1668711344
"Ethereum Massively Multiplayer game by Brights tarStudios begins open play, rewa rding land parcel to early players -Coindesk",1669227308
"Hey guys! Just saw an amazing review of Solana’s tech, ecosystem, and recent exposure to the FTX/Alameda bankruptcy. Definitely a must-see and please subscribe for more updates on the project! 🚀",1668706524
It’s a sign - I’m vacationing in the Philippines,1669091419
"My stake is in activating status for 12 hours, is that normal?",1669207287
"Here are some steps about how to sign up on GameGods. For more updates, download the GameGods app now",1668669333
A day ago everyone was worried about Solana now everyone forgot it and worried about Ethereum because hacker dumping ETH 🤣,1668983523
﻿Nyan Heroes - The future of battle royale rests in the paws of cats piloting robotic mechs - Embark on missions and collect Nyan Heroes Token - Launching Now - Verified Contract.,1669106583
"We developed an SDK for Solana Auth, and here are some APIs you can call right now for free",1669162948
Adidas NFT public/free Ethereum mint now live. 1000 NFTs for the first 1000 people.,1668825418
Ripple is buying FTX assets,1668919869
Delisting of USDC-Solana and USDT-Solana token networks – OKX,1668689525
My concerns about Solana.,1668707965
Future of SOLANA,1668959314
#bitcoin #solana,1669023843
"Hi, I’m implementing swap tokens with platform fees in flutter, does anyone has Solana swap tokens with platform fees tutorials?",1668767529
Check out Phantom's Twitter contest and let us know what projects deserve some extra love and support for their contributions to the greater Solana ecosystem!,1669061272
"I created a Tic-Tac-Toe Solana Program, I would love to hear feedback about my code",1668789596
Stablecoin vaults just re-opened for deposits on Kamino Finance!,1669239257
Magic Eden integrating with Polygon to grow gaming,1669139473
Porsche NFT public/free Ethereum mint now live. 1000 NFTs for the first 1000 people.,1668898609
What are some things you would like to see developed on Solana?,1668978136
Solana Invoicing and Payroll Product (YC),1669226060
Ethereum vs Solana - who is developing more in the bear market?,1669061785
Recent positives around Solana's network performance and things that I'm looking forward to :),1668968190
Hard working team with low floor price? Drop them below and explain me why ⚒️,1669213064
The Best in GameFi: 6 Exciting Web3 Games in Development on Solana | HackerNoon,1668702327
My fears about Solana.,1668950359
What's the price prediction for Solana in 2024?,1669223203
Using smart contracts with cli tools,1668891048
Opportunity,1669120151
Deposits of USDC-SPL (SOL) Token Resumed | Binance Support,1669207146
hello guys! How are you after last week?,1668673190
Is this website a scam?,1668789545
"Does the Solana project see the most negativity or is that just crypto in general? I’m hodling, but it’s tough with all the negative voices.",1668706005
coinbase... logged in and SOL presented its interest % as 1.77 or something instead of 4%... logged out and showed 4%.,1668720845
Is the coin dying or is it still worth holding?,1669170989
How to buy Aptos (APT) Guide – Binance,1668942382
My fears about Solana.,1668949413
Crypto,1669048552
"so, this is the Solana labs HQ...",1668865349
New solana project: Elite Emperors,1668941042
Bitcoin Billionaires 10K Raffle!,1669156600
﻿CentroFi - The One-Stop Venue To Earn - Decentralisation At Your Fingertips - A Hodler's World - Launching Now - Verified Contract - Strong Community &amp; Marketing.,1669021400
"Solana, flashy and sleek, was just a pump and dump",1669034821
What happened to MaticPo on Solana?,1668866611
first 100 wallets to transact with winG6JqMQUgJLjkgDdEXHSc93CmyeAZL8T1iP5QTcnX will get airdropped in 30 minutes🍀,1668985327
"If you compare Sol with other coins or tokens, then it is not rational to blame Solana",1669002199
how are you adding to the transactional use case for Solana?,1668714883
Porsche NFT public/free Ethereum mint now live. 1000 NFTs for the first 1000 people.,1668965165
Coinbase Wallet to Phantom,1669122785
Should I wait to buy more?,1668979523
Just Bought Solana,1668938978
Will Solana (SOL) Become the Next EOS and Fade into Irrelevance? Let's Compare and Find Out!,1669233779
I am an idiot.,1669218057
Selling of FTX allocation,1669030961
some funds stuck,1668788576
Follow up on staking,1668847368
"What do you think of this ? Will the chain be able to sustain itself after so much money has been pulled out of the ecosystem? I'm genuinely asking because I don't have much exposure to the Solana ecosystem. Also, looking at all those comments makes me sick. Tribalism is really an understatement.",1668891528
„FTX CEO asked OKX for +$2 billion before contacting Binance - then he called back hours later and asked for even more“,1669027874
Kamino Finance Stable Vaults are live again 🧑‍🌾,1669232694
Step Data Insights: Alameda's On-Chain DeFi Activity,1669046237
We need you!,1669212452
Kamino Retro is now live,1669219840
My fears about Solana.,1668949854
I am new here and think of going big on solana -- Advice,1669058147
FifaCup.Win - Secure betting on your favourite FIFA WC 22 Team - Presale On PinkSale 17TH NOV 14:00- 3 Hours Left - Live Match Streaming- BlockSafu Audit,1668684965
"Jet experienced soBTC price oracle exploit, Solend repaid its bad debt, MNGO token price increased by 50%. More news and stats in this Solana Lending Weekly👇",1669036708
Decentralized Finance: Uncontrolled Non-bank System?,1669199144
Star Atlas is listing titan ships today 🔥🔥🔥,1669221076
am I an idiot?,1669173110
﻿CentroFi - The One-Stop Venue To Earn - Decentralisation At Your Fingertips - A Hodler's World - Launching Now - Verified Contract - Strong Community &amp; Marketing.,1669019452
We need you!,1669166899
"Am I scammed by Gate.io? Seeking assistance to recover $10000 deposit. Support not engaging, ignoring tickets for almost 24 hours, providing fake reasons.",1668769024
"⚡️ Defi Newsletter: Deep dives, yield opps, yield farming strategies + more!",1668814950
My fears about Solana.,1668791703
Disappointed in the Trust Wallet TWT airdrop / new browser extension. Why only Ethereum network asset eligible for rewards not bsc?,1668794311
"[Coinbureau] Solana Update: FTX, Alameda &amp; Impacts on SOL!",1668702255
We are the first ever &amp; leading NFT Chatters service.,1669186552
"Come join Solcial, while we wait for the bull season",1668930404
Cannot swap veLFTNY to xLFTNY in Lifinity,1669041342
MBD-NFT 🚀🌙,1668749427
"FYI, 51% attacks on Solana don't exist.",1668697392
Stable coin only exchanges,1668787922
People called Solana a VC coin because it was backed by SBF. Now SBF is gone (SOLs are frozen for many years because of Chapter11) and people are still complaining. 🤣,1668866813
Fun things to do with Solana?,1668766939
Guys is online tool Solanamix legit? 👾Its for anonymous txs,1668810578
Best method for SOL multi-sig wallet and easy off ramp to fiat?,1669124413
The Solananator returns from the year 2050 to hunt Vitalik Buterin,1669223879
Updating the metadata of a fungible token on the Solana Blockchain,1669232872
"What are Web3 terms? Learn with GameGods. For more updates, download the app now",1668765176
Solana Cactus,1668881256
Question on stake pools,1669048639
How to deploy an RPC Node,1669121862
$SOL is pumping,1669243486
A new platform using solana.,1668796456
"In the midst of chaos, there is also opportunity. $12 🚀🫡",1669057529
Withdrawal,1668886371
Binance.US sol deposit disable anybody know why???,1669144631
What is Staking? Learn the web3 elements on GameGods. Download the app now,1668756026
Solana on Cronos network,1669044488
Is there any way to see approved/active Smart Contracts approval on Solana?,1668979505
﻿CentroFi - The One-Stop Venue To Earn - Decentralisation At Your Fingertips - A Hodler's World - Launching Now - Verified Contract - Strong Community &amp; Marketing.,1669017797
"Some perspective. In 2018, Cardano dominance dropped from 3.26% to 0.5%. These are almost identical drops to the Solana dominance.",1668989545
You’ve got to take risks!!. 250k @$13.5,1668863196
Coinbase Cloud Has Been Supporting Solana Since Their Earliest Testnets,1668699328
