neg,neu,pos,compound,headline,time,label
0.0,1.0,0.0,0.0,"Justin Sun the ""core investor"" in $1 billion Huobi buyout, aided by FTX's SBF : Report",1665412946,0
0.0,1.0,0.0,0.0,SBF Announces FTX v2 Crypto Exchange To Launch Near Thanksgiving 2022,1665398861,0
0.0,0.758,0.242,0.4939,"Sam Bankman-Fried AKA ""Crypto Jesus"" has stepped in to save Crypto.com",1665428064,1
0.0,1.0,0.0,0.0,FTX rolling out V2 of the exchange with new matching engine in November,1665424237,0
0.0,0.813,0.187,0.3182,"FTX, Visa Will Expand Crypto Debit Card Service to 40 Countries",1665454314,1
0.257,0.743,0.0,-0.4215,Bitcoin Is on Same Bumpy Ride as Stocks. Where Prices May Stop Falling.,1665482305,-1
0.0,1.0,0.0,0.0,FTX Partners With Visa To Release Crypto Debit Cards Across 40 Countries.,1665505360,0
0.0,0.615,0.385,0.3612,FTX now supports Algorand USDC.,1665612819,1
0.0,1.0,0.0,0.0,https://blockchain.news/news/ftx-ceo-says-his-brand-is-%22totally-on-board-with-regulation%22,1665653627,0
0.0,1.0,0.0,0.0,"FTX CEO Says His Brand is ""Totally on Board With Regulation""",1665653679,0
0.184,0.816,0.0,-0.4019,Sam Bankman-Fried on the Mango Markets Hack: ‘Make Up Your Own Damn Mind’,1665641570,-1
0.0,0.611,0.389,0.6249,Samsung announces 'private blockchain' security sytem for its smart devices,1665663447,1
0.246,0.672,0.082,-0.4939,"Someone abused FTX’s withdrawal fee subsidy to mint $70,000 of XEN",1665677017,-1
0.0,1.0,0.0,0.0,SBF FTX Announced As Speaker At Algorand Decipher Conference,1665687941,0
0.0,1.0,0.0,0.0,Sam Bankman - Fried is in TOP10 federal-level donors for this cycle elections.,1665680458,0
0.0,0.769,0.231,0.34,Samsung uses blockchain-based security for devices in its network,1665670346,1
0.0,1.0,0.0,0.0,"FTX buys 30% of Scaramucci’s firm, then adds Algo USDC, now the CEO is speaking at Decipher. If you’re not bullish on Algorand, you’re not paying attention.",1665701108,0
0.0,0.556,0.444,0.5859,Samsung Turns To Blockchain-Based Security To Secure Devices,1665742137,1
0.0,0.97,0.03,0.128,"Algorand TVL just hit a new All-Time High. It is one of the only ecosystems who's TVL is going up during this bear market. FTX just added USDC-Algorand, FIFA Marketplace just launched, DeFi ecosystem is booming. 6000 TPS, &lt;4s finality. If you're not bullish on Algorand, you're not paying attention.",1665702358,1
0.0,0.968,0.032,0.128,"Algorand TVL just hit a new All-Time High. It is one of the only ecosystems who's TVL is going up during this bear market. FTX just added USDC-Algorand, FIFA Marketplace just launched, DeFi ecosystem is booming. 6000 TPS, &lt;4s Finality, Quantum Resistant Falcon keys, State Proofs, .0003$ fees.",1665702865,1
0.0,1.0,0.0,0.0,How to withdraw LINK to Ethereum address from FTX US?,1665766811,0
0.0,1.0,0.0,0.0,FTX’s SBF Is Abstaining From Any Further Political Spending,1665779008,0
0.107,0.893,0.0,-0.0516,FTX CEO backs knowledge test for trading wide range of derivatives,1665879706,-1
0.0,1.0,0.0,0.0,FTX Token (FTT) And Avalanche (AVAX) Investors Are Rushing To Buy Flasko (FLSK) Presale,1666014280,0
0.145,0.855,0.0,-0.296,Crypto Billionaire Sam Bankman-Fried No Longer Looking to Spend $1 Billion on Political Donations,1666011376,-1
0.145,0.855,0.0,-0.296,Crypto Billionaire Sam Bankman-Fried No Longer Looking to Spend $1 Billion on Political Donations,1666011359,-1
0.145,0.855,0.0,-0.296,Crypto Billionaire Sam Bankman-Fried No Longer Looking to Spend $1 Billion on Political Donations,1666011679,-1
0.0,0.784,0.216,0.296,Securities Regulator launches Investigation into FTX and its CEO,1666021746,1
0.0,0.761,0.239,0.296,"FTX, Sam Bankman-Fried Probed by Texas Securities Regulator",1666026251,1
0.0,1.0,0.0,0.0,Voyager Sale to FTX Hits a Snag,1666033273,0
0.218,0.641,0.141,-0.296,"FTX, Sam Bankman-Fried Under Investigation by Texas Regulators Over Potential Securities Violations",1666022728,-1
0.0,1.0,0.0,0.0,"FTX, a16z-Backed Aptos Blockchain Off to a Rocky Start",1666086052,0
0.333,0.667,0.0,-0.5423,FTX-backed Aptos blockchain under fire for low scalability on launch day,1666087973,-1
0.0,1.0,0.0,0.0,"FTX, a16z-Backed Aptos Blockchain Off to a Rocky Start",1666102410,0
0.0,1.0,0.0,0.0,Polymath Delist by SWYFTX,1666087412,0
0.0,1.0,0.0,0.0,"FTX US, Sam Bankman-Fried Are Subject of Probe",1666101389,0
0.0,1.0,0.0,0.0,"FTX, a16z-Backed Aptos Blockchain Off to a Rocky Start",1666070617,0
0.0,1.0,0.0,0.0,What do y’all think of FTX and staking on there?,1666115719,0
0.233,0.616,0.151,-0.296,Texas investigates FTX for securities violations after objecting to Voyager auction,1666117008,-1
0.145,0.763,0.092,-0.3182,FTX and its founder SBF actively push for law that could make DeFi and P2P transactions in the Us illegal ❌❌,1666169680,-1
0.0,0.784,0.216,0.5106,"Free Samples First Grade USD, INR , CAD, GBP, EU AUD Available Whats App:+447496694011",1666163403,1
0.0,0.844,0.156,0.34,"FTX US Will Decide What Counts as a Crypto Security, CEO Bankman-Fried Says - BNN Bloomberg",1666220959,1
0.073,0.927,0.0,-0.0258,Crypto Lender Voyager Sends $1.42 Bln FTX Sale to Creditor Vote - Latest Tweet by Reuters,1666234102,-1
0.191,0.809,0.0,-0.3818,"FTX Sends 50,000 Ethereum To Voyagar, FTX Token Witnesses Pump And Dump",1666200660,-1
0.0,0.951,0.049,0.4019,"Check out the speaker list that is going to be at Decipher 2022. FTX, Kraken, Binance, among many other big names. This year it is November 28th to 30th in Dubai and it will be interesting to see the strategies presented and where crypto is going by such big names in the space.",1666231315,1
0.249,0.664,0.087,-0.5994,Crypto Billionaire Sam Bankman-Fried suggests capping the maximum bounty for attackers at $5 million and ensuring victims made whole,1666242888,-1
0.0,1.0,0.0,0.0,Here is what SBF ACTUALLY thinks about crypto regulation,1666218577,0
0.124,0.725,0.15,0.128,Is he a good guy for crypto? Sam Bankman-Fried draws fire from DeFi proponents after regulation proposal.,1666270158,1
0.0,0.706,0.294,0.3612,Sam Bankman-Freid Supports And Proposes Anti-Decentralization Rules,1666270897,1
0.09,0.577,0.333,0.5859,A Good Samaritan on Twitter Voluntarily Saves Cross-Chain Bridge From Huge Potential Exploit,1666281427,1
0.0,1.0,0.0,0.0,Texas Regulators Are Investigating Crypto Exchange FTX...,1666295784,0
0.241,0.759,0.0,-0.3612,"Leaked Draft of US Congress’ ‘DeFi Killer’ Bill Sparks Debate, SBF Backs Bill",1666281755,-1
0.118,0.683,0.199,0.3818,Sam Bankman-Fried says “the clearest way to help protect investors is to provide transparency and prevent scams.” While he has been dumping on retail for time. Ironic.,1666333591,1
0.091,0.909,0.0,-0.4404,Actual Unpopular Opinion (but is factual): SBF is a humble billionaire and right now everyone hates him because of rumors on twitter. This thread is the other side of the coin.,1666339729,-1
0.0,1.0,0.0,0.0,A Response to SBF and Principled Crypto Regulation,1666336301,0
0.267,0.733,0.0,-0.4588,BitBoy Crypto Calls FTX And Coinbase CEOs “Devils” In His Aggressive YouTube Rant,1666386878,-1
0.0,0.813,0.187,0.4404,"FTX Will Delist Crypto Assets in the US That It Deems Might Be Securities, According to CEO Sam Bankman-Fried",1666383928,1
0.18,0.82,0.0,-0.5106,Alchemix founder and other DeFi proponents call out FTX’s Sam Bankman-Fried after his damaging regulation proposal,1666370934,-1
0.086,0.82,0.094,0.0516,"The CEOs of FTX and Coinbase, Sam Bankman-Fried and Ben Armstrong, respectively, have been accused by crypto influencer Ben Armstrong, also known as",1666433117,1
0.0,0.803,0.197,0.4019,FTX Founder Sam Bankman-Fried Shaves Head In Support of Canadian Truckers' Convoy,1666437212,1
0.202,0.798,0.0,-0.5106,"Hacker Steals $300K From Olympus DAO, Then Returns It All the Same Day - Decrypt",1666393677,-1
0.423,0.423,0.155,-0.5859,Scam Alert: FTX User Lost $1.26M Through 3Commas API,1666464378,-1
0.071,0.839,0.089,0.1477,"After aggressively farming many of DeFi’s most lucrative opportunities since 2020, SBF is now pushing his own industry standards, many of which go against the entire concept of decentralisation.",1666508403,1
0.187,0.813,0.0,-0.3968,"Wintermute CEO argues Crypto Twitter ""doesn't matter"" as much as ""US regulators, politicians"" in response to SBF discourse",1666544768,-1
0.0,0.662,0.338,0.5574,3Commas issues security alert as FTX deletes API keys following hack,1666529901,1
0.231,0.769,0.0,-0.4588,FTX API keys connected to 3Commas confirmed to have been exploited,1666524244,-1
0.0,0.662,0.338,0.5574,3Commas issues security alert as FTX deletes API keys following hack,1666527464,1
0.0,0.69,0.31,0.7964,"Court Approves Agreement For FTX To Buy Out Voyager For 1.4B, Users Only Paid Back In Crypto If They Join FTX",1666522679,1
0.0,1.0,0.0,0.0,"Sam Bankman-Fried elaborates on DCCPA, but not everyone is buying it",1666539029,0
0.225,0.438,0.338,0.2023,FTX US Wins Bid to Acquire Bankrupt Lender Voyager's Assets,1666530674,1
0.231,0.769,0.0,-0.4588,FTX API keys connected to 3Commas confirmed to have been exploited,1666519498,-1
0.223,0.777,0.0,-0.3182,FTX to give a ‘one-time’ $6M compensation to phishing victims,1666607016,-1
0.194,0.806,0.0,-0.5574,"Court Kicks Off $1,422,000,000 Deal Between Bankrupt Crypto Lender Voyager and FTX US - The Daily Hodl",1666557470,-1
0.141,0.859,0.0,-0.2023,Sam Bankman-Fried Rows Back on Controversial Crypto Regulation Proposals After Backlash | CoinMarketCap,1666597520,-1
0.0,1.0,0.0,0.0,Crypto Exchange FTX to Provide $6 Million Phishing Compensation,1666566789,0
0.279,0.721,0.0,-0.4767,FTX Chief Announces $6 Million Compensation in Phishing Attack,1666604725,-1
0.0,1.0,0.0,0.0,Crypto Exchange FTX to Provide $6 Million Phishing Compensation - BNN Bloomberg,1666569063,0
0.0,1.0,0.0,0.0,FTX Sam Bankman-Fried hints at Cardano listing,1666612388,0
0.426,0.574,0.0,-0.6369,FTX compensating users who lost $6M to phishing attacks,1666626240,-1
0.0,1.0,0.0,0.0,"Cardano (ADA) Could Soon Be Listed on Crypto Exchange FTX, According to CEO Sam Bankman-Fried.",1666666507,0
0.0,1.0,0.0,0.0,Anybody ever heard of Coin-FTX app that’s part of FTX exchange?,1666649611,0
0.0,1.0,0.0,0.0,FTX’s Sam Bankman-Fried Tries to Backtrack on Crypto Regulatory Framework After Puckback From Crypto Community,1666639049,0
0.0,0.938,0.062,0.2732,"Binance is about to add USDC-Algorand. This comes only a week after FTX added USDCa as well. Algorand transactions are going through the roof, big things coming down the pipeline we aren't aware of?",1666658262,1
0.0,1.0,0.0,0.0,"Cardano (ADA) Could Soon Be Listed on Crypto Exchange FTX, According to CEO Sam Bankman-Fried.",1666667248,0
0.0,1.0,0.0,0.0,FTX CEO Sam Bankman-Fried Makes Prediction for ‘Stablecoin War’ As Binance USD (BUSD) Market Cap Soars - The Daily Hodl,1666637767,0
0.268,0.732,0.0,-0.6597,"ADA Listing on FTX Could Turn into Tragedy, Cardano Founder and BitBoy Discuss",1666694406,-1
0.286,0.714,0.0,-0.34,BitBoy's SBF rant gets a heavy metal remix,1666685683,-1
0.268,0.732,0.0,-0.6597,"ADA Listing on FTX Could Turn into Tragedy, Cardano Founder and BitBoy Discuss",1666693408,-1
0.141,0.859,0.0,-0.3182,"Sam Bankman-Fried Says Crypto Exchange FTX Will Dole Out One-Time $6,000,000 Reimbursement to Phishing Victims",1666717688,-1
0.0,1.0,0.0,0.0,"What would you say to the CEOs of Binance, Coinbase, or FTX if you met them in an elevator?",1666727445,0
0.0,1.0,0.0,0.0,"Cardano (ADA) Could Soon Be Listed on Crypto Exchange FTX, According to CEO Sam Bankman-Fried - The Daily Hodl",1666739778,0
0.091,0.909,0.0,-0.1027,Global Consumer Advocacy Group Warns Regulators of FTX CEO’s Anti-consumer Influence on Upcoming Cryptocurrency Regulations,1666799671,-1
0.09,0.758,0.152,0.3818,"BitBoy releases an unhinged video claiming he is trying to save crypto while the CEOs of FTX and Coinbase are trying to ruin it. In reality, they all care almost exclusively about their bottom lines",1666787123,1
0.0,1.0,0.0,0.0,Opinions on FTX?,1666809117,0
0.113,0.887,0.0,-0.1027,Consumer Group Warns Regulators of FTX CEO’s influence on Upcoming Cryptocurrency Regulations,1666811923,-1
0.0,1.0,0.0,0.0,FTX records largest short liquidation event in its history — $936.24 million,1666813975,0
0.0,1.0,0.0,0.0,Is Samo coin is rising more than 30% due to launch of SamoDao this week?,1666834398,0
0.056,0.648,0.296,0.8779,"The IMF praises the merits of Chinese social credit which could be implemented in the West thanks to CBDCs. IMF and CCP, Same Fight to Create a Society of Mass Surveillance. Bitcoin Is More Necessary Than Ever.",1666814787,1
0.0,0.784,0.216,0.296,Crypto Exchange FTX Is Working on Creating a Stablecoin: Report,1666865292,1
0.0,0.761,0.239,0.296,Crypto Exchange FTX Is Working on Creating a Stablecoin,1666863389,1
0.196,0.804,0.0,-0.296,FTX Chief Teases Native Stablecoin Launch in ‘Not-Too-Distant Future’ - Decrypt,1666876333,-1
0.0,1.0,0.0,0.0,"FTX Very Likely to Launch a Stablecoin, SBF Confirms",1666867300,0
0.0,0.758,0.242,0.3034,"EXCLUSIVE: Sam Bankman-Fried: ""We're working on our stablecoin""",1666864098,1
0.0,0.784,0.216,0.296,Crypto Exchange FTX Is Working on Creating a Stablecoin: Report,1666865058,1
0.0,1.0,0.0,0.0,Dubai is seen as the main hub for blockchain and Metaverse: LandVault CEO Sam Huber,1666865085,0
0.0,1.0,0.0,0.0,DeFi Pioneer Echoes SBF in Call for Tighter Crypto Regulations,1666859195,0
0.0,0.784,0.216,0.296,Crypto Exchange FTX Is Working on Creating a Stablecoin: Report,1666866049,1
0.0,0.741,0.259,0.2732,Cryptocurrency Exchange FTX ‘Likely’ to Create a Stablecoin,1666888268,1
0.0,0.896,0.104,0.1027,Short liquidations at the Cryptocurrency exchange FTX reached a new record of $1.2 Billion,1666899577,1
0.315,0.685,0.0,-0.3182,"Aptos, SBF, and a Lack of Transparency",1666941947,-1
0.0,1.0,0.0,0.0,Contact Sammy Logan 100%,1666999626,0
0.0,1.0,0.0,0.0,SBF vs Erik Voorhees: How Do We Regulate Crypto?,1667006732,0
0.0,1.0,0.0,0.0,SBF (CEO FTX) was speechless when being asked how AAVE was different from email when it comes to KYC,1667075791,0
0.225,0.775,0.0,-0.4404,"FTX Chief Wanted to Bring Blockchain Tech to Twitter, Musk Denied",1667057532,-1
0.241,0.759,0.0,-0.6652,"Sam Bankman-Fried Wanted With Elon Musk To Build Twitter, But Was Rejected By Tesla CEO",1667058221,-1
0.0,1.0,0.0,0.0,SBF (CEO FTX) was speechless when being asked how AAVE was different from email when it comes to KYC,1667076293,0
0.0,1.0,0.0,0.0,The Whole SBF Vs. Erik Voorhees Debate - Is Crypto Regulation REALLY Required?,1667054087,0
0.219,0.781,0.0,-0.4215,FTX CEO Sam Bankman-Fried Denies Offering $15 Billion for Twitter Buyout,1667066723,-1
0.158,0.707,0.136,-0.1027,The Block: FTX’s Bankman-Fried to let ‘Crypto Twitter take the wheel’ on digital asset policy,1667083900,-1
0.0,0.766,0.234,0.4696,Anyone is using FTX can help on that?? I can‘t withdraw anything…,1667085082,1
0.0,1.0,0.0,0.0,FTX CEO dissects Mark Zuckerberg's intent to pump $10B/year into Meta,1667132987,0
0.176,0.824,0.0,-0.2811,Here's why Sam Bankman-Fried is not the JP Morgan of crypto,1667129918,-1
0.159,0.841,0.0,-0.5574,"Samsung Watch 4 just died. ANY ATM5 watch that shows Crypto prices, uses BT Polar heart strap and connects to Android?",1667127710,-1
0.161,0.839,0.0,-0.3612,Sam Bankman Fried should be embarrassed over his recent “debate” on the Bankless podcast.,1667176165,-1
0.0,1.0,0.0,0.0,Sam Bankman-Fried set to cash in up to $100 million from Musk's Twitter purchase,1667165552,0
0.4,0.6,0.0,-0.7184,"Is SBF a superhero, villain or simply misunderstood by the crypto community?",1667163186,-1
0.0,1.0,0.0,0.0,Sam Bankman-Fried set to cash in up to $100 million from Musk's Twitter purchase.,1667146194,0
0.0,1.0,0.0,0.0,Why MOONs are connected to FTX only?,1667212279,0
0.0,1.0,0.0,0.0,FTX and GameStop have formed a partnership.,1667227173,0
0.0,1.0,0.0,0.0,FTX and GameStop have formed a partnership.,1667227932,0
0.0,1.0,0.0,0.0,SBF vs Erik Vorhees: How do we regulate crypto?,1667263710,0
0.204,0.796,0.0,-0.6239,Celsius Network Bankruptcy Update - FTX and Celsius Fraud Connections | Tomorrow's Court Agenda | Examiner Objections and scope expanded!,1667245763,-1
0.0,1.0,0.0,0.0,Contact Sammy Logan,1667331788,0
0.0,1.0,0.0,0.0,"FTX Now Allows You To Send Crypto To Emails Or Phone Numbers, With A Catch. Also Receive Crypto And Fiat With An FTX User Tag",1667389580,0
0.173,0.827,0.0,-0.3182,SBF Vs Erik Voorhees - censorship resistance is mission critical to open finance,1667381153,-1
0.247,0.753,0.0,-0.3182,SBFCensorship Resistance is Mission Critical to Open Finance,1667381062,-1
0.0,1.0,0.0,0.0,Divisions in Sam Bankman-Fried’s Crypto Empire Blur on His Trading Titan Alameda’s Balance Sheet,1667420178,0
0.0,1.0,0.0,0.0,"I live in NY, so I can't use FTX to buy ETH. How can I move my moons?",1667414330,0
0.124,0.876,0.0,-0.4019,"Sam Bankman and Twitter - did Elon know that FTX may be in trouble, so he took binance funding over FTX?",1667437827,-1
0.0,1.0,0.0,0.0,FTX and Tether were closer to Celsius than anyone realized,1667461907,0
0.0,1.0,0.0,0.0,"Hyperbitcoinization is a few years away, predicts Samson Mow",1667495310,0
0.0,1.0,0.0,0.0,FTX'ed: The Tangled Ties Of Celsius Network and Sam Bankman-Fried,1667476552,0
0.0,0.734,0.266,0.4404,Good deep dive into the FTX balance sheet data,1667478083,1
0.0,1.0,0.0,0.0,"‘Hyperbitcoinization’ Is a Few Years Away, Predicts Samson Mow",1667511101,0
0.0,1.0,0.0,0.0,Something concerning about Alameda Research (FTX investment branch),1667504165,0
0.0,1.0,0.0,0.0,"FTX has through its VC arm, FTX Ventures , recently invested in a Web3 decentralized platform called Lens Protocol.",1667564811,0
0.0,1.0,0.0,0.0,DeFi advocates push back against FTX-backed crypto bill,1667563958,0
0.077,0.839,0.084,0.0516,"Elon, Do Kwon, SBF etc. That is all I see all day long here. Can we just stop giving these Whales and Scammers so much space here?",1667583919,1
0.0,1.0,0.0,0.0,Why FTX Passed On Investing in Twitter: SBF,1667597984,0
0.0,1.0,0.0,0.0,SBF- Is Alameda Research Insolvent?,1667592226,0
0.0,1.0,0.0,0.0,Does anyone have proof that SBF/Alameda actually made their seed money from global crypto arbitrage?,1667646030,0
0.454,0.546,0.0,-0.717,Bitboy Calls Sam Bankman-Fried the Devil !!,1667613608,-1
0.0,0.769,0.231,0.2023,Sam Bankman-Fried Top U.S. Midterm Election Donor,1667663444,1
0.0,1.0,0.0,0.0,FTX Earn,1667674971,0
0.0,0.748,0.252,0.4019,"An Interesting Take on FTX/Alameda ""Is Alameda Research Insolvent?""",1667667745,1
0.0,1.0,0.0,0.0,FTX Ventures' Amy Wu: VC deals during bull market lacked proper due diligence,1667667737,0
0.0,1.0,0.0,0.0,My CRYPTOHOPPER.com and FTX.us Crypto Trading Bot Setup and Configuration,1667716492,0
0.0,1.0,0.0,0.0,Binance to Sell Rest of FTX Token Holdings as Alameda CEO Defends Firm's Financial Condition,1667756124,0
0.385,0.615,0.0,-0.6124,Binance Dumps FTX as FTT Loses 11% in 24 Hours,1667734534,-1
0.0,1.0,0.0,0.0,Binance Moves to Liquidate Its Entire Position in FTX Tokens,1667759205,0
0.302,0.698,0.0,-0.3818,Binance To Dump FTX (FTT) Token Holdings,1667755012,-1
0.385,0.615,0.0,-0.6124,Binance Dumps FTX as FTT Loses 11% in 24 Hours,1667747569,-1
0.0,0.833,0.167,0.2023,Sam Bankman Fried Announces Substantial Donations in US Mid-Term Elections,1667748299,1
0.0,1.0,0.0,0.0,FTX insolvency rumor,1667740700,0
0.385,0.615,0.0,-0.6124,Binance Dumps FTX as FTT Loses 11% in 24 Hours,1667752251,-1
0.385,0.615,0.0,-0.6124,Binance Dumps FTX as FTT Loses 11% in 24 Hours,1667743138,-1
0.316,0.684,0.0,-0.7184,Fears of Terra Luna style collapse of FTX native token as Binance liquidates its holdings,1667758455,-1
0.0,1.0,0.0,0.0,"CZ, CEO of Binance, announces that Binance plans to liquidate all of the FTT remaining on their order books, that they received when they exited FTX last year. Says they'll do it in a way to ""minimize market impact""",1667750976,0
0.071,0.929,0.0,-0.0772,SBF reveals he donated to Republicans &amp; Democrats as lobbying by crypto firms continues ahead of the midterms,1667741287,-1
0.186,0.499,0.316,0.4349,"Important warning: Traders on FTX and FTT holders, please be very cautious and protect your money",1667752673,1
0.0,0.815,0.185,0.3612,"be carefull everyone, i feel like another Celsius event could happen with FTX",1667754935,1
0.0,1.0,0.0,0.0,FTX and MtGox,1667783958,0
0.0,1.0,0.0,0.0,Get your portfolio off FTX ASAP,1667783276,0
0.0,1.0,0.0,0.0,FTX announces a partnership with the American Baseball League (MLB),1667765488,0
0.0,0.814,0.186,0.264,FTX solvency issues? Why would they be buying Voyager assets?,1667781488,1
0.0,1.0,0.0,0.0,Binance to Sell Rest of FTX Token Holdings as Alameda CEO Defends Firm's Financial Condition,1667760583,0
0.0,1.0,0.0,0.0,Withdraw your funds from FTX (hear me out),1667787583,0
0.0,1.0,0.0,0.0,Sam Bankman-Fried responds to rumors about FTX insolvency.,1667778782,0
0.0,1.0,0.0,0.0,Can FTX and Alameda Be The Next Big Crypto Insolvency?,1667772642,0
0.0,1.0,0.0,0.0,Any thoughts how a max exodus of coins kept on FTX exchange might affect prices of said coins?,1667787463,0
0.0,1.0,0.0,0.0,Can FTX and Alameda Be The Next Big Crypto Insolvency?,1667788775,0
0.0,1.0,0.0,0.0,FTX hourly withdrawals for ETH just hit an all-time high.,1667779239,0
0.0,1.0,0.0,0.0,Binance CEO just announced on twitter that they will liquidate its $500mm FTX position,1667774723,0
0.0,1.0,0.0,0.0,Binance to Sell Rest of FTX Token Holdings as Alameda CEO Defends Firm's Financial Condition,1667763051,0
0.0,1.0,0.0,0.0,Billionaire Sam Bankman-Fried Explains Why Crypto Exchange FTX Passed on Funding Twitter Acquisition - The Daily Hodl,1667773307,0
0.343,0.657,0.0,-0.5719,"Binance accuses FTX of ""spreading misinformation to media and US policymakers""",1667765478,-1
0.0,1.0,0.0,0.0,Withdraw all holdings from FTX,1667788505,0
0.0,1.0,0.0,0.0,Binance Moves to Liquidate Its Entire Position in FTX Tokens,1667771938,0
0.0,1.0,0.0,0.0,Binance versus FTX: the face/off,1667789129,0
0.15,0.85,0.0,-0.3182,Odd candle stick moves/gap - anyone seeing this in FTXUS? TradingView shows normal candle sticks.,1667761765,-1
0.434,0.566,0.0,-0.3182,I’m confused about FTX,1667770955,-1
0.0,1.0,0.0,0.0,Binance To Liquidate FTX’s FTT Holdings “Due To Recent Revelations”,1667768532,0
0.0,0.777,0.223,0.3182,Please withdraw your holdings from FTX to your wallets,1667787939,1
0.0,1.0,0.0,0.0,FTX &amp; MtGox,1667784242,0
0.552,0.448,0.0,-0.4005,ftx fud is so meh,1667782136,-1
0.0,1.0,0.0,0.0,FTX withdrawals,1667766821,0
0.0,1.0,0.0,0.0,Public Service Announcement: get your money out of FTX immediately.,1667769267,0
0.0,1.0,0.0,0.0,Withdraw all holdings from FTX,1667788312,0
0.092,0.794,0.115,0.2589,"It looks like Nexus Mutual no longer insures FTX. Not sure if this is recent, or has been this way for a while. Interesting to see after the news of FTX’s balance sheet. Celsius also used to be covered by Nexus.",1667767576,1
0.0,0.901,0.099,0.0258,FTX hourly withdrawal for $ETH just hit an all time high.,1667781279,1
0.165,0.647,0.188,0.1027,"FTX CEO pretty much confirms mass exodus from the platform, denies all rumours",1667778040,1
0.0,0.884,0.116,0.1779,"If FTX is having solvency issues (per rumors), why go after Voyager bankruptcy assets?",1667782467,1
0.0,0.723,0.277,0.3182,[SERIOUS] FTX rumors &amp; securing your crypto,1667773605,1
0.0,1.0,0.0,0.0,Billionaire Sam Bankman-Fried Reveals Reasons for Not Investing in Elon Musk Twitter Takeover,1667820051,0
0.0,1.0,0.0,0.0,"[August 9, 2022] ""FTX partners with Reddit to roll out tokenized Community Points""",1667809572,0
0.25,0.648,0.102,-0.3818,FTX addresses user withdrawal complaints amid major token movement,1667821046,-1
0.265,0.735,0.0,-0.2023,FTX risky. Get your funds out🔴,1667808421,-1
0.239,0.761,0.0,-0.296,FTX's Ethereum (ETH) Reserves Collapses Amid Liquidity Issues,1667822336,-1
0.194,0.806,0.0,-0.5859,"Binance and FTX, CZ vs SBF. What Is the Root of the Feud? A Brief Tale of the Feud Between the Two Giants.",1667823410,-1
0.0,1.0,0.0,0.0,Binance to liquidate its entire FTX Token holdings after ‘recent revelations’,1667792310,0
0.212,0.788,0.0,-0.5423,Remember back in July when SBF ominously predicted that more crypto exchanges would fail?,1667791926,-1
0.0,1.0,0.0,0.0,"SBF States FTX is “Fine”, Competitor Spreading False Rumors",1667826740,0
0.0,0.885,0.115,0.5661,"SBF lashes out at Binance liquidating $584 million worth of FTX tokens and says two can play the game, ""Do you know how many BNB we have? What happens if we throw it all in the market now?""",1667801633,1
0.18,0.82,0.0,-0.296,FTX weekly stablecoin outflows surge as Binance piles on the pressure,1667829291,-1
0.206,0.794,0.0,-0.4404,"[Old article from 20 Aug 2022] FTX grew revenue 1,000% during the crypto craze, leaked financials show",1667809028,-1
0.0,1.0,0.0,0.0,SBF tweets about the Binance x FTX issue,1667825743,0
0.0,1.0,0.0,0.0,71 Million XRP Moved by Whales to FTX in Flurry of Exchange Transfers,1667818099,0
0.0,1.0,0.0,0.0,There Are Now Reports Of MAJOR Issues With User Withdrawals With FTX Platform,1667824803,0
0.203,0.797,0.0,-0.4215,FTX CEO Sam Bankman-Fried Denies Insolvency Rumors as Binance Liquidates FTT Token,1667828915,-1
0.0,1.0,0.0,0.0,Billionaire Sam Bankman-Fried Reveals Reasons for Not Investing in Elon Musk Twitter Takeover,1667820146,0
0.0,1.0,0.0,0.0,Update FTX vs Binance,1667827766,0
0.126,0.874,0.0,-0.3182,Crypto Exchange Binance Dumping All FTX Tokens on Its Books — CEO Cites 'Recent Revelations' – Altcoins Bitcoin News,1667792541,-1
0.313,0.687,0.0,-0.6249,"Crypto Price Today: FTX Crisis Sinks Crypto Market, Bitcoin Falls",1667796585,-1
0.25,0.648,0.102,-0.3818,FTX addresses user withdrawal complaints amid major token movement,1667822245,-1
0.0,1.0,0.0,0.0,Billionaire Sam Bankman-Fried Reveals Reasons for Not Investing in Elon Musk Twitter Takeover,1667819876,0
