neg,neu,pos,compound,headline,time,label
0.0,1.0,0.0,0.0,SBF was NOT the Second Largest Donor to the Biden Campaign in 2020. Not Even Close.,1668338849,0
0.0,1.0,0.0,0.0,FTX balance sheet revealed,1668331762,0
0.0,1.0,0.0,0.0,The biggest takeaway from FTX,1668321979,0
0.196,0.804,0.0,-0.296,Reuters Reports $1B of Client Funds Missing at FTX - Slashdot,1668340343,-1
0.152,0.848,0.0,-0.5267,"KimDotcom: ""The FTX thief stole $1 billion from his customers and donated $100 million to Democrats.⸻10% for the big guy?""",1668336708,-1
0.167,0.833,0.0,-0.34,Bahamas regulator contradicts FTX claim that it was required to process local withdrawals,1668333381,-1
0.196,0.804,0.0,-0.296,Hong Kong to avoid FTX-like scenario through transparency and supervision,1668340049,-1
0.608,0.392,0.0,-0.4767,ftx ruined me,1668328089,-1
0.0,1.0,0.0,0.0,Solana liquidity hub Serum to be forked after possible compromise in FTX hack,1668338110,0
0.351,0.649,0.0,-0.7579,"As FTX fiasco leaves crypto markets in lurch, Indian crypto evangelists silent on collapse",1668336372,-1
0.0,0.797,0.203,0.4215,Vitalik Buterin calls out FTX for virtue signaling: 'deserves what its getting',1668329894,1
0.0,1.0,0.0,0.0,Not a FTX POST,1668339372,0
0.0,1.0,0.0,0.0,Solana liquidity hub Serum to be forked after possible compromise in FTX hack.,1668338901,0
0.306,0.694,0.0,-0.296,Stop calling people behind FTX kids,1668329625,-1
0.153,0.847,0.0,-0.4019,"Tom Brady, Steph Curry, and Kevin O’Leary Set to Lose Big From FTX Bankruptcy Filing — Barron's",1668335773,-1
0.0,0.797,0.203,0.4215,Vitalik Buterin calls out FTX for virtue signaling: ‘Deserves what it’s getting’,1668338285,1
0.144,0.72,0.136,-0.0258,FTX Held Just $900MM In Liquid Assets Vs $9BN In Liabilities,1668341923,-1
0.234,0.584,0.182,-0.1779,Crypto experts allege gateio and crypto.com could collapse like FTX,1668333832,-1
0.0,1.0,0.0,0.0,Didn’t know SBF was fat. Can vegans even be fat?,1668322777,0
0.0,1.0,0.0,0.0,FTX Hack Sparks Revolution at Serum DEX as Solana Devs Plot Alameda's Ouster,1668321141,0
0.0,0.779,0.221,0.1779,Next FTX? Crypto.com. Withdraw your assets ASAP.,1668330324,1
0.0,1.0,0.0,0.0,"FTX Hack Full Details: How It Happened, Where The Funds Are, The Current Situation And Are You Compromised",1668341371,0
0.434,0.566,0.0,-0.3182,FTX Balance Sheet leaked,1668332376,-1
0.213,0.787,0.0,-0.4019,FTX Boss Allegedly Conspired To Crash LUNA And Take Down 3AC,1668318108,-1
0.0,1.0,0.0,0.0,Can someone finally explain the “hack” on FTX app?,1668322563,0
0.0,1.0,0.0,0.0,“The king is dead”: Inside the fall of FTX,1668331991,0
0.223,0.777,0.0,-0.3182,Lost and dont know where to go next FTX,1668324636,-1
0.0,1.0,0.0,0.0,FTX and Sam Bankman Fried; Why I didn't invest in FTX token (FTT),1668318013,0
0.0,1.0,0.0,0.0,Sam is finished but wen Adani Liquidations ? 😂,1668332652,0
0.365,0.635,0.0,-0.6808,"Another SBF post, but ... conspiracy time (dubious flair)",1668331897,-1
0.0,1.0,0.0,0.0,FTX org chart is a cluster****,1668331704,0
0.324,0.676,0.0,-0.6908,The question no one seems to be asking yet: Which banks are exposed to the FTX collapse?,1668339379,-1
0.0,0.921,0.079,0.3034,BREAKING EXCLUSIVE: Tens of Billions of US Dollars Were Transferred to Ukraine and then Using FTX Crypto Currency the Funds Were Laundered Back to Democrats in US,1668323748,1
0.0,0.863,0.137,0.4019,Can anyone confirm SBF sex parties in Bahamas and any link to Anthony Scaramucci who visited him there?,1668335113,1
0.0,1.0,0.0,0.0,The fall of the FTX ‘King of Crypto’ Sam Bankman-Fried - BBC News,1668346571,0
0.0,0.732,0.268,0.296,Vitalik Buterin Shares Thoughts on FTX Implosion,1668346298,1
0.0,1.0,0.0,0.0,"Adult website ""Bang Bros"" offers $10 to name Miami Heat ""FTX arena"" stadium",1668349667,0
0.274,0.726,0.0,-0.5267,"Bahamas Police Are Investigating ""Potential"" Criminal Misconduct by FTX - Decrypt",1668359165,-1
0.0,1.0,0.0,0.0,SBF Is a Manipulative Sociopath,1668352676,0
0.0,1.0,0.0,0.0,"Crypto Caligula: Staring Sam Bankman Fried of FTX, O'Leary, Do Kwon, Scaramucci, Vitalik and Elon Musk",1668352465,0
0.0,1.0,0.0,0.0,One to Two Billion Dollars of FTX Client Cash Have Vanished,1668351513,0
0.0,0.823,0.177,0.4995,"FTX CLOWNS Graham Stephan, Andrei Jikh, &amp; Jeremy Lefebvre THANK YOU for Their MILLION DOLLAR HOMES",1668358752,1
0.0,1.0,0.0,0.0,FTX Binance Crypto.com,1668358304,0
0.21,0.79,0.0,-0.729,"Hacked funds on the move: FTX hack sent to a pool called ""fuckFTX"" a new pool was made and it's called ""CRO Next."" POSSIBLE FALSE ALARM - BEWARE!",1668349410,-1
0.296,0.704,0.0,-0.2732,"Crypto.com at risk, next after FTX?",1668352752,-1
0.0,1.0,0.0,0.0,Happening now: 🚨FTX Saga Continues. But Who's Next? - The Crypto Roundtable (Kim DotCom has allegedly juicy info on Binance not being as solvent),1668348605,0
0.367,0.633,0.0,-0.7003,$3 billion in Bitcoin left exchanges this week amid FTX contagion fears,1668345005,-1
0.0,0.808,0.192,0.6678,"The fall of FTX will not destroy cryptocurrency, but regulation could. Why we should all be opposed to regulation (and what we should support instead)",1668353386,1
0.0,1.0,0.0,0.0,"Investing | Finance on Instagram: ""FTX part 3. Is this a luxury playground cult?""",1668355929,0
0.444,0.556,0.0,-0.34,Accidentally went to FTX.com,1668356287,-1
0.0,1.0,0.0,0.0,FTX’s founder was called a modern-day J.P. Morgan. The analogy still works.,1668355515,0
0.266,0.734,0.0,-0.7003,"If you’re upset with CZ in the midst of FTX’s collapse, Blockfi’s demise, and CDC mishandling customer funds -",1668356971,-1
0.0,1.0,0.0,0.0,What exactly happened with FTX?,1668348647,0
0.0,1.0,0.0,0.0,"FTX Recap: What just happened with Blockfi, Crypto dot Com and more",1668347333,0
0.35,0.65,0.0,-0.6486,'The King is dead: Inside the fall of FTX,1668347740,-1
0.0,1.0,0.0,0.0,"$389,233,378 in FTT Abruptly Leaves FTX Contract Address, Moves to Unknown Crypto Wallet",1668343317,0
0.0,1.0,0.0,0.0,Gemini Sends Statement on FTX to Users,1668348767,0
0.132,0.755,0.113,-0.0772,"Collapsed cryptocurrency exchange FTX had ties to Ukrainian government, WEF, and top Biden adviser",1668343232,-1
0.0,1.0,0.0,0.0,Is the Exodus Wallet connected in anyway to FTX?,1668346773,0
0.0,0.752,0.248,0.5106,FTX Insiders Are Somehow Still Using FTT To Print Free Money,1668346750,1
0.444,0.556,0.0,-0.34,Accidentally went to FTX.com,1668355701,-1
0.242,0.44,0.319,0.1779,"no money left , good bye - FTX",1668352720,1
0.0,1.0,0.0,0.0,Paradigm marks down FTX investment to zero: Sources,1668350593,0
0.0,1.0,0.0,0.0,What exactly did FTX do?,1668348837,0
0.0,1.0,0.0,0.0,should biden speak up and raise funds from dnc to give back donations from SBF?,1668356709,0
0.0,1.0,0.0,0.0,What EXACTLY did FTX do?,1668347920,0
0.286,0.714,0.0,-0.4939,FTX Collapse Saw $1 Billion Long Liquidations In 3 Days,1668345487,-1
0.242,0.758,0.0,-0.4939,Another Crypto Exchange Halts Withdrawals on Heels of FTX Collapse: Details,1668352431,-1
0.291,0.709,0.0,-0.4005,"""Really Sorry, Again"": Crypto Exchange FTX Founder As His Firm Collapsed",1668347329,-1
0.0,1.0,0.0,0.0,Crypto.com FTXscam,1668354669,0
0.099,0.901,0.0,-0.0258,"Crypto Exchange Kraken Freezes Accounts of FTX, Alameda Research, Their Executives",1668349001,-1
0.211,0.789,0.0,-0.4939,CZ First Interview After the Collapse of FTX at Indonesia Fintech Summit 2022,1668354708,-1
0.121,0.794,0.085,-0.0428,"Does anyone find it odd that FTX.com didn't allow US Citizens to trade, yet, it was run by Americans, and they are filing for bankruptcy in the United States?",1668354669,-1
0.195,0.805,0.0,-0.5267,Let's err on the side of empathy for those who have been hurt by FTX.,1668358163,-1
0.0,0.756,0.244,0.4404,One good thing to come out of this FTX stuff…,1668349212,1
0.0,0.87,0.13,0.2714,Scammer Ben Armstrong (@Bitboy_Crypto) has top secret evidence to send SBF to jail for life!,1668345764,1
0.088,0.912,0.0,-0.4019,"Mark Cuban trolls Kevin O'Leary who got it right once again: ""if there's ever a place I could be that I'm not gonna get in trouble, it's gonna be at FTX""",1668344196,-1
0.0,0.894,0.106,0.4932,"FTX Saga Continues [Live]. But who's next? - The Crypto Roundtable - Notable speakers: Mario Nawfal, Kim Dotcom, Charles Hoskinson, and more expected to join in. Binance reveal coming up.",1668345035,1
0.137,0.863,0.0,-0.4019,Something to note with some of these videos lately that are saying FTX caused every crash this year,1668357389,-1
0.326,0.674,0.0,-0.7003,$3 billion in Bitcoin left exchanges this week amid FTX contagion fears By Cointelegraph,1668349327,-1
0.0,1.0,0.0,0.0,"so whats the cheapest way to withdraw bitcoin/eth now, since the FTX app doesnt even load anymore?",1668355152,0
0.201,0.763,0.036,-0.8012,Pointing out legitimate and concerning issues with competitors is not “fudding”. CZ did not fud FTX - they were fraudulent and he exposed them. And it isn’t ‘fudding’ to point out that a rival accidentally sent 80% of their cold reserves to the wrong address.,1668356758,-1
0.0,1.0,0.0,0.0,Gensler ties to FTX,1668354922,0
0.0,1.0,0.0,0.0,FTX cannot account for $1 billion of client's funds,1668348435,0
0.247,0.753,0.0,-0.3182,So are all funds stored in FTX lost?,1668343900,-1
0.0,1.0,0.0,0.0,SBF's blog,1668346902,0
0.172,0.72,0.108,-0.264,Is FTX US fine? Is it totally separate from the mess at FTX international?,1668360362,-1
0.0,1.0,0.0,0.0,FTX staff trading my life savings away 😞,1668365973,0
0.09,0.843,0.067,-0.1943,BREAKING EXCLUSIVE: Tens of Billions of US Dollars Were Transferred to Ukraine and then Using FTX Crypto Currency the Funds Were Laundered Back to Democrats in US ⋆ The Savage Nation,1668365181,-1
0.248,0.752,0.0,-0.5106,Hong Kong Crypto Exchange AAX Suspends Withdrawals as FTX Failure Reverberates,1668364250,-1
0.389,0.611,0.0,-0.7906,Bankrupt crypto exchange FTX is under criminal investigation in The Bahamas | CNN Business,1668372967,-1
0.2,0.562,0.237,0.1531,Bitcoin Will Be The Winner: Michael Saylor on the FTX Collapse,1668372141,1
0.0,1.0,0.0,0.0,What’s Next for FTX and its Customers After Bankruptcy Filing?,1668372454,0
0.0,1.0,0.0,0.0,"FTX, an already stale Virginia / DC local central bank inheritor psyop to slow Bitcoin's rise",1668370157,0
0.292,0.708,0.0,-0.5106,Crypto Exchange AAX Suspends Withdrawals as FTX Failure Reverberates,1668365466,-1
0.0,1.0,0.0,0.0,Liquidity hub Serum forked by developers after FTX hack,1668361505,0
0.403,0.597,0.0,-0.4019,FTX behind Terra Luna crash?,1668371113,-1
0.0,1.0,0.0,0.0,FTX will trigger regulation,1668365747,0
0.0,1.0,0.0,0.0,Did anyone noticed dydx while FTX fell over,1668362147,0
0.481,0.519,0.0,-0.8126,Could Sam Bankman-Fried go to prison for the FTX disaster?,1668362073,-1
0.0,0.836,0.164,0.3724,"After the cyber-attack on FTX, isn't it dangerous to buy bitcoin on P2P platforms?",1668359285,1
0.0,0.769,0.231,0.2023,FTX Fallout - Why take chances with cash?,1668366056,1
0.244,0.546,0.21,-0.2023,"Robinhood will restrict trading, FTX will out right steal your assets. Let’s trust another centralized exchange. EDX.",1668368146,-1
0.126,0.71,0.164,-0.0772,"FTX founder, Sam Bankman-Fried loses all of his $16 Billion net worth in a matter of 5 days",1668365755,-1
0.093,0.838,0.069,-0.1943,EXCLUSIVE: Tens of Billions of US Dollars Were Transferred to Ukraine and then Using FTX Crypto Currency the Funds Were Laundered Back to Democrats in US ⋆ The Savage Nation,1668365254,-1
0.0,1.0,0.0,0.0,The reason this FTX drama is making me even more bullish on blockchain,1668365010,0
0.172,0.72,0.108,-0.264,Is FTX US fine? Is it totally separate from the mess at FTX International?,1668359849,-1
0.208,0.615,0.177,-0.1027,The FTX crash is a huge setback for crypto mass adoption.,1668362097,-1
0.533,0.467,0.0,-0.7906,"FTX fiasco threatens industry meltdown, 25% drop in bitcoin: JPMorgan",1668364298,-1
0.193,0.807,0.0,-0.5563,Was This Capitulation or More Pain Ahead for BTC Following the FTX Bankruptcy? (Bitcoin Price Analysis),1668362499,-1
0.169,0.615,0.215,-0.0258,"SBF's 'Truly Trustless' Protocol — Serum’s Upgrade Authority May Be Tainted, Devs Look to Fork Project",1668359910,-1
0.0,1.0,0.0,0.0,"FTX files for bankruptcy, and the fallout begins. Who’s next?",1668370751,0
0.0,1.0,0.0,0.0,Have an ftx account with personal data what should I do?,1668372321,0
0.0,1.0,0.0,0.0,"SBF vs CZ music video, SBF thought he was the man until…",1668368325,0
0.0,1.0,0.0,0.0,"Thoughts on FTX's acquisition of Voyager and others, as a means to keep the ponzi going?",1668371038,0
0.0,1.0,0.0,0.0,Crypto Hedge Fund Galois Confirms $40 Million Exposure to FTX,1668365321,0
0.0,1.0,0.0,0.0,FTX will be the cause of Crypto regulation.,1668363488,0
0.0,1.0,0.0,0.0,I have an ftx account with personal data what should I do?,1668372657,0
0.292,0.708,0.0,-0.5106,Crypto Exchange AAX Suspends Withdrawals as FTX Failure Reverberates,1668367213,-1
0.0,1.0,0.0,0.0,The reason this FTX drama is making me even more bullish on blockchain,1668365256,0
0.602,0.398,0.0,-0.6739,WTF happened to FTX?,1668363541,-1
0.0,1.0,0.0,0.0,Anyone know him ? FTX,1668365393,0
0.0,0.791,0.209,0.4404,I hope Democrats will prove the opposite. And reveal their connections to SBF.,1668372249,1
0.0,1.0,0.0,0.0,The FTX Saga: The Downfall Told Through Memes,1668363201,0
0.057,0.943,0.0,-0.3412,"For all the Algorand fans who aped in because of MIT professor, doesn't mean it's a good investment. SBF is MIT graduate, Alameda CEO is Caroline Ellison, Gary Gensler is ex MIT professor, Caroline Ellison dad was Gary's ex boss at MIT",1668360019,-1
0.0,0.878,0.122,0.3818,"Insider from FTX saying that FTX Executives bribed everyone in bahamas. Including police by donations, port authority, politicians, banks, real estate, etc… Can we even expect a fair trial?",1668365691,1
0.367,0.633,0.0,-0.7003,$3 billion in Bitcoin left exchanges this week amid FTX contagion fears,1668360809,-1
0.0,0.894,0.106,0.2263,Crypto giant FTX files for bankruptcy after CEO sees $16 billion net worth wiped in one day,1668366009,1
0.0,1.0,0.0,0.0,The FTX Rabbit Hole Goes Deeper,1668363602,0
0.153,0.847,0.0,-0.2023,Sam Bankman Fried and his empty boxes. (SBF's yield farming ponzi),1668370869,-1
0.207,0.793,0.0,-0.5267,Royal Bahamas Police Force Reveals FTX Is Being Investigated for 'Criminal Misconduct' – Bitcoin News,1668371613,-1
0.0,0.791,0.209,0.4404,"Lessons from FTX: Keeping Crypto Safe Using Exchange, Self-Custodial, and Hardware Wallets",1668363643,1
0.279,0.721,0.0,-0.4767,What about all the fake crypto sold by FTX?,1668362463,-1
0.135,0.821,0.044,-0.6124,"Cryptocurrency Solana Collapses in FTX Scandal. The token lost 61.6% of its value in the last seven days, according to data firm CoinGecko. Solana (SOL) prices are now down 95% from their all-time high of Nov. 6, 2021. Solana is currently trading around $14.12 from $259.96 in November 2021.",1668382697,-1
0.059,0.903,0.038,-0.2263,"Huobi’s Hong Kong-listed company announced that $18.1 million in crypto could not be withdrawn on FTX, of which $13.2m was customer assets. Controlling shareholder Li Lin will provide additional unsecured financing of up to $14 million, which will cover client balance sheets.",1668388653,-1
0.417,0.583,0.0,-0.6486,SBF Found Dead at Rosewood Baha Mar.,1668377260,-1
0.114,0.812,0.074,-0.3182,"The safe and ""trustworthy"" yield earning products are ponzi's. Even Genesis on the Gemini earn product has admitted to 200M in lost funds that they had on FTX, to get their 8% Yield on deposits. They kept half and gave the users half. It was the same high risk just lower yield.",1668392797,-1
0.0,1.0,0.0,0.0,The latest from SBF,1668395987,0
0.0,0.626,0.374,0.6988,“Brankrupt FTX Yacht Club” 😂 Gotta love the crypto/NFT space!!,1668378485,1
0.119,0.881,0.0,-0.3182,H'wood FTX Frenzy as Michael Lewis Reveals He Spent 6 Months with FTX Founder SFB For His Next Book.,1668383080,-1
0.0,0.722,0.278,0.4019,A song about SBF and Caroline Ellison -Help Finish,1668384175,1
0.0,1.0,0.0,0.0,FTX &amp; Alameda saga,1668384220,0
0.205,0.795,0.0,-0.5574,"""Kanye Was Right"" – Black CoinDesk Journalist Fired for Noticing That Everyone at FTX Was Jewish",1668380324,-1
0.109,0.891,0.0,-0.0258,Crypto exchange Kraken freezes accounts related to FTX and Alameda,1668393709,-1
0.0,1.0,0.0,0.0,sbf is back!,1668395665,0
0.0,1.0,0.0,0.0,The Big Short author is making a book on FTX’s Sam Bankman-Fried,1668378305,0
0.0,1.0,0.0,0.0,SBF just tweeted...,1668396081,0
0.0,1.0,0.0,0.0,Crypto.com sent $1bn in stablecoins to FTX in 2022 - Etherscan.io,1668374719,0
0.0,0.792,0.208,0.2732,Visa has terminated global debit card agreements with FTX,1668394061,1
0.0,1.0,0.0,0.0,Happening now: 🚨 FTX Saga Continues - More Exchanges Shutter! Live discussion,1668376923,0
0.683,0.317,0.0,-0.6486,SBF found dead,1668378350,-1
0.692,0.308,0.0,-0.6705,SBF RUMORED SUICIDE,1668379611,-1
0.0,1.0,0.0,0.0,CDC CEO address trading volume CDC had with FTX over the year to clarify that they (allegedly) had less than 10m $ actual exposure to FTX.,1668396345,0
0.0,1.0,0.0,0.0,European perp traders - which exchange now FTX has snuffed it?,1668377983,0
0.286,0.714,0.0,-0.4939,FTX collapse with Coinbase CEO Brian Armstrong (Starts 20:47),1668383638,-1
0.0,1.0,0.0,0.0,"Michael Lewis (The Big Short, Moneyball, Liar's Poker) has reportedly been traveling with and interviewing Sam Bankman-Fried over the last six months, prepping a book, and is now shopping the film rights.",1668379237,0
0.0,1.0,0.0,0.0,CEO of FTX is Daughter of SEC Head's Former Boss,1668396166,0
0.0,1.0,0.0,0.0,"A report in August by the regulator of the US audit profession, said its inspectors found deficiencies in all four of the public company audits carried out by Prager Metis. Prager Metis is the audit firm for FTX and the other is Armanino. FT reported.",1668387265,0
0.0,0.841,0.159,0.1779,CrossTower revises new offer for Voyager's assets after FTX's bankruptcy,1668377442,1
0.047,0.853,0.1,0.2023,"Huobi announced it is also affected by the FTX Bankruptcy. Huobi announced that $18.1 million in crypto couldn't be withdrawn on FTX, and $13.2m are customer assets while $5m are Huobi's assets.",1668395900,1
0.0,1.0,0.0,0.0,Why Nobody Wants to Talk on How the Ukraine President Laundered FTX Money?,1668394245,0
0.0,1.0,0.0,0.0,What’s happening with Elon Musk and Sam Bankman-Fried?,1668387239,0
0.0,1.0,0.0,0.0,The silver lining in the FTX debacle,1668382552,0
0.0,1.0,0.0,0.0,The silver lining in the FTX debacle,1668383098,0
0.0,1.0,0.0,0.0,SBF twitter account just posted “what”,1668395204,0
0.0,1.0,0.0,0.0,Predicted the FTX fall out back in March!!!,1668396130,0
0.365,0.635,0.0,-0.3182,SBF flee attempt: photos leaked,1668375581,-1
0.167,0.833,0.0,-0.296,Sam Bankman-Fried’s fall cuts off big source of funds for US Democrats,1668392010,-1
0.0,1.0,0.0,0.0,CRYPTO.COM AND BINANCE TO FOLLOW FTX?! Video here👇,1668391636,0
0.326,0.496,0.177,-0.2732,Crypto exchanges race to soothe clients’ nerves after FTX collapse,1668374147,-1
0.0,1.0,0.0,0.0,"Everyone who didn't take their funds out of FTX, why?",1668389504,0
0.0,0.704,0.296,0.4939,FTX- you don’t want to know how deep the rabbit hope goes …,1668377120,1
0.0,1.0,0.0,0.0,CRYPTO.COM AND BINANCE TO FOLLOW FTX?! Video here👇,1668391855,0
0.0,1.0,0.0,0.0,FTX was a WEF Partner. The WEF has now deleted this page,1668387770,0
0.0,1.0,0.0,0.0,AAX crypto exchange says it is suspending withdrawals amid FTX fallout,1668394707,0
0.0,0.82,0.18,0.6808,"Mario Nawful (Twitter) has been hosting Twitter spaces regarding the FTX fallout, but Nawful is only using this fallout for personal gain",1668389397,1
0.078,0.922,0.0,-0.5719,These are the people that our all stealing your money thru crypto on exchanges.... take a close look... the exchanges are all working together... and ❤ for you to think they don't. #CZBinance #FTX #BTC #doge #SamBankmanFried #Binance #DoKwon they leverage your own investments against you thru,1668388333,-1
0.177,0.789,0.034,-0.6732,Three Arrows Capital is now trying to put all the blame for their collapse on FTX “hunting“ their positions. Of course it was not them longing the top…,1668377698,-1
0.278,0.722,0.0,-0.4019,FTX downfall was Sam fault and his only,1668379762,-1
0.0,1.0,0.0,0.0,Mercedes F1 team suspends partnership with FTX,1668378459,0
0.0,0.782,0.218,0.7717,Funny how Mercedes get a 1-2 (first win and first 1-2 of the season) at the first race where FTX is removed as a sponsor in their car…,1668379607,1
0.0,0.839,0.161,0.3612,Is there any place that offers Tokenized Stocks and Crypto trading like FTX did?,1668385625,1
0.059,0.941,0.0,-0.5141,"To anyone out there trying to figure out why the FTX saga sounds so familiar I figured it out. It’s literally the plot from the little known shitty sequel to the Justin Timberlake and Ben Affleck movie Runner Runner, that nobody asked for😂 I give you the cover for Runner Runner 2, also my first meme",1668375332,-1
0.403,0.597,0.0,-0.4019,FTX Losses on taxes 2022?,1668393537,-1
0.377,0.623,0.0,-0.7399,Am I missing something with FTX? Couldn’t this all the funds lost from people been avoided?,1668383757,-1
0.0,1.0,0.0,0.0,SBF NEW TWEET!,1668395876,0
0.206,0.794,0.0,-0.7579,Everyone thought all stablecoins were going to collapse after Luna and now everyone thinks all exchanges are going to fall after FTX. Don't feed into the panic.,1668386138,-1
0.0,1.0,0.0,0.0,Is Crypto.com’s CRO Coin the Next Domino To Fall Now That FTX Is in Regulatory Crosshairs and Sam Bankman-Fried and the CEO of Alameda Are on the Run?,1668380158,0
0.0,1.0,0.0,0.0,Simon Dixon on FTX - what happens when short term trader runs an exchange,1668376520,0
0.479,0.521,0.0,-0.8442,FTX collapse is ‘slow-motion train wreck running into a dumpster fire full of black swans’: Analyst,1668384141,-1
0.091,0.909,0.0,-0.3182,"withdrew 200 usd from ftx acc on November 4th at around 12am, still haven't received money in my bank acc. should I consider it lost?",1668395786,-1
0.32,0.68,0.0,-0.5106,The Hunt for the FTX Thieves Has Begun,1668384191,-1
0.151,0.849,0.0,-0.6298,"Did ftx screw me? i cant sign in on pc. can't buy, sell, or update profile. Did they steal my money? Is there a way that works do I have to wait till monday?",1668390268,-1
0.13,0.663,0.207,0.2165,SMOKING GUN! FTX was given go ahead (no-action relief) by SEC to embezzle investor digital asset securities in April.,1668385159,1
0.0,1.0,0.0,0.0,It appears Crypto.com is the next little brother of FTX,1668378165,0
0.0,1.0,0.0,0.0,How the FTX backdoor happened hack happened. Employee whistleblower.,1668404338,0
0.0,1.0,0.0,0.0,El Salvador President Bukele says Bitcoin is ‘the opposite‘ of FTX,1668417086,0
0.211,0.789,0.0,-0.4939,Crypto prices slide as investors pull funds from global exchanges after FTX collapse,1668400063,-1
0.0,1.0,0.0,0.0,SBF is a politician who used crypto currency for power,1668399081,0
0.0,1.0,0.0,0.0,SBF issues statement about current FTX situation,1668399225,0
0.0,1.0,0.0,0.0,Ownership Structure Behind FTX Trading Ltd,1668404191,0
0.0,1.0,0.0,0.0,The FTX Story Explained,1668409687,0
0.0,1.0,0.0,0.0,FTX-Induced Crypto Swoon Saps Bitcoin’s Sway on Global Investors,1668414511,0
0.0,1.0,0.0,0.0,FTX - What Happened?,1668414492,0
0.515,0.24,0.246,-0.5423,NuGenesis: Exposing SBF’s Great Crypto Fraud &amp; Crash,1668405430,-1
0.0,1.0,0.0,0.0,Wanna be more altruistic? Go work for Alameda or FTX!! + Arthur Breitman (Tezos) being woke and calling BS.,1668416416,0
0.0,1.0,0.0,0.0,"""Meltdown Being Tracked Real-Time"": Elon Musk On Reports About Crypto Exchange FTX Hacking",1668415830,0
0.234,0.683,0.083,-0.6369,"Kraken CEO Discusses Impact of FTX Failure — Says Damage to Crypto Industry Is Huge, Will Take Years to Undo – Featured Bitcoin News",1668405513,-1
0.0,1.0,0.0,0.0,Tens of Billions of US Dollars Were Transferred to Ukraine and then Using FTX Crypto Currency the Funds Were Laundered Back to Democrats in US,1668409825,0
0.208,0.737,0.054,-0.7003,Exchange outflows hit historic highs as Bitcoin investors self-custody. - The echos of the FTX collapse will likely shift the preference for trustless vs centrally issued assets.,1668400871,-1
0.0,1.0,0.0,0.0,"As regulators scrutinise FTX, investor focus swings to Crypto.com",1668410261,0
0.0,1.0,0.0,0.0,Company Ownership Structure Behind FTX Trading and SBF,1668403739,0
0.599,0.401,0.0,-0.4574,Damn you SBF!,1668397388,-1
0.313,0.476,0.211,-0.128,"Bahamas regulator contradicts FTX, says no approval given for withdrawals",1668398858,-1
0.0,1.0,0.0,0.0,Reddit vault is still directing users to FTX to buy eth for gas fees,1668399594,0
0.0,0.84,0.16,0.6486,"President Nayib Bukele: FTX is the opposite of Bitcoin. Bitcoin protocol was created precisely to prevent Ponzi schemes, bank runs, Enron’s, WorldCom’s, Bernie Madoff’s, Sam Bankman-Fried’s, bailouts and wealth reassignments. Some understand it, some not yet.",1668414652,1
0.0,1.0,0.0,0.0,Sam Bankman-Fried is just the frontman of a much larger network - starting with Dan Friedberg,1668401945,0
0.13,0.87,0.0,-0.4019,"FTX Crash, Trade dog research team has put an open mic on twitter to brain storm on twitter spaces.",1668413184,-1
0.292,0.708,0.0,-0.8726,"Isn’t this FTX crime major news? Possibly a larger fraud than Enron, Lehman Brothers or even Bernie Madoff. Why isn’t the mainstream media covering it? Not a peep. Interesting.",1668400529,-1
0.0,1.0,0.0,0.0,Elon Musk on meeting Sam Bankman-Fried.,1668420118,0
0.0,1.0,0.0,0.0,TRYING TO GET YOUR MONEY FROM FTX BE LIKE😂👇,1668416794,0
0.245,0.755,0.0,-0.3804,Second Tweet by SBF. Crypto Twitter now completely confused.,1668398242,-1
0.0,1.0,0.0,0.0,"Mt Gox or FTX, Cryptocurrencies are here to stay!",1668422471,0
0.0,1.0,0.0,0.0,SBF finally breaks his silence with a detailed explanation of what happened.,1668411257,0
