neg,neu,pos,compound,headline,time,label
0.155,0.845,0.0,-0.6283,"In all of this Luna, Celsius, three arrows and FTX mess the SEC is still perusing Brad Garlinghouse, Chris Larsen and Ripple. The regulators do not care about investor protection.",1668079530,-1
0.0,0.827,0.173,0.3182,"Without Details, Tron's Justin Sun Says He's 'Putting Together Solution' for FTX",1668077389,1
0.0,1.0,0.0,0.0,Is FTX.US also effected? or the issues are only on FTX.,1668068150,0
0.0,1.0,0.0,0.0,"Now that Binance has been FTX and Alameda books, they can now trade with this information",1668071785,0
0.242,0.758,0.0,-0.4939,Crypto Execs Ask for Clearer US Regulatory Policy After FTX Collapse,1668064344,-1
0.0,1.0,0.0,0.0,Tron's Justin Sun Announces Plans to Return ‘Normalcy for All FTX Users’ - Decrypt,1668085352,0
0.133,0.667,0.2,0.2732,Justin Sun Trying To Rescue FTX After Binance Says No to Acquisition Deal,1668069682,1
0.0,1.0,0.0,0.0,"TRX Momentarily Surges 4,000% on FTX After Justin Sun Emerges as Latest 'Would Be' FTX Savior",1668085752,0
0.351,0.649,0.0,-0.4019,Video about FTX and Solana problem,1668081220,-1
0.0,1.0,0.0,0.0,MicroStrategy stock plunges 35% amid Binance-FTX saga,1668073299,0
0.0,1.0,0.0,0.0,FTX - USDT Wallet has just been frozen,1668094064,0
0.146,0.854,0.0,-0.0572,FTX Has Made $34M in Trading Fees Since Recent FTT Token Burn Despite Withdrawal Freeze,1668089615,-1
0.0,1.0,0.0,0.0,"FTX appears to have resumed withdrawals, blockchain data shows",1668101965,0
0.152,0.798,0.05,-0.7299,"After FTX crash, Binance proves their reserves for almost all trading tokens. What is now official: they can’t prove Monero reserves, while do prove ZCash ones. Withdraw all your funds from Binance, regardless token names! Can you?! Or Binance is a scam like FTX?!",1668101348,-1
0.116,0.884,0.0,-0.2411,"I'm trying to understand what's happening with FTX, I'm not sure if my understanding is correct.",1668091281,-1
0.172,0.601,0.227,0.2075,So SBF lost 15 bil… what did he stand to gain?,1668093534,1
0.0,1.0,0.0,0.0,FTX address frozen after trying to move USDT,1668090272,0
0.121,0.728,0.151,0.1451,There are rumors that El salvador's BTC was on FTX and I hope it is not true.,1668087060,1
0.326,0.674,0.0,-0.743,Crack Down on US Crypto Firms Over FTX Crisis 'Makes No Sense': Coinbase CEO - Decrypt,1668088467,-1
0.145,0.855,0.0,-0.296,"'I F***** Up': FTX Needs $4 Billion to Avoid Bankruptcy, SBF Reportedly Tells Investors",1668094022,-1
0.0,1.0,0.0,0.0,Speculation that SBF is trying to short USDT!,1668087241,0
0.0,1.0,0.0,0.0,SBF out with his side of the story,1668089768,0
0.031,0.866,0.103,0.3752,"So let me get this straight, Binance's ""proof of funds"" is 100% comprised of cryptocurrency / tokens that can be worth -90% in the near future. Isn't it just like FTX marking FTT at 22 bucks on their books but on a much bigger scale? Is this even legal?",1668086967,1
0.216,0.784,0.0,-0.5106,SBF is a stone cold idiot on so many levels that it defies comprehension.,1668097004,-1
0.0,1.0,0.0,0.0,"FTX appears to be processing withdrawals again, on-chain data show",1668097170,0
0.0,1.0,0.0,0.0,FTX Pursuing 'Possible New Investors' As Embattled Exchange Works With Tron's Justin Sun: Report - The Daily Hodl,1668092517,0
0.216,0.784,0.0,-0.296,"Robinhood has no direct exposure to FTX, says CEO",1668101026,-1
0.0,1.0,0.0,0.0,SBF Tweetstorm!,1668089913,0
0.326,0.674,0.0,-0.743,Crack Down on US Crypto Firms Over FTX Crisis 'Makes No Sense': Coinbase CEO - Decrypt,1668094320,-1
0.0,1.0,0.0,0.0,Sam is back with a new Tweet thread,1668089699,0
0.0,1.0,0.0,0.0,Is the FTX situation similar to Mt Gox?,1668088332,0
0.0,1.0,0.0,0.0,FTX - Stablecoin wallet has been frozen,1668094675,0
0.061,0.939,0.0,-0.0258,"Tether freezes $46 million $USDT linked to an FTX address at the request of law enforcement, CoinDesk reports.",1668092427,-1
0.0,1.0,0.0,0.0,"After watching the downfall of FTX, do y’all have any recommendations for a hardware wallet?",1668086581,0
0.0,1.0,0.0,0.0,Tether froze transaction on FTX USDT. Is this the end for FTX?,1668091625,0
0.0,1.0,0.0,0.0,Crypto Exchange FTX Reopens Withdrawals: Nansen,1668102032,0
0.0,0.794,0.206,0.3818,"Sam Bankman-Fried Says Alameda Winding Down, Promises FTX US Customers 'Fine'",1668092205,1
0.0,0.85,0.15,0.3182,Zhu Su retweeted that SBF was responsible for the fall of 3AC &amp; Luna,1668100485,1
0.348,0.652,0.0,-0.5859,Deepwaters WTR airdrop for people affected by the FTX collapse [serious],1668087978,-1
0.0,1.0,0.0,0.0,The Sam Bankman-Fried empire crumbled. What happened? (part one),1668100793,0
0.0,1.0,0.0,0.0,Untangling the knotty empire of Bankman-Fried and FTX,1668090757,0
0.0,1.0,0.0,0.0,"Twitter Space on FTX/Alameda Research, NFT Flippening &amp; general market slump!",1668089308,0
0.227,0.773,0.0,-0.6249,What happened to FTX and could the crisis spill over to the rest of crypto?,1668100484,-1
0.0,1.0,0.0,0.0,FTX - Stablecoin wallet has been frozen,1668094441,0
0.394,0.606,0.0,-0.0772,SBF's sorry tweet,1668098864,-1
0.0,1.0,0.0,0.0,FTX US Derivatives (formerly LedgerX) releases statement saying the two businesses are functionally separate,1668093598,0
0.0,0.68,0.32,0.5106,"FTX, Iran and the myth of free market",1668089254,1
0.0,1.0,0.0,0.0,FTX approaches Kraken amid scramble to find funding,1668094713,0
0.0,0.816,0.184,0.2023,SBF Playing Video Games While the Crypto World Burns,1668093847,1
0.245,0.755,0.0,-0.8122,"And... yeah... I know, its the hardest thing to say. But, @SBF_FTX based on his ""sense"" to calculate the risk 🙃. Nah, this time, you sorry but you lost most of users heart! -- SBF's sorry tweet: https://twitter.com/sbf_ftx/status/1590709166515310593",1668098610,-1
0.108,0.892,0.0,-0.3182,It's being speculated that El Salvador Lost All Bitcoins On FTX. President Bukele demands the immediate extradition of Sam Bankman-Fried,1668086030,-1
0.248,0.752,0.0,-0.5106,SEC's Gensler says more investor protection is needed after FTX fiasco,1668093422,-1
0.394,0.606,0.0,-0.0772,SBF's sorry tweet:,1668099038,-1
0.0,1.0,0.0,0.0,"Twitter Space on FTX/Alameda Research, NFT Flippening &amp; general market slump!",1668092793,0
0.167,0.833,0.0,-0.4588,"A ‘cascade of margin calls’ deleveraging, crypto failures and bitcoin at $13,000 are likely amid FTX fallout",1668092757,-1
0.0,1.0,0.0,0.0,Nansen: FTX has reopened withdrawals,1668099222,0
0.109,0.569,0.322,0.5023,"SBF is sorry, but will he be forgiven?",1668090311,1
0.0,0.792,0.208,0.5696,Tree of Alpha confirmed on twitter only friends of SBF able to withdraw from FTX!!,1668101659,1
0.0,1.0,0.0,0.0,SBF explains. 21 tweet thread condensed into text.,1668095806,0
0.197,0.803,0.0,-0.4019,SBF Secretly Moved FTX Client Funds to Alameda After Spring Losses: Report,1668095686,-1
0.0,1.0,0.0,0.0,Holy moly. El Salvador's supply of bitcoins might possibly been on FTX. An entire nation rugged.,1668087133,0
0.0,1.0,0.0,0.0,Tether has Frozen FTX's USDT,1668090860,0
0.0,1.0,0.0,0.0,"Twitter Space on FTX/Alameda Research, NFT Flippening &amp; General Market Slump!",1668091602,0
0.084,0.916,0.0,-0.0258,"Report: Tether freezes $46M of FTX's USDT on Tron blockchain, setting new precedent",1668095874,-1
0.0,1.0,0.0,0.0,Crypto Exchange FTX Reopens Withdrawals: Nansen,1668099217,0
0.0,1.0,0.0,0.0,Is El Salvador's bitcoin on FTX?,1668086947,0
0.348,0.652,0.0,-0.5859,Deepwaters WTR airdrop for people affected by the FTX collapse [serious],1668087531,-1
0.146,0.78,0.073,-0.3612,"Within 24 hours of the Coindesk article attacking FTX, Binance launched its first US-targeted ad campaign through Meta",1668092686,-1
0.151,0.849,0.0,-0.4939,"SEC Chair GaryGensler on The FTX Collapse &amp; Regulation | ""Running Out of Runway"" | 11/10/22 | Featuring Cory Klippsten and SBF",1668089705,-1
0.0,0.645,0.355,0.5106,FTX approaches Kraken for potential rescue deal,1668097070,1
0.108,0.853,0.039,-0.7003,"‘I fucked up,’ says FTX founder in public apology | Binance backed out of the deal to acquire FTX, investors in the company are marking it down to zero, Alameda Research is winding down trading and FTX is left scrambling for liquidity, but at least Sam Bankman-Fried is admitting he made mistakes.",1668092141,-1
0.13,0.87,0.0,-0.2023,"FTX Tapped Into Customer Accounts to Fund Risky Bets, Setting Up Its Downfall",1668094148,-1
0.108,0.739,0.153,0.2023,So have we all forgotten that FTX partnered with Reddit to help with Moons integration?,1668100186,1
0.0,1.0,0.0,0.0,"SBF Says FTX to Raise Funds, Binance ""Never Really Planned"" with Acquisition",1668090662,0
0.186,0.814,0.0,-0.4939,"SEC Chair Gary Gensler on The FTX Collapse, Crypto Regulation | ""Running Out of Runway"" | 11/10/22",1668099138,-1
0.339,0.661,0.0,-0.477,FTX Warns of Bankruptcy Without Rescue for $8 Billion Shortfall,1668086273,-1
0.135,0.791,0.073,-0.5781,"Binance makes a proof-of-reserves even for private coins (ZCash), but NOT Monero. Try it yourself. And release, whether Binance is a scam like FTX, LUNA, MTGOX, etc?! Can you withdraw all your funds from Binance right now? Check it!",1668102209,-1
0.0,0.796,0.204,0.3182,justin sun say he is working on a solution with ftx,1668086775,1
0.073,0.727,0.2,0.4767,Survived the SBF Storm. Time to quit and leave or is this the bottom?,1668090732,1
0.0,1.0,0.0,0.0,Blockfolio/FTX.com is still 'offering' 8% APY for crypto &amp; fiat.,1668100123,0
0.242,0.758,0.0,-0.4939,Message from the founders - Bitpanda’s response to the collapse of FTX,1668101681,-1
0.412,0.588,0.0,-0.4215,FTX Ceo is now broke.,1668088427,-1
0.252,0.748,0.0,-0.4019,"Michael Saylor discusses FTX crash, saying it was predicted",1668099334,-1
0.0,1.0,0.0,0.0,"After watching the downfall of FTX, do y’all have any recommendations for a hardware wallet?",1668086399,0
0.444,0.556,0.0,-0.4939,FTX Collapse Timeline: Nov 2 - Today,1668098874,-1
0.0,1.0,0.0,0.0,FTX - USDT Wallet has been frozen,1668093840,0
0.0,1.0,0.0,0.0,What can I use in place of FTX portfolio tracking?,1668087070,0
0.326,0.552,0.122,-0.5719,"Crypto billionaire Sam Bankman-Fried blames himself for FTX's collapse, admits he 'f---ed up'",1668101654,-1
0.796,0.204,0.0,-0.5994,FTX - die ?,1668088515,-1
0.084,0.916,0.0,-0.0258,Tether freezes 46.3 million USDT owned by FTX at request of law enforcement,1668092170,-1
0.0,1.0,0.0,0.0,FTX appears to have resumed withdrawals Blockchain data shows,1668098909,0
0.185,0.726,0.089,-0.296,FTX Japan Ordered by Regulator to Suspend Operations Following Withdrawal Halt,1668092433,-1
0.0,1.0,0.0,0.0,Email from FTX.US (Derivatives),1668091361,0
0.0,1.0,0.0,0.0,Reddit's replacement of FTX?,1668117454,0
0.0,0.901,0.099,0.0258,Sam Bankman-Fried on How to Prevent the Next Terra and 3AC,1668122456,1
0.583,0.417,0.0,-0.1027,FTX Bailout,1668112578,-1
0.0,0.825,0.175,0.1779,FTX Digital Markets Assets Frozen by Bahamian Regulator: Bloomberg,1668120195,1
0.355,0.645,0.0,-0.6705,"CPI Pumps Markets, FTX Crypto Crash, Dollar Weakness, Bitcoin FTT &amp; Solana",1668109598,-1
0.215,0.785,0.0,-0.6249,What happened to FTX and could the crisis spill over to the rest of crypto? | Cryptocurrencies,1668118797,-1
0.16,0.84,0.0,-0.2263,FTX Users Pull Millions Off the Exchange as Limited Withdrawals Resume,1668109455,-1
0.0,1.0,0.0,0.0,LayerZero Labs bought back its stake from FTX Ventures and Alameda,1668115060,0
0.0,1.0,0.0,0.0,FTX US Message on Trading/Withdrawals,1668124253,0
0.0,1.0,0.0,0.0,Someone just paid 3751% over market for TRON on FTX,1668123311,0
0.385,0.615,0.0,-0.3612,FTX joins other fallen projects,1668117511,-1
0.0,1.0,0.0,0.0,How can anyone invest in crypto after the FTX debacle?,1668123412,0
0.0,1.0,0.0,0.0,Some news came to light about FTX Withdrawals,1668116677,0
0.097,0.629,0.274,0.6808,US customers you should thank you government for the regulations you cry about + how are the CEOs of celcius and FTX free and safe?,1668106304,1
0.0,1.0,0.0,0.0,"Over $250,000,000 in Bitcoin Withdrawn From FTX",1668122697,0
0.193,0.588,0.218,0.0772,FTX US resigns from the Crypto Council for Innovation,1668113987,1
0.0,0.853,0.147,0.2263,"‘Thank God’ El Salvador doesn’t have any Bitcoin on FTX, CZ clarifies",1668104619,1
0.0,1.0,0.0,0.0,Not my favourite sub but this post rightly called out shady FTX behaviour around liquidations in 2021,1668117054,0
0.0,1.0,0.0,0.0,FTX CEOs Health Was Deteriorating Before FTT Alameda Implosion,1668105854,0
0.256,0.628,0.116,-0.4404,JPMorgan says FTX collapse fallout could cut the value of cryptocurrencies in half before it's over,1668104819,-1
0.0,0.803,0.197,0.4019,New Report Shows FTX Used Customer's Crypto Funds To Support Almeda Research,1668119487,1
0.0,0.769,0.231,0.5994,Apparently FTX started marketing with fortune cookies a while ago? Timely fortune for me lmao,1668110071,1
0.0,1.0,0.0,0.0,"FTX CEO can End Up in Jail, SEC, DOJ Probing",1668102436,0
0.0,1.0,0.0,0.0,FTX has done it… hardware wallet come at me!,1668111651,0
0.0,1.0,0.0,0.0,Is FTX.US Next?,1668105794,0
0.185,0.672,0.143,-0.128,"Voyager has no assets on FTX, says deal not done",1668107704,-1
0.24,0.48,0.279,0.2263,Tom Brady and other super wealthy investors lost big money in the FTX crypto collapse,1668103287,1
0.279,0.597,0.124,-0.4767,TRX and FTX Manipulating Markets Through Using TRX As Only Withdrawable Asset And Disabling Deposits,1668112717,-1
0.199,0.682,0.119,-0.34,Sam Bankman-Fried might've just committed another crime (NO CLICKBAIT). Partnering with Tron (Justin Sun).,1668112707,-1
0.112,0.69,0.198,0.25,Expect a pump and dump as SBF and Justin Sun reached an agreement allows withdrawals from FTX using Sun-related tokens,1668121339,1
0.318,0.682,0.0,-0.4215,DAI/USD broke $2 on FTX US yesterday.,1668110506,-1
0.287,0.425,0.288,0.0085,"EXCLUSIVE Behind FTX's fall, battling billionaires and a failed bid to save crypto",1668108128,1
0.32,0.68,0.0,-0.5106,"With FTX Failing, Could We See More Regulation?",1668115185,-1
0.39,0.61,0.0,-0.4939,Latest Developments Following the FTX Collapse,1668113593,-1
0.239,0.514,0.247,-0.2298,FTX and Tron Have Launched a Highly Suspicious Withdrawal Scheme,1668117006,-1
0.0,1.0,0.0,0.0,FTX Crypto Exchange Boss Says He Is Trying to Raise More Money,1668103625,0
0.0,1.0,0.0,0.0,Republican lawmaker claims SEC chair was coordinating with FTX 'to obtain regulatory monopoly',1668110976,0
0.0,1.0,0.0,0.0,Question about ftx.,1668106617,0
0.185,0.596,0.219,0.128,FTX scrambles for rescue funds as crypto worries spread (Justin sun),1668103263,1
0.099,0.901,0.0,-0.0258,Tether Freezes $46M of USDT Held by FTX Following Law-Enforcement Request,1668105160,-1
0.0,1.0,0.0,0.0,Where should EU users of FTX migrate to?,1668106969,0
0.149,0.851,0.0,-0.1027,FTX.US warns 'trading may be halted' in coming days,1668110217,-1
0.0,1.0,0.0,0.0,Did crypto influencers get burned by FTX?,1668103218,0
0.0,1.0,0.0,0.0,Someone just paid 3751% over market price to withdraw from FTX,1668123600,0
0.138,0.862,0.0,-0.1531,How will Reddit Community points be affected by the FTX saga?,1668122222,-1
0.181,0.556,0.264,0.296,Do Kwon vs. SBF - who would win in a fist fight?,1668117796,1
0.186,0.814,0.0,-0.6249,FTX Liquidity Crisis of 2022: Regulation in the Cryptosphere is coming one way or another. Historic precedent demonstrates why.,1668120821,-1
0.0,0.658,0.342,0.3818,FTX Announcement Regarding Tron Credit Facility,1668102563,1
0.0,0.779,0.221,0.1779,71% if Hodlnaut's assets were with FTX,1668118606,1
0.0,1.0,0.0,0.0,US authorities investigate crypto exchange FTX,1668111828,0
0.0,1.0,0.0,0.0,FTX still sponsoring the Cricket World Cup,1668114754,0
0.0,1.0,0.0,0.0,"FTX Once Again Processing Withdrawals, On-Chain Data Shows",1668102960,0
0.0,1.0,0.0,0.0,James Altucher theory about behind the scenes with CZ and SBF,1668105274,0
0.0,1.0,0.0,0.0,"White House says 'prudent regulation of cryptocurrencies' is needed, hinting at situation with FTX",1668117471,0
0.0,0.87,0.13,0.2023,"Tron Agrees to Swap TRX, BTT, JST, SUN, and HT 1:1 From FTX",1668104002,1
0.0,1.0,0.0,0.0,FTX-Backed Crypto Unicorn LayerZero Bought Out Stake,1668108464,0
0.0,1.0,0.0,0.0,"Kraken's Jesse Powell Blasts FTX CEO, Lists All Red Flags About SBF",1668109332,0
0.266,0.734,0.0,-0.4404,JPMorgan Sees Wave of Crypto Deleveraging From FTX’s Woes,1668102254,-1
0.39,0.61,0.0,-0.4939,R/investing take on the FTX collapse,1668108739,-1
0.167,0.833,0.0,-0.1027,Did crypto influencers get burned hard with FTX?,1668103170,-1
0.0,1.0,0.0,0.0,FTX May Be Looking to Kraken for Help—But Jesse Powell Says There Are 'Red Flags',1668108117,0
0.053,0.789,0.158,0.5994,"If you have funds on FTX US it’s time to get them off. Don’t be lazy, don’t think it will all be ok. Protect yourself. Because the regulators were meeting with FTX and did nothing about it. They won’t protect you.",1668113916,1
0.0,0.782,0.218,0.3034,EXCLUSIVE Bankman-Fried seeks $9.4 bln package for FTX rescue-sources,1668107350,1
0.298,0.442,0.26,-0.1779,"Exclusive: Behind FTX's fall, battling billionaires and a failed bid to save crypto",1668118113,-1
0.104,0.896,0.0,-0.1027,FTX US Warns Users That Trading Could Be Halted 'In a Few Days' - Decrypt,1668116055,-1
0.0,1.0,0.0,0.0,FTX’s U.S. website says trading ‘may be halted’ in a few days but withdrawals still available,1668105076,0
0.304,0.696,0.0,-0.5859,FTX fallout - To those affected in the UK (Lost or stolen crypto assets),1668113607,-1
0.276,0.724,0.0,-0.5319,Crypto CRASH Explained (FTX Insolvent &amp; SBF Going to JAIL),1668117109,-1
0.0,0.595,0.405,0.5267,Brave browser is still hyping FTX.,1668118472,1
0.479,0.521,0.0,-0.6808,What the Hell Happened to FTX?,1668107292,-1
0.0,1.0,0.0,0.0,"White House says ‘prudent regulation of cryptocurrencies‘ is needed, hinting at situation with FTX",1668119775,0
0.0,1.0,0.0,0.0,Limit FTX-related posts =&gt; cclimits.herokuapp.com,1668109880,0
0.0,1.0,0.0,0.0,"Justin Sun of Tron Intervenes, FTX Resumes Operations",1668104848,0
0.134,0.472,0.394,0.5106,Could you please help me with my ftx dilemma,1668106920,1
0.0,0.839,0.161,0.3612,"Not all companies in cyrpto are set up like FTX was, says Coinbase CEO",1668116796,1
0.0,1.0,0.0,0.0,Can someone explain what is happening to FTX and why?,1668109847,0
0.298,0.442,0.26,-0.1779,"Exclusive: Behind FTX's fall, battling billionaires and a failed bid to save crypto",1668110618,-1
0.186,0.643,0.171,-0.0516,SBF has time to play League between losing billions of dollars.,1668108617,-1
0.0,1.0,0.0,0.0,AP source; US authorities investigate crypto exchange FTX,1668104697,0
0.16,0.84,0.0,-0.2732,Bored Ape Yacht Club NFT Prices Fall After FTX Sinks Crypto Market,1668124146,-1
0.191,0.809,0.0,-0.3818,Sam Bank-Fried of FTX Lied in front of US Lawmakers about Transparency,1668106417,-1
0.0,0.517,0.483,0.4215,Are we saved? - FTX,1668112195,1
0.412,0.588,0.0,-0.2732,FTX Risk Management 2022,1668102955,-1
0.0,0.826,0.174,0.2732,BlockFi exchange has paused withdrawals as well because of FTX deal,1668132111,1
0.0,0.746,0.254,0.1779,FTX assets frozen by Bahamas regulator 📉,1668138608,1
0.297,0.703,0.0,-0.4215,FTX Arena Deal Spurs Miami-Dade Warning About Need to Pay Up,1668138404,-1
0.262,0.738,0.0,-0.4939,Crypto lender BlockFi pauses withdrawals in wake of FTX's collapse,1668138336,-1
0.0,0.633,0.367,0.5859,Tom Emmer on Twitter - Gary Gensler helping FTX create a monopoly through legal loopholes.,1668141922,1
0.0,0.805,0.195,0.1779,FTX Digital Market Assets frozen by Bahamas regulator.,1668137697,1
0.0,1.0,0.0,0.0,Who's next after FTX?,1668132227,0
0.225,0.775,0.0,-0.4404,"Cryptocurrency exchange FTX now worthless, says key investor | Cryptocurrencies | The Guardian",1668126358,-1
0.126,0.874,0.0,-0.0772,"‘I’m sorry, I f****d up.’ Sam Bankman-Fraud needs $4 billion. Fast.",1668128523,-1
0.0,0.909,0.091,0.0258,Massive hit for 5 Cryptocurrency amidst backed off acquisition between Binance and FTX.,1668139373,1
0.0,0.795,0.205,0.3786,Convert my FTX balance to SOL a chance to get out !!,1668149216,1
0.313,0.522,0.165,-0.4019,Sequoia Associate Who Prepared FTX Investment Memo Fired,1668146125,-1
0.0,1.0,0.0,0.0,"With SBF's Rapid Demise, Signs of a Clinton-Led Patsy Narrative Abound",1668135902,0
0.0,0.784,0.216,0.296,Binance shares proof of reserves amid FTX crypto meltdown,1668137750,1
0.341,0.519,0.141,-0.4019,"JPMorgan Warns FTX Collapse Will Spark ""Cascade Of Margin Calls""",1668142844,-1
0.286,0.714,0.0,-0.4939,Senators moving forward with SBF-backed bill after FTX collapse,1668133604,-1
0.0,1.0,0.0,0.0,FTX Fortune Cookie,1668143379,0
0.044,0.857,0.099,0.3612,"TIL Barbara Fried (Scam's mother) is the founder and president of MTG, the second largest Democratic donor in the 2020 American presidential election. Congrats to all the Libertarians and Republicans who had funds on FTX, as arguably you helped Democratics achieve victory.",1668151007,1
0.0,1.0,0.0,0.0,Do you think Netflix has already started the docu-series about the fall of FTX and the real story behind Sam Baked-fried Chicken?,1668133110,0
0.325,0.351,0.325,-0.25,Scam Alert: FTX Impersonators Launched 'Compensation Program',1668139788,-1
0.262,0.738,0.0,-0.4939,Crypto Lender BlockFi Pauses Withdrawals in Wake of FTX Collapse,1668130511,-1
0.0,1.0,0.0,0.0,Non KYC FTX account,1668144062,0
0.0,0.526,0.474,0.4019,Non-KYC FTX account help,1668145612,1
0.0,0.764,0.236,0.4019,Yo Meta...FTX Saga Creates Highest Crypto Social Activity Ever With Over 6.9 Billion Engagements,1668129025,1
0.0,0.8,0.2,0.3612,California State Regulator (DFPI) Announces Investigation Into Crypto Asset Platform FTX,1668131115,1
0.353,0.647,0.0,-0.7963,The Claman Countdown - FTX crisis doesn't change long-term success of crypto: Coinbase CFO Alesia Hass,1668132887,-1
0.278,0.722,0.0,-0.4019,"Crypto Lender BlockFi Halts Withdrawals, Citing FTX’s Problems",1668143908,-1
0.0,0.841,0.159,0.1779,FTX US employees attempt to sell assets in CEO’s absence,1668148951,1
0.0,1.0,0.0,0.0,I made a video about SBF and Warren Buffet 3 months ago… it aged poorly to say the least (except for the end comparison to 3AC),1668138116,0
0.0,0.775,0.225,0.4404,SBF asked if he knew lawyers that can show good results,1668145859,1
0.238,0.524,0.238,-0.25,"Crypto Lending Platform BlockFi Announces Withdrawal Freeze, Blames 'Lack of Clarity' at FTX and Alameda Research",1668147996,-1
0.248,0.752,0.0,-0.5106,Ontario Teachers' Pension Plan invested US$95M into failing crypto platform FTX,1668137568,-1
0.0,1.0,0.0,0.0,Do you think Netflix has already started the docu-series about the fall of FTX and the real story behind Sam Baked-fried Chicken?,1668133985,0
0.138,0.375,0.488,0.4215,Bahamas securities regulator freezes FTX assets,1668124731,1
0.0,0.909,0.091,0.0258,Massive hit for 5 Cryptocurrency amidst backed off acquisition between Binance and FTX.,1668138730,1
0.0,1.0,0.0,0.0,Alchemy Crypto CyPheR!!11/11/22 XRP latest news/FTX/SbF arrested/jump on into the cypha y’all!,1668147366,0
0.0,1.0,0.0,0.0,What's the status of your FTX withdrawals?,1668142444,0
0.186,0.814,0.0,-0.1531,BlockFi’s Been Affected by the FTX shenanigans too,1668130436,-1
0.0,0.784,0.216,0.5106,"After Rattling Confidence in FTX, Binance Still Holds 5% of FTT Supply - Decrypt",1668127034,1
0.0,1.0,0.0,0.0,Binance vs FTX,1668131900,0
0.0,0.665,0.335,0.5473,SBF asking Kim Dotcom for lawyer referral LOL,1668140694,1
0.121,0.879,0.0,-0.296,According to the CTO of Tether there will be no loans or investments to bail out FTX.,1668143248,-1
0.038,0.753,0.21,0.7506,"Maybe now this will get the attention it should have gotten months ago. SBF interview leaves Matt Levine stunned - ""You're just like, well, I'm in the Ponzi business and it's pretty good.""",1668141614,1
0.0,1.0,0.0,0.0,Crypto News Live Update Nov 11: FTX Price Jumps By 40%,1668148950,0
0.0,0.901,0.099,0.0258,"I've been sitting under ""withdrawal requested"" for nearly 4 hours.... FTX US",1668131711,1
0.412,0.588,0.0,-0.6808,Investment Bank CEO Tried Warning SBF About FTX's Potential Collapse,1668140722,-1
0.3,0.7,0.0,-0.4588,Jeez how far does this FTX contagion go?,1668148494,-1
0.121,0.879,0.0,-0.296,"BlockFi says it can no longer operate business as usual due to FTX, is halting user withdrawls",1668131916,-1
0.194,0.758,0.047,-0.8011,FTX meltdown and contagion fears spreading through the markets are getting worse with Binance and BlockFi statements recently. Please get your crypto off exchanges and into wallets people! Get in control of your own keys or they are not your coins!,1668139073,-1
0.0,1.0,0.0,0.0,Sam Bankman-Fried goes from toast of Washington to political pariah,1668146599,0
0.0,0.7,0.3,0.5739,FTX Arena 😅... Jail time for SBF... I hope you don't drop the soap,1668130542,1
0.0,0.795,0.205,0.3786,convert my FTX balance to SOL a chance to get out !!,1668148886,1
0.0,1.0,0.0,0.0,FTX traded against us with our own money illegally,1668144614,0
0.0,1.0,0.0,0.0,Jubi-Ex or COIN-FTX,1668147756,0
0.059,0.896,0.045,-0.169,"UPDATE: Yet again Genesis is admitting to hundreds of millions in losses on FTX, despite initially falsely denying exposure with fancy technical lawyer speak. Withdraw your loans to them, we dont know how deep this really goes or if they are solvent anymore.",1668135651,-1
0.226,0.774,0.0,-0.5233,Shower thoughts: The entities FTX is asking for a bailout have the most to lose if FTX falls,1668134565,-1
0.147,0.705,0.147,0.0,Bankman-Fried’s Struggle to Start Alameda Research | Solution? Start FTX to print infinite money.,1668143584,0
0.0,0.756,0.244,0.2263,Bahaman Regulator asks court to freeze FTX Assets and appoint liquidator,1668136658,1
0.0,0.76,0.24,0.8834,"Sequoia Capital Writes Down Entire Value of Its FTX Stake - In September, Sequoia called Bankman-Fried ""a legend"" and held up his “savior complex” as worth emulating. Full memo sent to Sequoia LPs re FTX below: lol and we are the retards…. Haha ok 🤡🩳☠️🪦",1668143253,1
