neg,neu,pos,compound,headline,time,label
0.0,0.543,0.457,0.6369,Best article to understand FTX story?,1668568434,1
0.386,0.52,0.095,-0.7728,"FTX... fool me once, shame on you. fool me twice, you can't get fooled again.-GW Bush🤣",1668545395,-1
0.0,1.0,0.0,0.0,Australian exchange DigitalSurge halting all withdrawals due to their exposure to FTX - another one down,1668557688,0
0.0,1.0,0.0,0.0,FTX Gensler Ties,1668564055,0
0.0,1.0,0.0,0.0,2 More Crypto Platforms Pause Withdrawals as Liquid Global and Salt Lending Cite Exposure to FTX,1668547548,0
0.171,0.829,0.0,-0.4767,Australia-based crypto exchange Digital Surge has temporarily suspended withdrawals and deposits citing “limited exposure” to FTX.,1668557146,-1
0.0,1.0,0.0,0.0,Did you score the 2022 trifecta? LUNA:CELSIUS:FTX,1668549585,0
0.0,0.826,0.174,0.2263,It’s okay SBF has his customers as his first priority,1668605277,1
0.225,0.775,0.0,-0.4939,Genesis’ Crypto-Lending Unit Is Halting Customer Withdrawals in Wake of FTX Collapse,1668604095,-1
0.0,1.0,0.0,0.0,FTX hacker is now one of the largest ETH holders,1668574058,0
0.451,0.549,0.0,-0.6249,Meet Kevin explaining the FTX crisis,1668599309,-1
0.225,0.775,0.0,-0.4939,Genesis’ Crypto-Lending Unit Is Halting Customer Withdrawals in Wake of FTX Collapse,1668603841,-1
0.0,1.0,0.0,0.0,FTX downfall was a turning point for citizen journalism: Coinbase CEO,1668581272,0
0.226,0.774,0.0,-0.5423,Solana entities sold 50M tokens to FTX — How long will SOL price suffer?,1668592287,-1
0.0,1.0,0.0,0.0,"Celebrities, Investors Scramble To Erase Evidence of SBF Ties",1668596565,0
0.0,1.0,0.0,0.0,"Crypto Lender BlockFi Pauses Platform Activity, Prepares for Bankruptcy Amid FTX Drama",1668597742,0
0.0,1.0,0.0,0.0,Will SBF face consequences for mismanaging FTX? Don’t count on it,1668577890,0
0.0,1.0,0.0,0.0,Kevin O’Leary shilling for FTX,1668603771,0
0.0,1.0,0.0,0.0,Sam Bankman-Fried Still Trying To Raise Fund For FTX,1668578457,0
0.365,0.635,0.0,-0.3182,Visualized: FTX’s Leaked Balance Sheet,1668580448,-1
0.0,1.0,0.0,0.0,FTX’s former CEO claims crypto exchange is still solvent | Cryptocurrencies | The Guardian,1668601006,0
0.068,0.862,0.07,0.0129,"Solana has lost 60% of its market value in a week due to its exposure to FTX. But what's next for the ""Ethereum killer""?",1668602003,1
0.0,1.0,0.0,0.0,Crypto Lender BlockFi Prepares To Go Belly Up Amid FTX Bankruptcy,1668588469,0
0.0,1.0,0.0,0.0,Bankman-Fried: Cryptocurrency Exchange FTX,1668593019,0
0.0,0.635,0.365,0.3182,Solution for SBF on Twitter,1668580514,1
0.0,1.0,0.0,0.0,Australia suspends FTX's financial services license,1668585298,0
0.16,0.84,0.0,-0.2263,FTX bankruptcy can lead to delayed institutional crypto adoption: ARK Invest,1668588689,-1
0.0,1.0,0.0,0.0,Was FTX Being Used As A Back Door To Short GameStop &amp; Tesla Stocks?,1668601125,0
0.0,1.0,0.0,0.0,Zero-Knowledge proof of solvency for crypto exchanges: How to detect the next FTX and Mt. Gox,1668591142,0
0.198,0.802,0.0,-0.8126,Kevin O'Leary says SBF is a “brilliant trader” &amp; would still invest in his projects again even after he was exposed as a liar and fraudster 🤡. He was also a paid spokesperson for FTX...and an investor in FTX. He is also lobbying in DC.,1668576085,-1
0.0,1.0,0.0,0.0,At least it mentions his relationship with ftx,1668599191,0
0.202,0.798,0.0,-0.5106,FTX's failure had nothing to do with the fact that it was doing crypto,1668595168,-1
0.0,1.0,0.0,0.0,Have an idea for FTX Arena rebrand name? Who do you think should get the branding rights next?,1668574431,0
0.0,1.0,0.0,0.0,FTX downfall was a turning point for citizen journalism: Coinbase CEO,1668580197,0
0.0,1.0,0.0,0.0,"Silvergate, the mother bank behind lots of crypto exchanges, including FTX, is dropping fast. Move your coins to cold wallets now when you still can",1668582869,0
0.0,1.0,0.0,0.0,Bankman-Fried: Cryptocurrency Exchange FTX,1668592914,0
0.0,1.0,0.0,0.0,What is SBF’s deal?,1668594850,0
0.0,0.825,0.175,0.5267,Kusunoki Samurai: Become A Warrior Who Transcends Time And Gain Access To the Kusunoki Token And The Metaverse,1668592577,1
0.307,0.693,0.0,-0.7351,FBI is planning to extradite SBF as crypto contagion from FTX collapse spreads to $20BN BlockFi,1668592888,-1
0.333,0.667,0.0,-0.25,SBF Ruining My Life - Reminder,1668602685,-1
0.3,0.7,0.0,-0.4588,Gemini Earn halts withdrawals as FTX contagion continues,1668605186,-1
0.0,0.465,0.535,0.3182,SBF cool GIF,1668602871,1
0.0,1.0,0.0,0.0,Kevin O’Leary would back Sam Bankman-Fried again if he had a new venture,1668597171,0
0.0,1.0,0.0,0.0,FTX’s Bahamas Arm Files for Bankruptcy Protection in US,1668592232,0
0.0,0.61,0.39,0.8074,Special Report: FTX&amp;#x27;s Bankman-Fried begged for a rescue even as he revealed huge holes in firm&amp;#x27;s books,1668598826,1
0.0,1.0,0.0,0.0,"Not Your Keys, Not Your Crypto: What to Know Before the Next FTX-type Meltdown",1668595229,0
0.0,0.556,0.444,0.5859,Please explain what happen to FTX like I’m 5,1668574080,1
0.0,1.0,0.0,0.0,"FTX drainer sells more BNB, now 34th largest holder of ETH",1668605231,0
0.0,1.0,0.0,0.0,Caroline Ellison - SBF - Bernie Madoff,1668604564,0
0.432,0.568,0.0,-0.5859,FTX Accounting Fraud - In Depth Look,1668592915,-1
0.0,1.0,0.0,0.0,"SBF's Mom's Book ""Facing Up to Scarcity: The Logic and Limits of Nonconsequentialist Thought""",1668575376,0
0.0,0.779,0.221,0.1779,How to Buy Amazon Tokenized (FTX) Stock?,1668589539,1
0.0,1.0,0.0,0.0,Silver Lining to the FTX Saga | 0.1 BTC Hodler Numbers Rises to 4 Million,1668587346,0
0.0,1.0,0.0,0.0,Caroline Ellison - SBF - Bernie Madoff,1668604728,0
0.0,1.0,0.0,0.0,"Lawyer who beat Microsoft, repped Theranos, eyes suit against FTX's celeb backers",1668587858,0
0.0,1.0,0.0,0.0,Will Nike's .Swoosh thrive or Bite the Dust? (FTX Aftermath),1668605376,0
0.18,0.82,0.0,-0.296,FTX downfall associated with Digital Surge (Australia) no longer exchanging crypto/fiat,1668605638,-1
0.0,1.0,0.0,0.0,FBI is planning to extradite SBF to the U.S,1668597493,0
0.0,1.0,0.0,0.0,Who is the next SBF?,1668605199,0
0.0,1.0,0.0,0.0,Sam Bankman-Fried: The fall of the crypto king,1668587396,0
0.057,0.943,0.0,-0.25,"Messari estimates up to 50% of FTX user funds recoverable. According to ""rough balance sheet"" calculations, FTX users whose funds are stuck on the exchange are more likely to have less than 40% returned.",1668599323,-1
0.0,0.682,0.318,0.6808,FTX's Bankman-Fried begged for a rescue even as he revealed huge holes in firm's books,1668606154,1
0.0,1.0,0.0,0.0,if your money was with FTX,1668582568,0
0.216,0.784,0.0,-0.296,Further details emerge on FTX bankruptcy and missing funds,1668587273,-1
0.252,0.748,0.0,-0.4019,SBF has been posting absolute nonsense on his twitter,1668581263,-1
0.0,0.724,0.276,0.6369,New York Times' ‘Breathless Love Letter’ to SBF Lambasted by Crypto Community,1668596501,1
0.0,1.0,0.0,0.0,David Portnoy eloquently describes the FTX situation,1668603061,0
0.0,1.0,0.0,0.0,Genesis Suspending Client Withdrawals for Lending Arm Citing 'FTX Impact',1668607948,0
0.0,1.0,0.0,0.0,How FTX’s fallout impacts the world of cryptocurrency,1668608363,0
0.0,1.0,0.0,0.0,FTX Exchange Outflow of $600 Million: Insider Theft or Hack?,1668617054,0
0.153,0.847,0.0,-0.4019,Upper Echelon Dug into the folks involved in the FTX crash and the connections are wild.,1668609546,-1
0.0,1.0,0.0,0.0,"DCG Digital Currency Group, Genesis, Grayscale Investments is the next domino to go after LUNA, 3AC, Celcius, Voyager, FTX , Luno",1668617598,0
0.217,0.783,0.0,-0.5574,Crypto Community Calls For Congressional Probe Into SEC Gary Gensler’s Ties To Bankrupt FTX,1668616593,-1
0.25,0.75,0.0,-0.4588,"Genesis crypto lending unit halts services, adding to FTX contagion",1668619500,-1
0.0,0.802,0.198,0.5719,"SBF Is Sleeping Better, Playing Video Games — New York Times Sam Bankman-Fried Interview Dunked on for Going Soft on FTX Co-Founder",1668611143,1
0.286,0.714,0.0,-0.4939,"McHenry, Waters Announce December Hearing to Investigate FTX Collapse",1668613418,-1
0.0,1.0,0.0,0.0,FTX hacker now one of the world's largest holders of ethereum,1668608735,0
0.0,1.0,0.0,0.0,FTX crypto investors sue founder Sam Bankman-Fried and celebrity promoters,1668618824,0
0.371,0.629,0.0,-0.7096,"'Dr Doom' says after SBF, crypto king CZ is a 'walking time bomb'",1668617893,-1
0.252,0.748,0.0,-0.4019,"FTX Balance Sheet has a $7.3 million ""Trump Lose"" fund.",1668615028,-1
0.0,1.0,0.0,0.0,The Future of FTX arena,1668609145,0
0.0,0.909,0.091,0.2023,"Sam Bankman hasn't just been sitting around playing video games, he's been working on his new crypto venture FTTclassic",1668611907,1
0.176,0.824,0.0,-0.4588,"FTX investor sues Tom Brady, Gisele Bundchen and others as crypto contagion spreads | CNN Business",1668624049,-1
0.524,0.476,0.0,-0.5106,FTX failed the industry,1668615782,-1
0.0,1.0,0.0,0.0,"Sam Bankman-Fried Is A 'Criminal,' Says Coinbase CEO, Calls Out Mainstream Media For 'Puff Pieces' - Coinbase Global (NASDAQ:COIN)",1668609213,0
0.204,0.796,0.0,-0.3182,"3AC hunted by FTX, Alameda, founder claims. Sam Bankman-Fried disagrees.",1668620668,-1
0.0,0.899,0.101,0.2023,Question on crypto and rhe whole ftx situation. Did SBF break any laws playing with your crypto?,1668609119,1
0.18,0.82,0.0,-0.296,"Sam Bankman-Fried, Tom Brady and Other Celebs Sued in Class-Action Complaint",1668623766,-1
0.0,0.857,0.143,0.25,"Class action filed against Tom Brady, Larry David and others who endorsed FTX",1668610059,1
0.2,0.8,0.0,-0.4588,FBI Plans To Extradite FTX Bankman-Fried From Bahamas As Contagion Spills To Genesis?,1668610797,-1
0.0,1.0,0.0,0.0,Binance FTX Full Coverage Till 16 Nov -,1668607599,0
0.172,0.828,0.0,-0.3612,SEC Chair Gary Gensler ‘in a corner’ as Congress seeks answers over FTX mess,1668619472,-1
0.314,0.686,0.0,-0.4939,Binance role in FTX collapse under congressional scrutiny,1668624026,-1
0.0,1.0,0.0,0.0,U.S. Authorities Going After FTX Sam Bankman-Fried,1668626087,0
0.211,0.789,0.0,-0.4939,U.S. House committee to hold hearing on FTX collapse and crypto fall out,1668616533,-1
0.0,0.822,0.178,0.3818,How Much Were Tom Brady And Other Celebrity Influencers Paid To Promote FTX?,1668620631,1
0.333,0.667,0.0,-0.7906,Blockworks Still Blaming Binance for FTX's Fraud: Binance’s CZ Looking Into Acquiring Genesis Loan Book: Source,1668624463,-1
0.262,0.738,0.0,-0.4939,House Financial Services Committee to Hold Hearing into FTX Collapse,1668611414,-1
0.0,1.0,0.0,0.0,Former Kraken CEO Jesse Powell Says Mainstream Media Complicit in FTX ‘Ponzi’,1668616504,0
0.0,1.0,0.0,0.0,Bahamas Crypto Advocates Undeterred Despite FTX’s Downfall,1668623628,0
0.348,0.652,0.0,-0.5859,Binance Denies Accusation From UK Lawmaker That It Deliberately Sank FTX,1668617690,-1
0.0,1.0,0.0,0.0,Future of the FTX arena,1668609527,0
0.0,1.0,0.0,0.0,Sam Bankman-Fried and Vitalik Buterin,1668625596,0
0.225,0.775,0.0,-0.4939,Genesis’ Crypto-Lending Unit Is Halting Customer Withdrawals in Wake of FTX Collapse,1668606332,-1
0.0,1.0,0.0,0.0,SBF's cryptic tweet thread DECODED by crypto Twitter community. [repost of my deleted post from r/cryptocurrency],1668608811,0
0.0,1.0,0.0,0.0,class action against ftx and sbf?,1668619903,0
0.39,0.61,0.0,-0.4939,Joe Rogan On The FTX Collapse,1668626081,-1
0.375,0.625,0.0,-0.6597,FTX Contagion Hits Winklevoss Twins as Crypto Lenders Come Under Fire,1668617992,-1
0.225,0.775,0.0,-0.4404,"The Dirty SBF, Tether, and Justin Sun Pyramid of Partnership Schemes",1668607213,-1
0.314,0.686,0.0,-0.4939,Binance role in FTX collapse under congressional scrutiny,1668622855,-1
0.286,0.714,0.0,-0.5574,"FTX actions 'were illegal 100 years ago,' says Rep. Auchincloss",1668619162,-1
0.0,0.693,0.307,0.4767,TSM officially suspends partnership with FTX - effective immediately,1668623310,1
0.22,0.78,0.0,-0.7351,FBI is planning to EXTRADITE Sam Bankman-Fried from Bahamas - as crypto contagion from FTX collapse spreads to $20BN BlockFi that is preparing for bankruptcy,1668617068,-1
0.0,1.0,0.0,0.0,Genesis Suspending Client Withdrawals for Lending Arm Citing 'FTX Impact',1668615211,0
0.0,1.0,0.0,0.0,"Despite FTX Bankruptcy, Kevin O'Leary Says He Would Still Invest in SBF Again",1668607442,0
0.412,0.588,0.0,-0.1027,FTX bailout incoming,1668617186,-1
0.262,0.738,0.0,-0.4939,Genesis lending unit halts withdrawals in aftermath of FTX collapse,1668610934,-1
0.0,1.0,0.0,0.0,BlockFi Heading For Bankruptcy After FTX Exposure,1668608117,0
0.0,1.0,0.0,0.0,FTX implosion could affect 'more than one million' investors,1668609512,0
0.0,1.0,0.0,0.0,So who made money in FTX/Alameda saga?,1668609130,0
0.52,0.48,0.0,-0.7579,The Worst Part About FTX? The Shameless Self-Promotion,1668614848,-1
0.0,0.732,0.268,0.5106,OKX reveals $100m 'market recovery fund' after rebuffing FTX rescue,1668607281,1
0.314,0.686,0.0,-0.4939,How the FTX Collapse May Affect Your Taxes,1668610743,-1
0.123,0.714,0.162,0.1531,"FTX Lawsuit Takes Aim at Larry David, Tom Brady for Promoting Crypto Exchange",1668617478,1
0.0,1.0,0.0,0.0,FBI Is Planning To Extradite Sam Bankman-Fried Back To The US • ProCoinNews.com,1668612542,0
0.0,1.0,0.0,0.0,Is Reddit going to move gas fees from FTX? The main network post still mentions them.,1668607678,0
0.0,0.789,0.211,0.4939,How FTX could instantly get liquidity for its users and possibly save itself,1668611330,1
0.0,0.763,0.237,0.4767,"Newly Elected US House Whip Emmer Downplays FTX Meltdown, Cheers Crypto",1668625615,1
0.0,1.0,0.0,0.0,"World Economic Forum, FTX, Ukraine, and CBDC",1668624027,0
0.0,0.783,0.217,0.3612,Sam Bankman-Fried caught deleting more tweets that aged like milk,1668617985,1
0.464,0.536,0.0,-0.6523,Dave Portnoy DESTROYS FTX and SBF,1668616819,-1
0.0,1.0,0.0,0.0,"Young Platform, italian based exchange, halts Earning Wallet program in the aftermath of FTX crysis",1668612337,0
0.206,0.794,0.0,-0.3818,"Musk, Hoskinson, And Crypto Community Slam New York Times’ SBF Article",1668618285,-1
0.266,0.734,0.0,-0.4404,Scared by FTX? Move your crypto off an exchange,1668639041,-1
0.278,0.722,0.0,-0.6124,"Interview: Fallen crypto CEO Sam Bankman-Fried opens up about FTX, Alameda Research, and his regrets",1668648305,-1
0.062,0.938,0.0,-0.0516,If the SBF &amp; Caroline sex tape ends up being real this is officially the craziest bear market yet,1668626560,-1
0.0,0.667,0.333,0.3612,Flow crypto still promoting FTX exchange,1668627954,1
0.0,1.0,0.0,0.0,FTX and Bankman- Fried sued in $11 billion consumer class action,1668630860,0
0.0,0.868,0.132,0.4939,[Krakauer] SBF DMing incriminating information to a reporter who works for the arm of Vox that he's personally funding is just... pretty perfect...,1668632090,1
0.0,1.0,0.0,0.0,Bitcoin miners send less BTC to exchanges since 2020 halving despite FTX,1668643369,0
0.0,1.0,0.0,0.0,Sam Bankman-Fried tries to explain himself.,1668640130,0
0.337,0.584,0.079,-0.8176,"Crypto is dead,again (Original heading:Crypto is now dead: FTX, a cryptocurrency exchange, collapsed last week, proving a lot of cool guys horribly wrong)",1668631504,-1
0.0,0.734,0.266,0.4404,Is it safe to log into FTX website now?,1668655427,1
0.0,1.0,0.0,0.0,Postmortem FTX questions,1668650249,0
0.0,1.0,0.0,0.0,"Con artist Sam Bankman-Fried visited the White House at least two times this year to discuss ""crypto regulation"". uh huh.",1668632636,0
0.0,0.869,0.131,0.3089,Robert Kiyosaki Says Bitcoin Isn't the Problem — Calls Former FTX CEO the 'Bernie Madoff of Crypto',1668649649,1
0.485,0.515,0.0,-0.765,The failure of FTX was not a failure of cryptocurrency.,1668641635,-1
0.086,0.914,0.0,-0.128,"About the FTX fallout: There’s Bitcoin and there’s everything else, says Jack Mallers, CEO of Strike talks.",1668647943,-1
0.25,0.75,0.0,-0.4588,"Gemini, BlockFi, Genesis announcing new restrictions as FTX contagion spreads",1668633361,-1
0.0,1.0,0.0,0.0,"FTX just imploded, and Jack Dorsey wants to talk about the next stage for crypto?",1668648754,0
0.403,0.597,0.0,-0.4019,Insane SBF Interview - he's a sociopath,1668631633,-1
0.433,0.567,0.0,-0.7269,"SBF regrets declaring FTX bankrupt, per his DMs to Vox",1668636550,-1
0.0,1.0,0.0,0.0,Given what as going on. I wonder if SBF was talking about crypto and what he done,1668653190,0
0.174,0.826,0.0,-0.2263,"FTX lawsuit targets Steph Curry, Warriors and other crypto ‘ambassadors’",1668650711,-1
0.289,0.711,0.0,-0.7269,JUST IN - Binance's role in the collapse of FTX is now under U.S. Congressional scrutiny: The Block,1668635472,-1
0.0,1.0,0.0,0.0,Was FTX Being Used As A Back Door To Short GameStop &amp; Tesla Stocks?,1668633633,0
0.0,1.0,0.0,0.0,Postmortem FTX question,1668649875,0
0.147,0.853,0.0,-0.2263,Tom Brady and other celebrities named in class action lawsuit against FTX,1668634961,-1
0.251,0.749,0.0,-0.8126,"Sam Bankman-Fried tries to explain himself - The fallen crypto CEO on what went wrong, why he did what he did, and what lies he told along the way.",1668656384,-1
0.0,1.0,0.0,0.0,FUSBF,1668642586,0
0.0,1.0,0.0,0.0,"Sam Bankman-Fried updates investors: ‘We got overconfident and careless,’ claims $13B leverage",1668637116,0
0.0,1.0,0.0,0.0,Sam Bankman-Fried didn’t know he was over leveraged by $8b!,1668639270,0
0.0,1.0,0.0,0.0,"SBF, Caroline, DoKwon, CZ followed same career paths",1668634045,0
0.0,1.0,0.0,0.0,what does news regarding FTX mean for the Voyager bankruptcy.,1668647872,0
0.0,1.0,0.0,0.0,"Con artist Sam Bankman-Fried visited the White House at least two times this year to discuss ""crypto regulation"". uh huh.",1668633136,0
0.0,0.861,0.139,0.2732,[Matthews] So @kelseytuoc has been DMing with SBF and ... just ... my God,1668632231,1
0.313,0.687,0.0,-0.6249,The FTX Disaster is Deeper Than you Think - ColdFusion video,1668627327,-1
0.0,1.0,0.0,0.0,From SBF's interview (link in comments),1668636987,0
0.252,0.748,0.0,-0.4019,Bahamian liquidators reject validity of FTX's US bankruptcy filing,1668654744,-1
0.0,1.0,0.0,0.0,The admins should let the community vote on what company to use to replace FTX within the official mobile app,1668629787,0
0.0,1.0,0.0,0.0,⚠️WARNING TO THE RIPPLE/XRP ARMY | GENSLER GETS INVESTIGATED BY CONGRESS | CLAYTON INVOLVED W/ FTX⚠️,1668642276,0
0.119,0.881,0.0,-0.2263,"FTX founder Sam Bankman-Fried hit with class-action lawsuit that also names Brady, Bündchen, Shaq, Curry",1668634974,-1
0.0,1.0,0.0,0.0,Saylor talks about regulation and the FTX debacle with Bitcoin Archive,1668626877,0
0.079,0.921,0.0,-0.2617,"I'm not really a crypto guy but something weird is going on here... This was under a video about Sam Bankman-Fried, has anyone else seen these bots?",1668636069,-1
0.0,1.0,0.0,0.0,fusbf,1668642754,0
0.399,0.601,0.0,-0.8074,The FTX crypto collapse and the underlying crisis of the capitalist financial system,1668650490,-1
0.225,0.775,0.0,-0.4939,Tweet-by-Tweet Account of FTX's Collapse as It Happened : It Got So Much...,1668641345,-1
0.0,1.0,0.0,0.0,"Singapore’s state-owned investor, Temasek Holdings Pte, has decided to write down its entire $275 million investment in FTX, saying its belief in SBF was likely “misplaced.”",1668651466,0
0.67,0.33,0.0,-0.7269,SBF regrets declaring FTX bankrupt,1668653464,-1
0.0,1.0,0.0,0.0,[SERIOUS] How to file a proper claim for my FTX deposits,1668653937,0
0.0,0.734,0.266,0.4404,FTX Fallout: Can Proof of Reserves Improve Crypto Transparency?,1668636484,1
0.0,0.92,0.08,0.1901,"The media is puffing up SBF because he owns them, but that might lead to legal implications for these media corporations.",1668642022,1
0.13,0.87,0.0,-0.5106,"FTX WAS REGISTERED WITH AND LICENSED BY THE CFTC, WHICH FAILED TO PROPERLY REGULATE OR SUPERVISE IT AND ITS INNUMERABLE FORMER CFTC OFFICIALS",1668640123,-1
0.0,1.0,0.0,0.0,Algorand Foundation statement on our exposure to FTX,1668627131,0
0.0,1.0,0.0,0.0,Sam Bankman-Fried wanted to let retail investors borrow money to trade crypto derivatives: CFTC head,1668641862,0
0.252,0.748,0.0,-0.4019,The Psychopharmacology Of The FTX Crash by Scott Alexander,1668648007,-1
0.0,0.839,0.161,0.3612,"FTX Employees Were Encouraged to Keep Life Savings in the Now-Bankrupt Exchange, Sources Say",1668641624,1
0.369,0.631,0.0,-0.6249,The FTX Disaster is Deeper Than you Think,1668633326,-1
0.0,1.0,0.0,0.0,SBF Leaks,1668643311,0
0.116,0.776,0.108,-0.0516,"Guys, the downfall of companies like FTX and BlockFi illustrate the problems with centralization that cryptocurrency was designed to address",1668652008,-1
0.185,0.815,0.0,-0.6124,Why are people dragging the blame of the FTX-fraud on all influencers? It is very likely that even they were lied on by FTX.,1668634301,-1
0.068,0.872,0.06,-0.1027,In theory most of the exchanges that competed with FTX could fail in the days ahead. Over-tokenization and rewards (fee discounts etc if you topped up using their in-house token) will be seen as a Hindenburg level miscalculation in the crypto-economy; the in-house token is a fragile Achilles heel.,1668651409,-1
0.074,0.926,0.0,-0.0516,"Data visualization of FTX connnections network on twitter, for a link to the data set leave a comment.",1668643153,-1
0.153,0.847,0.0,-0.2023,New FTX CEO Distances Company From SBF After Controversial DMs Surface,1668645772,-1
0.0,1.0,0.0,0.0,Sam Bankman-Fried tries to explain himself; states altruism efforts were a facade,1668636086,0
0.0,1.0,0.0,0.0,U.S. crypto investors have filed a class action suit against Sam Bankman-Fried and the company’s host of celebrity endorsers,1668629385,0
0.0,1.0,0.0,0.0,Have you heard of this FTX thing?,1668635108,0
0.0,1.0,0.0,0.0,FTX and Alameda Executives Including Sam Bankman-Fried Were Aware of Customer Funds Misuse: Report,1668634304,0
0.474,0.441,0.085,-0.891,"Crypto is now dead: FTX, a cryptocurrency exchange, collapsed last week, proving a lot of cool guys horribly wrong",1668630358,-1
0.0,1.0,0.0,0.0,Kevin O’Leary said he’d back SBF again… thoughts?,1668647409,0
0.0,0.843,0.157,0.0772,Who would actually want to watch this? sbfleaks.eth:,1668653630,1
0.314,0.686,0.0,-0.4939,Binance role in FTX collapse under congressional scrutiny,1668630541,-1
0.0,1.0,0.0,0.0,Sam Bankman-Fried comes comes off as a sociopath in interview with Vox,1668643150,0
0.0,1.0,0.0,0.0,So should I purchase gas funds for my vault through FTX? 😶‍🌫️ Are there other options?,1668635350,0
0.25,0.75,0.0,-0.4588,"FTX Contagion Spreads As Gemini Earn, Genesis Capital Halt Withdrawals",1668633763,-1
0.0,1.0,0.0,0.0,Sam Bankman-Fried says 'f*ck regulators' in wide-ranging interview with Vox,1668636379,0
0.0,1.0,0.0,0.0,"Binance CEO slams Samuel Bankman-Fried’s behavior, takes aim at Nouriel Roubini",1668685406,0
0.2,0.8,0.0,-0.25,Coachella NFTs Sold for $1.5M—Now They’re Stuck on FTX,1668687331,-1
0.0,0.741,0.259,0.8114,"As An FTX User, You shouldn't feel stupid that you believed in FTX. Companies with way more knowledge and resources like Blackrock and Softbank also trusted FTX.",1668688419,1
0.126,0.728,0.146,0.0772,A lawsuit Filed Against FTX and Sam Bankman-Fried for the Sale of Unregistered Securities,1668670887,1
0.0,1.0,0.0,0.0,Binance FTX Full Coverage Till 16 Nov -,1668676960,0
0.0,1.0,0.0,0.0,NYT posts List of November 30th DealBook Summit speakers and includes FTX’s Sam Bankman-Fried as a speaker among others. You can’t make this stuff up,1668689143,0
0.0,1.0,0.0,0.0,"Sam Bankman-Fried Lobbied Key Regulator To Let Retail Investors Borrow Money To Trade Crypto Derivates, Says CFTC Chair - Bitcoin (BTC/USD), Ethereum (ETH/USD), FTX Token (FTT/USD)",1668663221,0
0.0,1.0,0.0,0.0,Beware! Don‘t give anyone your FTX email address!,1668688912,0
0.0,1.0,0.0,0.0,"Maxine Waters dodges question on FTX, Democrat ties and claims 'both sides' got money.",1668665744,0
0.255,0.745,0.0,-0.34,Bankman-Fried says filing for FTX bankruptcy was a mistake,1668687478,-1
0.286,0.714,0.0,-0.4939,Tremors from FTX's collapse reverberate through the scientific community,1668666124,-1
0.099,0.901,0.0,-0.296,[SERIOUS] Unchained Podcast - A panel of crypto insiders/experts break how SBF Fraud's machine worked and why no one caught it months before,1668660089,-1
0.104,0.769,0.126,0.1027,"Tom Brady, Larry David, and Others Who Supported FTX Are the Targets of a Class Action Lawsuit",1668682030,1
0.255,0.745,0.0,-0.6249,"Ah its finally out now, The FTX Disaster is Deeper Than you Think",1668669701,-1
0.275,0.725,0.0,-0.5859,Bahamian FTX Liquidators Cite ‘Serious Fraud and Mismanagement’ in Court Filings,1668680756,-1
0.367,0.633,0.0,-0.4404,FTX scandal discussed on Joe Rogan,1668667535,-1
0.214,0.786,0.0,-0.4574,"After FTX &amp; BlockFi, These Exchanges May Also Land in Deep Trouble!",1668674955,-1
0.0,1.0,0.0,0.0,FTX’s new CEO John Ray coldly addresses SBF’s erratic tweets,1668657447,0
0.0,1.0,0.0,0.0,Interview: Sam Bankman-Fried tries to explain himself,1668670362,0
0.259,0.741,0.0,-0.4215,Binance Denies Intentionally Crashing Rival FTX in UK Inquiry,1668672177,-1
0.0,1.0,0.0,0.0,"FTX, Celsius, etc. are just unregulated banks",1668664874,0
0.0,1.0,0.0,0.0,SBF,1668675392,0
0.158,0.705,0.137,-0.128,After $10+ billion fraud SBF is free while Tornado cash developer is in jail for developing open source sofware,1668671897,-1
0.297,0.703,0.0,-0.5859,FTX liquidators cite “serious fraud and mismanagement” in court filings.,1668680193,-1
0.0,1.0,0.0,0.0,Why Sam Bankman-Fried may face life imprisonment,1668673145,0
0.0,1.0,0.0,0.0,Singapore’s Temasek writes down $275M investment in FTX,1668680829,0
0.0,0.834,0.166,0.6997,Hyperstructures are the only way to go after multiple events such as Tornado Cash and FTX. The entire industry should aim towards true decentralization with much more support for such projects.,1668682191,1
0.391,0.503,0.105,-0.91,Disgraced Sam Bankman-Fried blames his EX-GIRLFRIEND for FTX collapse and loss of $32BN - as he admits he lied about being moral and calls ethics a 'dumb game we woke Westerners play',1668682411,-1
0.0,0.621,0.379,0.6705,Will ETHE And Grayscale Bitcoin Trust Share Same Fate As FTT?,1668665301,1
