neg,neu,pos,compound,headline,time,label
0.074,0.738,0.189,0.4939,"""Luxury automaker joins strained digital art market with own free-to-mint Ethereum sketch collection, which grant ""real-world benefits to holders"" - ""Non fungible tokens are increasingly important, despite recent market doldrums"" -Coin Telegraph",1668651658,1
0.0,0.213,0.787,0.7506,Join to Share $2500 Prizes,1668688614,1
0.0,0.27,0.73,0.4019,romantic Drama,1668516888,1
0.284,0.37,0.346,0.128,Lost all faith in ZKSync,1668620479,1
0.0,0.95,0.05,0.34,"Ryan Salame, CEO of an FTX subsidiary, was the 14th biggest individual donor on the list, giving more than $23.6 million, all to Republicans; To What Extent are FTX, Senator Gillibrand , Lummis, Boozeman, &amp; Michael Saylor Doing Regulatory Capture To Force KYC (6050i) On DeFi Front Ends.",1668638388,1
0.0,1.0,0.0,0.0,CDC wallet,1668499266,0
0.0,1.0,0.0,0.0,Nike Open Up NFT Platform,1668699051,0
0.262,0.738,0.0,-0.4939,How FTX Collapse Is the Lehman Brothers of Crypto Sector?,1668697654,-1
0.0,1.0,0.0,0.0,"Vitalik Buterin Reportedly ""sold"" $3.75 million of ETH",1668584449,0
0.278,0.722,0.0,-0.4019,Mycellium wallet sync error with Ethereum server connection,1668622982,-1
0.0,1.0,0.0,0.0,I asked AI to show me how it imagines blockchain,1668629290,0
0.0,1.0,0.0,0.0,How They Got $105K In Bitc0in,1668649449,0
0.0,0.758,0.242,0.8481,"""Luxury car maker surprises beleaguered NFT market with free-to-mint Ethereum collection, which provide ""tangible benefits to owners and are all drawn by hand"" - ""Non fungible tokens are increasing in importance, despite the recent market malaise"" - Bloomberg",1668600283,1
0.0,0.755,0.245,0.5994,They Are Testing A Super Creepy “Digital Dollar” That They Plan To Introduce Soon,1668669703,1
0.0,0.213,0.787,0.7506,Join to Share $2500 Prizes,1668688351,1
0.0,0.752,0.248,0.8481,"""Luxury automaker surprises digital art market with free-mint Ethereum collection which provide ""tangible benefits to owners and are all drawn by hand"" - ""Non fungible tokens are only increasing in importance, despite recent market malaise"" - Bloomberg",1668626164,1
0.0,1.0,0.0,0.0,Stake Platinum 2 or 3 verified account,1668742489,0
0.0,0.716,0.284,0.8657,"""Luxury Auto Manufacturer surprises NFT market with free-to-mint collection, 'our NFTs provide tangible benefits to owners and are all hand drawn'""; ""NFTs are here to stay, despite crypto market chaos"" - Bloomberg",1668536433,1
0.0,1.0,0.0,0.0,Libonomy Blockchain Introduction,1668539083,0
0.0,1.0,0.0,0.0,𝑻𝒉𝒊𝒔 𝒊𝒔 𝒘𝒉𝒂𝒕 𝒚𝒐𝒖'𝒓𝒆 𝒍𝒐𝒐𝒌𝒊𝒏𝒈 𝒇𝒐𝒓... 🚀🌙,1668758433,0
0.0,0.805,0.195,0.1779,Which identity management solutions for secret key recovery?,1668727379,1
0.0,0.488,0.512,0.6369,5 best gaming motherboards under $400:,1668764928,1
0.0,1.0,0.0,0.0,"Learn Zero Knowledge (Workshops with Ethereum Foundation, Aztec, Anoma)",1668587747,0
0.0,0.816,0.184,0.6249,"""Luxury automaker joins growing list of big brands entering digital art market with free-to-mint Ethereum collection, providing ""real world benefits to holders"" - ""Non fungible tokens are increasingly important"" -Coin Telegraph",1668651843,1
0.0,1.0,0.0,0.0,"This is only the beginning, in the end, cryptocurrency will prove to us all that it was never designed to be centralized.",1668693081,0
0.0,1.0,0.0,0.0,"FTT token still selling for over $8.50 on some DEX , any way to make money with this?",1668681903,0
0.0,1.0,0.0,0.0,Metamask hacker initiated unstaking for my coins... I have 5 days!,1668550409,0
0.0,0.758,0.242,0.8481,"""Luxury car maker surprises beleaguered NFT market with free-to-mint Ethereum collection, which provide ""tangible benefits to owners and are all drawn by hand"" - ""Non fungible tokens are increasing in importance, despite the recent market malaise"" - Bloomberg",1668611897,1
0.0,0.698,0.302,0.6973,THE SCIENCE OF GETTING RICH!! YOU HAVE TO WATCH THIS VIDEO NOW!!,1668699630,1
0.6,0.4,0.0,-0.7177,Man holy crap $CULT is selfish!,1668709369,-1
0.0,1.0,0.0,0.0,Make .2 Eth Every Hour,1668604992,0
0.0,1.0,0.0,0.0,Buy Process on Meta Mask,1668617977,0
0.0,0.758,0.242,0.8481,"""Luxury Auto Manufacturer surprises beleaguered NFT market with free-to-mint Ethereum collection, which provides ""tangible benefits to owners and are all drawn by hand"" - ""Non fungible tokens are increasing in importance, despite the recent market malaise"" - Bloomberg",1668556384,1
0.0,1.0,0.0,0.0,This should help!:-),1668625825,0
0.0,0.598,0.402,0.6166,FREE CLOUD MINING [NO KYC] only mobile,1668634521,1
0.0,0.381,0.619,0.7579,Great News for Capital Gains Tax,1668696746,1
0.0,1.0,0.0,0.0,PM for WEB3 Vedio content platform (Part/Full time),1668666043,0
0.0,0.782,0.218,0.8225,"""High end auto manufacturer joins growing number of big brands making waves in digital art market with free-to-mint Ethereum collection, which provide ""real world benefits to holders and are all hand drawn"" - ""Non fungible tokens are increasingly important, despite recent market doldrums"" -Bloomberg",1668651488,1
0.0,1.0,0.0,0.0,Decentralised Exchange dYdX reinstates liquidity pool and resumes USDC staking with a market leading yield of 14.31% -DefiPulse,1668735112,0
0.0,1.0,0.0,0.0,2022-11-06 - atuni.site - ENS Scam.pdf,1668504093,0
0.6,0.4,0.0,-0.7177,Man holy crap $CULT is selfish!,1668709344,-1
0.0,1.0,0.0,0.0,Decentralised Exchange dYdX reinstates liquidity pool and resumes USDC staking with a market leading yield of 14.31% -DefiPulse,1668736790,0
0.0,0.694,0.306,0.296,Creating a local forked node using go-ethereum,1668760324,1
0.291,0.606,0.103,-0.4767,"The FTX exploiter, who has been dumping all other drained assets for ETH",1668545976,-1
0.21,0.79,0.0,-0.4926,HEADS UP: GEMINI EXCHANGE RUMORED TO HALT ALL GOOGLE SOCIAL MEDIA SPENDING! :(,1668618558,-1
0.6,0.4,0.0,-0.7177,Man holy crap $CULT is selfish!,1668708752,-1
0.0,0.876,0.124,0.4019,Parity between EVM precompiles and smart contracts (information context). A collab example with Cosmos/Ethermint: Execute Cosmos Transactions from an EVM multisig,1668529826,1
0.0,0.204,0.796,0.5994,beautiful scenerylandscape,1668643945,1
0.0,0.627,0.373,0.9641,"https://theprotocol.network/ @_THE_PROTOCOL #THE #THEProtocol #Airdrop #Presale.This strong team and reliable idea make this great project. This project has a very promissing future, because I really think this project is too perfect. very good project.The project more success in future",1668652984,1
0.0,0.764,0.236,0.7003,"""Premium automaker joins growing list of big brands with own public Ethereum collection, providing ""real world benefits to holders"" - ""NFTs are increasing in importance"" -CNBC",1668682528,1
0.0,0.816,0.184,0.6249,"""Luxury automaker joins growing list of big brands entering digital art market with free-to-mint Ethereum collection, providing ""real world benefits to holders"" - ""Non fungible tokens are increasingly important"" -Coin Telegraph",1668679818,1
0.0,0.84,0.16,0.2716,Who do you think are the most important Layer-1 influencers to follow?,1668733446,1
0.0,0.732,0.268,0.7717,"""Luxury Auto Manufacturer Porsche surprises beleaguered NFT market with free-to-mint collection, 'our NFTs provide tangible benefits to owners and are all hand drawn'"" - Bloomberg",1668546748,1
0.0,1.0,0.0,0.0,Where is the moderation here?!,1668706022,0
0.0,0.633,0.367,0.4404,Is wrapped ether on polygon safe?,1668664148,1
0.0,1.0,0.0,0.0,OM Matra,1668749962,0
0.057,0.84,0.104,0.3761,Can someone explain to me how to stake eth yourself without having to join a pool? Either by getting some friends together or by accumulating 32 eth? Can’t figure this out,1668777555,1
0.0,1.0,0.0,0.0,What if Ledger goes out of business?,1668629402,0
0.0,1.0,0.0,0.0,Marketplace for Goerli Eth,1668609543,0
0.0,1.0,0.0,0.0,Know What Blockchain Is Right For Your Business | Consult With Us | Bloc...,1668600785,0
0.0,1.0,0.0,0.0,bear call sell #ETHUSDT call price 1260.12 volume at call price 2346.1446737 time of call 2022-11-15T10:00:01Z,1668506410,0
0.0,1.0,0.0,0.0,"CBDC has arrived ... what next? (Part 3) Here Come ""Programmable Dollars"": New York Fed And 12 Banking Giants Launch Digital Dollar Test",1668550555,0
0.0,0.758,0.242,0.8481,"""Luxury car maker surprises beleaguered NFT market with free-to-mint Ethereum collection, which provide ""tangible benefits to owners and are all drawn by hand"" - ""Non fungible tokens are increasing in importance, despite the recent market malaise"" - Bloomberg",1668621298,1
0.0,1.0,0.0,0.0,Oasis × DappRadar Accelerator Demo Day,1668655120,0
0.0,0.508,0.492,0.4404,Better UI for uniswap?,1668648381,1
0.0,0.758,0.242,0.8481,"""Luxury Auto Manufacturer surprises beleaguered NFT market with free-to-mint Ethereum collection, which provides ""tangible benefits to owners and are all drawn by hand"" - ""Non fungible tokens are increasing in importance, despite the recent market malaise"" - Bloomberg",1668556980,1
0.0,1.0,0.0,0.0,Hi everyone. I’m new to ETH. Wondering if it’s still possible for ETH to 15-30X it’s coin price. I know the market cap is already very high.,1668549646,0
0.0,1.0,0.0,0.0,The KUNUSOKI TOKEN is an Ethereum chain based token with potentials to moon,1668594521,0
0.0,1.0,0.0,0.0,Another $STATE 1Quad $STATE supply burnt! Over 3% of $STATE total supply was already burnt!,1668608537,0
0.0,1.0,0.0,0.0,Cheapest way to convert BUSD to USDC?,1668720689,0
0.0,1.0,0.0,0.0,bear call sell #GOLD call price 1777.37 volume at call price 46102 time of call 2022-11-16T01:00:00Z,1668560406,0
0.0,0.817,0.183,0.722,"[Project] The Bot Shed provides web forms for command-line bots. CEX bots are admittedly powerful but as a community we can do better! Also: your wallet, your tokens, your bot.",1668579366,1
0.0,1.0,0.0,0.0,Arbswap: A New Gem of Arbitrum,1668734370,0
0.0,1.0,0.0,0.0,Is there a way to split my passphrase into 3 and be able to recover it from any 2 of them?,1668722981,0
0.103,0.722,0.175,0.2263,Blockchain and the world’s growing plastic problem. Crypto cleanup is the good news story we need to prove our real world legitimacy,1668507513,1
0.0,1.0,0.0,0.0,POMERANIAN ERC: Layer 1 Blockchain,1668700595,0
0.0,1.0,0.0,0.0,Bubiihbu,1668712417,0
0.0,0.817,0.183,0.722,"[Project] The Bot Shed provides web forms for command-line bots. CEX bots are admittedly powerful but as a community we can do better! Also: your wallet, your tokens, your bot.",1668579457,1
0.0,1.0,0.0,0.0,Apple job listings &amp; patents hint at foray into ‘3D mixed-reality world’ -,1668517056,0
0.208,0.792,0.0,-0.2732,"Keep DeFi Codes Simple to Reduce Risk, Vitalik Advises",1668692969,-1
0.0,1.0,0.0,0.0,stETH Exposure to Alameda Research,1668712552,0
0.0,1.0,0.0,0.0,Marina Dubai OpenseaNFT Collections,1668567836,0
0.0,0.476,0.524,0.0258,Withdrawal times,1668584781,1
0.0,1.0,0.0,0.0,Where did my ETH go?,1668496256,0
0.0,1.0,0.0,0.0,Binance FTX Full Coverage Till 16 Nov -,1668607859,0
0.0,1.0,0.0,0.0,"can i get some goerli eth , if anyone some to spare",1668692634,0
0.0,1.0,0.0,0.0,Is there any projects working on decentralized privacy preserving KYC?,1668759069,0
0.0,1.0,0.0,0.0,Javascript to Solidity Transpiler,1668551053,0
0.0,1.0,0.0,0.0,How to manually sell a honeypot ERC-20 token?,1668727496,0
0.0,0.808,0.192,0.2263,Is buying a ledger worth it for storing one eth?,1668566703,1
0.0,1.0,0.0,0.0,FifaCup.Win -Presale On PinkSale 18TH NOV 13:00 - Presale Time Duration only 2 hours- SC/HC 50/100 - Live Match Streaming -2 hrs Left - BlockSafu Audit,1668771554,0
0.281,0.538,0.182,-0.7057,SCAM WARNING: Make sure any links you click from a post go to where they appear to! A user is actively promoting a fake DyDx website across multiple crypto subs,1668743734,-1
0.6,0.4,0.0,-0.7177,Man holy crap $CULT is selfish!,1668708829,-1
0.0,1.0,0.0,0.0,Anyone know if this educational platform is legit?,1668648926,0
0.0,0.68,0.32,0.5719,Ethereum turns into first profitable blockchain from Top 10 of Crypto Market,1668700062,1
0.0,1.0,0.0,0.0,"Hop Protocol and bridge from Polygon to Mainnet, found did not bridge?",1668628751,0
0.0,1.0,0.0,0.0,Rocketpool UNSTAKE,1668503122,0
0.0,0.893,0.107,0.0516,"Ethereum Corrects Upwards And Reaches The High At 1,400 Dollars Again",1668507022,1
0.0,0.674,0.326,0.4404,How to choose a good crypto lottery site?,1668602592,1
0.0,1.0,0.0,0.0,"$TSUKA the new project from Ryoshi, creator of $SHIBA",1668711119,0
0.0,1.0,0.0,0.0,【Job offer】Production Manager for WEB3 Vedio content platform (Part/Full time),1668656896,0
0.0,1.0,0.0,0.0,Is there a way to split my passphrase into 3 and be able to recover it from any 2 of them?,1668723093,0
0.0,1.0,0.0,0.0,enter the market: bull call buy ETHUSDT KUCOIN call price 1226.5 volume at call price 2464.3599164 time of call 2022-11-18T03:00:02Z,1668740413,0
0.0,1.0,0.0,0.0,Curve Newsletter,1668499720,0
0.074,0.738,0.189,0.4939,"""Luxe Automaker joins strained digital art market with own free-to-mint Ethereum sketch collection, which grant ""real-world benefits to holders"" - ""Non fungible tokens are increasingly important, despite recent market doldrums"" -Coin Telegraph",1668651579,1
0.0,0.645,0.355,0.296,Join All The Blockchains Together,1668621665,1
0.0,0.914,0.086,0.128,Soccer superstar Cristiano Ronaldo's exclusive Digital Art collection launches in partnership with Binance; Minting is now live.,1668778454,1
0.0,0.69,0.31,0.2023,an important event in history,1668670438,1
0.317,0.683,0.0,-0.9491,Ftx totally destroy my life. Lost all my money there and have a big debt more than 35 k :( Do someone have some information about ftx? Is this scam now? Or they are still looking way to give back cash for ppls?,1668501395,-1
0.0,0.758,0.242,0.8481,"""Luxury car maker surprises beleaguered NFT market with free-to-mint Ethereum collection, which provide ""tangible benefits to owners and are all drawn by hand"" - ""Non fungible tokens are increasing in importance, despite the recent market malaise"" - Coindesk",1668597203,1
0.0,1.0,0.0,0.0,CALL TO ACTION,1668576825,0
0.0,1.0,0.0,0.0,The Zero Knowledge Bible,1668527165,0
0.0,1.0,0.0,0.0,bear call sell #ETHWUSDT call price 3.873 volume at call price 760.79431798 time of call 2022-11-15T12:01:00Z,1668513675,0
0.0,1.0,0.0,0.0,Crypto Mining With Phones: All You Need To Know,1668580648,0
0.056,0.731,0.213,0.7579,"""High end sports car maker surprises strained NFT market with free-to-mint Ethereum collection, which provide ""real world benefits to owners and are all drawn by hand"" - ""Non fungible tokens are increasing in importance, despite the recent market doldrums"" - Coin Telegraph",1668636070,1
0.0,0.816,0.184,0.6249,"""Luxury automaker joins growing list of big brands entering digital art market with free-to-mint Ethereum collection, providing ""real world benefits to holders"" - ""Non fungible tokens are increasingly important"" -Coin Telegraph",1668679751,1
0.649,0.351,0.0,-0.5719,Recovery crypto scam?,1668703192,-1
0.286,0.44,0.275,-0.0516,Can someone please help me? I think I'm the victim of a dust attack,1668739759,-1
0.0,0.732,0.268,0.5106,"Football Cup Trading Competition Prize pool up to 2,000,000 USDT",1668600008,1
0.0,1.0,0.0,0.0,For anyone Staking ETH2 on Coinbase...,1668618615,0
0.0,0.843,0.157,0.0772,I want to make NFTs with Legit Use Case,1668669917,1
0.0,0.755,0.245,0.7003,"""Premium automaker joins growing list of big brands with free-to-mint Ethereum collection, providing ""real world benefits to holders"" - ""NFTs are increasing in importance"" -CNBC",1668682478,1
0.0,1.0,0.0,0.0,Eth/eth2,1668716595,0
0.0,1.0,0.0,0.0,bear call sell #SP500 call price 3993.46 volume at call price 0 time of call 2022-11-16T12:00:00Z,1668600015,0
0.062,0.762,0.176,0.5994,"""High end sports car maker enters strained digital art market with free-to-mint Ethereum collection, which provide ""real world benefits to holders and are all hand drawn"" - ""Non fungible tokens are increasingly important, despite recent market doldrums"" -Bloomberg",1668651728,1
0.0,0.81,0.19,0.5709,Non custodial wallets are more important that ever to ensure further adoption. Enkrypt from MyEtherWallet is on Product Hunt for just that.,1668524063,1
0.0,0.857,0.143,0.5927,"Have Ethereum fees decrease, I just hold, also been working a lot so been busy, but I haven’t seen anyone ranting about high fees, are things better ?",1668585848,1
0.0,1.0,0.0,0.0,What happens if Trezor and Ledger shut down?,1668567373,0
0.608,0.392,0.0,-0.4767,I'm poor look,1668601337,-1
0.0,0.213,0.787,0.7506,Join to Share $2500 Prizes,1668688556,1
0.0,0.476,0.524,0.5106,STEX: GET A FREE 5 USDT,1668619022,1
0.174,0.826,0.0,-0.2732,The First Metaphy drop of Paiverse is the oldest Penderyn whisky,1668500339,-1
0.0,0.758,0.242,0.8481,"""Luxury car maker surprises beleaguered NFT market with free-to-mint Ethereum collection, which provide ""tangible benefits to owners and are all drawn by hand"" - ""Non fungible tokens are increasing in importance, despite the recent market malaise"" - Bloomberg",1668557779,1
0.0,1.0,0.0,0.0,CR7 Ronaldo NFT just released on ERC20 Network,1668710405,0
0.0,0.909,0.091,0.128,Soccer superstar Cristiano Ronaldo's exclusive NFT collection launches in partnership with Binance; Minting is now live.,1668710410,1
0.0,0.426,0.574,0.4019,Smart Contract Basics,1668669666,1
0.0,0.817,0.183,0.722,"[Project] The Bot Shed provides web forms for command-line bots. CEX bots are admittedly powerful but as a community we can do better! Also: your wallet, your tokens, your bot.",1668630367,1
0.0,1.0,0.0,0.0,Potential targets for a local bottom after capitulation event: $BTC 12k-14k $ETH 500-750 $BNB 100 $ADA 0.18-0.23 $LTC 29-32 $DOT 3.4-3.6 $FTT 0.000000000 $SOL 0.00000000000 $CRO 0.0000000000,1668716528,0
0.6,0.4,0.0,-0.7177,Man holy crap $CULT is selfish!,1668708497,-1
0.0,1.0,0.0,0.0,Golden rules for crypto investment,1668762971,0
0.0,1.0,0.0,0.0,None - Otherdeed for Otherside| DTTD,1668567229,0
0.0,0.722,0.278,0.7717,"""Luxury Auto Manufacturer surprises beleaguered NFT market with free-to-mint collection, 'our NFTs provide tangible benefits to owners and are all hand drawn'"" - Bloomberg",1668546817,1
0.0,0.732,0.268,0.5106,"Football Cup Trading Competition Prize pool up to 2,000,000 USDT",1668600101,1
0.0,1.0,0.0,0.0,Binance FTX Full Coverage Till 16 Nov -,1668677379,0
0.0,0.571,0.429,0.128,Is Railgun legal?,1668510491,1
0.242,0.704,0.054,-0.8402,Please start moderating this sub. The same nft scam has been on this sub atleast 3 times in the past few days. This is terrible for new users and makes the whole community look bad.,1668609303,-1
0.0,1.0,0.0,0.0,https://www.feroxadvisors.com/srt $SRT #Saratoga #SeedRound #Presale #FairLaunch #LandRevolution #LiquidityLock #OrganicAgriculture #Wellness #Longevity #BSC #Pancakeswap,1668653221,0
0.062,0.762,0.176,0.5994,"""High end sportscar maker enters strained digital art market with Ethereum public mint, which provide ""real world benefits to holders and are all drawn by hand"" - ""Non fungible tokens are increasingly important, despite recent market doldrums"" -Coindesk",1668651319,1
0.0,0.508,0.492,0.4404,A truly interoperable blockchain - Libonomy,1668694960,1
0.0,0.805,0.195,0.5267,"""Catch me if you can"" or Guide to an ideal robbery, example of $GALA token.",1668628375,1
0.6,0.4,0.0,-0.7177,Man holy crap $CULT is selfish!,1668709238,-1
0.056,0.731,0.213,0.7579,"""High end sports car maker surprises strained NFT market with free-to-mint Ethereum collection, which provide ""real world benefits to owners and are all drawn by hand"" - ""Non fungible tokens are increasing in importance, despite the recent market doldrums"" - Coin Telegraph",1668636913,1
0.0,0.704,0.296,0.2732,Energy Mining Comparison Of Different Blockchains,1668619818,1
0.062,0.762,0.176,0.5994,"""High end sports car maker enters strained digital art market with free-to-mint Ethereum collection, which provide ""real world benefits to holders and are all hand drawn"" - ""Non fungible tokens are increasingly important, despite recent market doldrums"" -Bloomberg",1668651760,1
0.0,1.0,0.0,0.0,Whats the advantages/disadvantages of rocket pool over lido for staking?,1668539455,0
0.0,1.0,0.0,0.0,What if Bitcoin goes out of business,1668650762,0
0.0,1.0,0.0,0.0,The Role of Blockchain Participants,1668669379,0
0.744,0.256,0.0,-0.4404,Should I Worry?,1668559691,-1
0.0,1.0,0.0,0.0,‎NFT and Chill: FTX and the Difference Between CeFi vs DeFi on Apple Podcasts,1668545660,0
0.0,1.0,0.0,0.0,Question regarding Ethereum source code,1668773740,0
0.0,0.716,0.284,0.8657,"""Luxury Auto Manufacturer surprises NFT market with free-to-mint collection, 'our NFTs provide tangible benefits to owners and are all hand drawn'""; ""NFTs are here to stay, despite crypto market chaos"" - Bloomberg",1668543687,1
0.218,0.605,0.177,-0.25,"For a blockchain to be Decentralized it has to have a property of Byzantine Fault Tolerance. So, what’s Byzantine Fault Tolerance?",1668628141,-1
0.0,1.0,0.0,0.0,The Eagle 11 November 2022: Meet the new Aragon protocol,1668551629,0
0.0,0.676,0.324,0.34,Sooo excited for the testnet launch…🤩🤩🤩🤩,1668578470,1
0.074,0.738,0.189,0.4939,"""Luxe Automaker joins strained digital art market with own free-to-mint Ethereum sketch collection, which grant ""real-world benefits to holders"" - ""Non fungible tokens are increasingly important, despite recent market doldrums"" -Coin Telegraph",1668651594,1
0.0,0.792,0.208,0.2732,What is the Cost to Create an ERC20 Token?,1668688178,1
0.0,1.0,0.0,0.0,What if Bitcoin goes out of business,1668650142,0
0.0,1.0,0.0,0.0,centralization of ETH,1668719859,0
0.787,0.213,0.0,-0.5719,Porsche Scam,1668622268,-1
0.0,1.0,0.0,0.0,Staking,1668777813,0
0.0,1.0,0.0,0.0,Transaction privacy?,1668488841,0
0.0,0.69,0.31,0.2023,an important event in history,1668669187,1
0.0,0.619,0.381,0.5719,Are layer 2s essential to Ethereum's success?,1668520850,1
0.0,0.927,0.073,0.0258,How does ethereum prevent all blockchain copies from being altered if all nodes are compromised?,1668635995,1
0.0,1.0,0.0,0.0,"dYdX just reinstated its erc20 USDC liquidity pool and resumes USDC stakign, highest yield on the market atm 14pc",1668778602,0
0.0,0.722,0.278,0.4019,Need help moving ETH between MyEtherWallet and Kraken,1668500656,1
0.0,0.649,0.351,0.4019,Smart Contract Development Services | Blockchain Firm,1668510489,1
0.0,0.385,0.615,0.4939,OKX Football Festival,1668522411,1
0.172,0.828,0.0,-0.3595,No Paper Hands! Ethereum Presale Investor Sells 500 ETH ($627K) After Seven Years,1668528230,-1
0.0,1.0,0.0,0.0,drama romantis,1668581647,0
0.0,1.0,0.0,0.0,What if Bitcoin goes out of business,1668649861,0
0.231,0.769,0.0,-0.5859,"Lost all my money on ftx, debt more than 35 k. Do someone have new inf about ftx?",1668501304,-1
0.0,0.75,0.25,0.4588,"Bitcoin, Ethereum, and Altcoins' Open Interest Tank across Binance, OKX",1668693615,1
0.0,0.625,0.375,0.6369,What is the best way to test dapps?,1668775452,1
0.0,1.0,0.0,0.0,Arbitrum Decentralization Update,1668624073,0
0.0,1.0,0.0,0.0,ETH Digital Art Token $10,1668768311,0
0.0,0.707,0.293,0.4404,Are cryptocurrencies useful in the real world yet?,1668589357,1
0.0,1.0,0.0,0.0,CM Sky News interview 31.10.22 - Blockchain company Valereum acquires Gbraltar Stock Exchange,1668729928,0
0.0,1.0,0.0,0.0,Hi everyone. I’m new to ETH and wondering if it’s still possible for ETH to 15-30X the coin price in the future. I know it already has a relatively high market cap,1668549736,0
0.0,0.893,0.107,0.0516,"Ethereum Corrects Upwards And Reaches The High At 1,400 Dollars Again",1668506923,1
0.0,1.0,0.0,0.0,Can someone explain to me how staking with Kiln works?,1668698045,0
0.0,1.0,0.0,0.0,Where to buy stuff with Ethereum?,1668703256,0
0.0,0.893,0.107,0.34,FifaCup.Win - Secure betting on your favourite FIFA WC 22 Team - Presale On PinkSale 17TH NOV 14:00 - Live Match streaming - BlockSafu Audit,1668635251,1
0.0,0.828,0.172,0.4019,A Web3 Messaging App For Web3 Users. Launch &amp; Test Idea . Can You Support Me?,1668519433,1
0.0,0.821,0.179,0.6249,"""High end auto manufacturer joins growing list of big brands entering digital art market, with free-to-mint Ethereum collection, providing ""real world benefits to holders"" - ""Non fungible tokens are increasingly important"" -CoinTelegraph",1668680977,1
0.274,0.692,0.035,-0.9538,Ftx totally destroy my life. Lost all my money there and have a big debt more than 35 k :( Do someone have some information about ftx? Is this scam now? Or they are still looking way to give back cash for ppls? who have also problems with ftx here ? Maybe you have some Group for ppls like me?,1668501625,-1
0.0,1.0,0.0,0.0,Anyone know of DEXs that run on ETH L1 or L2 which offer limit buy and sell capability?,1668493583,0
0.0,0.922,0.078,0.0258,Does it matter which bridge you use to get from ETH to an L2,1668655010,1
0.0,1.0,0.0,0.0,"Data Question: How many wallets exist on ETH that have over $1M, or even $2M?",1668643190,0
0.0,1.0,0.0,0.0,Buidl Academy,1668600632,0
0.0,1.0,0.0,0.0,Can I unstake Eth 2.0 from Coinbase and send it to my Ledger to stake on Lido?,1668658861,0
0.0,1.0,0.0,0.0,Can someone eli5 this tweet?,1668571742,0
0.0,1.0,0.0,0.0,"PSA: If anyone holds $FTT, sell it on DEX, not CEX; DEX price is $8-9 still",1668489862,0
0.0,1.0,0.0,0.0,enter the market: bull call buy #DXY call price 106.681 volume at call price 0 time of call 2022-11-16T02:00:00Z,1668564008,0
0.0,1.0,0.0,0.0,Javascript to Solidity Transpiler?,1668538207,0
0.0,0.828,0.172,0.3612,If you will buy my any 1 nft I will buy from you 4 be ready,1668490856,1
0.0,1.0,0.0,0.0,Would now be the time to buy and hold?,1668559281,0
0.373,0.432,0.195,-0.5106,Crypto romance scams: fake ‘Asian women’ are coming for your ‘crypto-wallets,1668515542,-1
0.0,1.0,0.0,0.0,What if Bitcoin goes out of business?,1668650403,0
0.0,0.508,0.492,0.4404,What’s better than CEX?,1668717779,1
0.792,0.208,0.0,-0.5859,Fraud exchange,1668530920,-1
