neg,neu,pos,compound,headline,time,label
0.0,1.0,0.0,0.0,ETH Node with an HDD,1665526625,0
0.0,1.0,0.0,0.0,syncing Etherium blockchain on my desktop,1665746233,0
0.0,0.764,0.236,0.5719,Adidas to Reward Finishers of Latest Buenos Aires International Marathon with Merch-Redeemable NFTs,1665838828,1
0.0,0.5,0.5,0.6124,£35 Amazon Voucher For Your Honest Feedback,1665437331,1
0.0,0.674,0.326,0.4404,"Libonomy - Interoperable, scalable and truly decentralized blockchain",1665660188,1
0.0,0.204,0.796,0.5994,beautiful scenerylandscape,1665388938,1
0.0,1.0,0.0,0.0,"Crypto investors still haven't priced in the upside from the Ethereum (ETH) merge, JPMorgan says. Do you think ETH could rally some more?",1665586638,0
0.0,0.909,0.091,0.0772,"An explainer on ""Zero-knowledge proofs"": its history, visual examples, landmark findings, zk-SNARK/STARK, post-quantum cryptography",1665527766,1
0.106,0.804,0.09,-0.0772,David Hoffman from Bankless is suing Janet Yellen and the Treasury Department over their sanctions against Tornado Cash,1665603778,-1
0.045,0.955,0.0,-0.2732,"Ethereum (ETH) investors still haven't priced in the upside from the ETH merge, JPMorgan has said. ETH is currently down around 19% from the price levels since the day of the merge. Do you think ETH will drop further to $1,000 or below until October 21?",1665676594,-1
0.0,1.0,0.0,0.0,Any options to recover funds? Sent BEP-20 Ethereum Token to Coinbase Wallet. Funds dissolved from both accounts. “Lost forever”,1665779691,0
0.0,1.0,0.0,0.0,Wholesome on-chain message as an MEV bot retires...,1665428768,0
0.0,1.0,0.0,0.0,Where where i short ethereum? Which defi apps can i access thru metamask to short/long eth,1665536153,0
0.298,0.617,0.085,-0.5803,Did Ethereum Merge Fail ? Gas Prices Reach a 60-Day High? – cryptowiky,1665599872,-1
0.0,1.0,0.0,0.0,A simple wallet on your phone that replaces hardware wallets,1665602035,0
0.0,0.729,0.271,0.3818,Flashbots unveils upgrade that could resolve censorship concerns,1665822277,1
0.0,0.762,0.238,0.3612,PinkChain - PoW + Staking | Ethash | Greater Alternative to PoW Ethereum,1665609855,1
0.474,0.526,0.0,-0.4019,Crypto Arguments for outsiders,1665663999,-1
0.0,1.0,0.0,0.0,Decentralized exchange Uniswap v3 gets ‘Warp’ed’ onto StarkNet,1665683373,0
0.0,0.805,0.195,0.7003,"Your NFTs are the gateway to simply amazing Own not just a piece of art but creativity, story, characters, frames and lot more more details soon. https://neofilms.movie/",1665599691,1
0.278,0.722,0.0,-0.4019,Here's Why You Lose Money On Crypto Staking,1665838254,-1
0.0,1.0,0.0,0.0,Staking: Make Your Tokens Work - educational card,1665495490,0
0.0,0.762,0.238,0.3612,The Ethereum wallet MetaMask now supports instant bank-to-crypto transfers,1665812307,1
0.0,1.0,0.0,0.0,How to implement a voting system for the employees of a company ?,1665767173,0
0.247,0.753,0.0,-0.5574,"Binance, Coinbase, Blockchain.com, Crypto.com, The Dapper, And Other Platforms To Ban Russians",1665819306,-1
0.143,0.765,0.091,-0.1952,"Further Elaborating on the Context of What This US Department Really Is ; ""Sassel.eth : All my friends are suing the U.S Treasvry Department and I couldn't be more proud of them""",1665699920,-1
0.0,0.729,0.271,0.3818,Why did my exchange credit me with EthereumPoW?,1665764569,1
0.0,0.909,0.091,0.0772,"An explainer on ""Zero-knowledge proofs"": its history, visual examples, landmark findings, zk-SNARK/STARK, post-quantum cryptography",1665527823,1
0.0,1.0,0.0,0.0,Curve Newsletter,1665473669,0
0.0,0.633,0.367,0.4404,ETH gas fees is getting better,1665486464,1
0.0,0.68,0.32,0.5106,Intro to Web3: The Internet of the Free,1665450168,1
0.0,0.816,0.184,0.2023,jat community eth domain important in future make offers,1665512737,1
0.0,1.0,0.0,0.0,Justin Sun accquiced Huobi exchange,1665388998,0
0.0,1.0,0.0,0.0,Polygon zkEVM Public Testnet: The Next Chapter for Ethereum — Polygon | Blog,1665496722,0
0.0,1.0,0.0,0.0,Will we ever be able to send transactions without a middle man?,1665766861,0
0.0,1.0,0.0,0.0,Ethereum’s Supply is Shrinking Again. Here’s Why,1665407967,0
0.0,1.0,0.0,0.0,Just bridged to Arbitrum for $25,1665785569,0
0.0,1.0,0.0,0.0,Self-Hosted Wallet?,1665399457,0
0.0,0.706,0.294,0.3612,Explain it to me like I'm 10.,1665437733,1
0.0,1.0,0.0,0.0,What is Airdrops? Follow Hefty Games on Instagram for more updates. Link is provided in comment section.,1665561838,0
0.0,0.762,0.238,0.3612,PinkChain - PoW + Staking | Ethash | Greater Alternative to PoW Ethereum,1665609903,1
0.0,1.0,0.0,0.0,Staking in rocket pool.,1665797655,0
0.0,0.934,0.066,0.2247,"October has become the worst-ever month for crypto-related crimes. Injective Labs CEO Eric Chen says ""we have to be very careful discerning what kind of hack it is.""",1665764608,1
0.0,1.0,0.0,0.0,NEW! 1 on 1 Affiliate Marketing Strategy,1665396702,0
0.0,0.796,0.204,0.3182,boom is still sure for some of us this year,1665594779,1
0.135,0.651,0.214,0.1779,X10M defi hedge fund. using ETH block chain and NFTs to create a more liquid and accessible asset,1665482137,1
0.0,1.0,0.0,0.0,Ethereum Goerli testnet is available!,1665578636,0
0.0,0.645,0.355,0.5106,Which cryptocurrency do you trust the most?,1665768606,1
0.0,1.0,0.0,0.0,Any ETA on eth2 (merge) locked staking unlock time?,1665462148,0
0.0,1.0,0.0,0.0,"Hullo, if I may have a moment of your time.",1665473775,0
0.363,0.637,0.0,-0.6908,Has Konami Chosen the Worst Time to Jump on the NFT Craze?,1665809828,-1
0.11,0.797,0.093,-0.1007,"You can now create your own onchain, permissionless, immutable chat walls! No accounts or backend, just transactions on the network.",1665752970,-1
0.0,1.0,0.0,0.0,Facts You Probably Didn’t Know About Vitalik Buterin,1665656190,0
0.0,1.0,0.0,0.0,CoinScan x Yahoo,1665672595,0
0.0,0.645,0.355,0.296,Join All The Blockchains Together,1665669169,1
0.0,0.642,0.358,0.5994,🎮 A web3 game is coming to the Super Bowl 😲,1665774032,1
0.0,0.597,0.403,0.4019,Support Manga Project with Crypto,1665458945,1
0.0,1.0,0.0,0.0,Bitcoin and economic nihilism,1665401803,0
0.0,1.0,0.0,0.0,"Hypothetically how would an ""irregular state change"" be executed in a post-merge Ethereum?",1665767141,0
0.0,1.0,0.0,0.0,BEEP BOOP BOTZ,1665501375,0
0.0,1.0,0.0,0.0,What wallet other than MetaMask do you use for Ethereum's DeFi ecosystem?,1665667153,0
0.0,1.0,0.0,0.0,ETA for unlocking locked eth in eth2?,1665462506,0
0.0,1.0,0.0,0.0,www.j-b.i-t.s-c.g.com,1665591403,0
0.0,1.0,0.0,0.0,Any Eventbrite alternatives using NFTs?,1665468285,0
0.0,0.837,0.163,0.4404,"Made a onchain, permissionless and immutable chat. Trollbox on the blockchain. Please be careful what you post. Beta. Also Polygon for cheap gas.",1665432882,1
0.0,1.0,0.0,0.0,Google started displaying balances of Ethereum wallets,1665516768,0
0.0,1.0,0.0,0.0,How are NFTs taxed?,1665570557,0
0.0,1.0,0.0,0.0,EU aims for 'integrated supervision' of DeFi on Ethereum.,1665426907,0
0.0,1.0,0.0,0.0,PoS quantum migration,1665410603,0
0.0,1.0,0.0,0.0,First cryptocurrency betting platform?,1665553700,0
0.0,1.0,0.0,0.0,how to teach your children,1665489287,0
0.0,1.0,0.0,0.0,Measuring and comparing decentralization of Ethereum Pre- and Post-Merge - Looking for additional Data and Literature,1665575321,0
0.0,0.793,0.207,0.2714,Top 5 Investment Models in the Blockchain World in 2022!,1665752549,1
0.0,1.0,0.0,0.0,Apparently EU regulations aren't enough: now G20 wants to clamp down on crypto,1665566324,0
0.0,1.0,0.0,0.0,What is Hefty Games? Follow Hefty Games on Instagram for more updates. Link is provided in comment section.,1665568975,0
0.072,0.885,0.043,-0.3415,"for Gamefi，The current token burning is mainly divided into official purchases in the market and players taking a small part to destroy in the process of using tokens. Which one do you think is more important and why? Of course, we are also doing token burns.",1665574325,-1
0.0,0.811,0.189,0.2732,France Energy Giant EDF Now Runs Over 150 Ethereum Nodes,1665656074,1
0.0,0.667,0.333,0.3612,PinkChain - Greater Alternative to PoW Ethereum,1665609885,1
0.0,1.0,0.0,0.0,BUY XRP NOW? OR NEVER! XRP Ripple - CRYPTO NEWS 2022!,1665586284,0
0.0,1.0,0.0,0.0,Optimism's Op Token inflation to be Rectified to 2%,1665651230,0
0.0,1.0,0.0,0.0,Ethereum merge,1665529908,0
0.0,0.741,0.259,0.2732,How to create a IDO Launchpad on ethereum?,1665578996,1
0.262,0.738,0.0,-0.4278,What does everyone here think of this greentext FUD?,1665771277,-1
0.0,1.0,0.0,0.0,Waitlist – WeSendit is the 1st. Gateway to the world of decentralised Storage Networks – WeSendit Token Switzerland 🇨🇭,1665412668,0
0.0,1.0,0.0,0.0,Found this listing. Is that 1280 ETH?,1665716330,0
0.0,1.0,0.0,0.0,Looking for some feedback from developers.,1665515241,0
0.0,0.672,0.328,0.5983,Brand new ADA wallet full node giving away 50$ for creating a wallet!,1665431540,1
0.173,0.827,0.0,-0.3182,Bought crypto for first time and am confused how to cash out.,1665583458,-1
0.0,0.698,0.302,0.0772,Oracle Node Host Challenges,1665413663,1
0.121,0.879,0.0,-0.4648,my dad got me an ethereum coin for my 18th birthday. i have absolutely no knowledge in stocks or whatever. what does this mean???,1665593235,-1
0.035,0.894,0.07,0.4682,"ETH was hot today I wonder what happened? dropped suddenly to $1,240s and then up to $1,320 and going ups still. after being subtle for a week! do you think trading now is a good idea?I mean even if you buy low at $1,240 and you don't trade you don't know where it is going?am I right?what you think?",1665715515,1
0.0,1.0,0.0,0.0,A search engine to keep up with Ethereum,1665772733,0
0.0,1.0,0.0,0.0,A16z Leads $14M Funding Round for New E-Commerce Platform From Twitch Co-Founder,1665671871,0
0.0,1.0,0.0,0.0,Are there any Infura/Alchemy decentralized equivalents?,1665762881,0
0.0,1.0,0.0,0.0,Reversible Transactions on Ethereum 🤔,1665710384,0
0.0,1.0,0.0,0.0,"By taking this position you bet that 30 days from now ETH will be below $2,500.1",1665407861,0
0.0,1.0,0.0,0.0,heard about dixwin,1665643433,0
0.0,1.0,0.0,0.0,EU Commission seeks automated Ethereum DeFi monitoring,1665417039,0
0.0,1.0,0.0,0.0,Ethereum Serenity ETH 2.0 DeFi,1665588965,0
0.0,0.789,0.211,0.6808,We have a new API tool out and are looking for ETH developer feedback. Care to come play? (those of us not at Bogota).,1665515038,1
0.0,1.0,0.0,0.0,jat community domain valiable for gitiy,1665515190,0
0.0,1.0,0.0,0.0,"Hullo, if i may have a moment of your time.",1665470761,0
0.0,1.0,0.0,0.0,X10M REDEFINING your Returns,1665825012,0
0.0,1.0,0.0,0.0,Libonomy Blockchain Introduction,1665404926,0
0.0,1.0,0.0,0.0,What is NFT 1:1? Follow Hefty Games on Instagram for more updates. Link is provided in comment section.,1665557395,0
0.0,1.0,0.0,0.0,The new feature packed update of Libonomy OS is out NOW!,1665591946,0
0.0,0.775,0.225,0.4404,Detailed Explanation of ETHF DAO: Building the Strongest Ethereum PoW Community,1665470158,1
0.0,1.0,0.0,0.0,Crypto Influencers,1665755449,0
0.0,0.645,0.355,0.296,Join All The Blockchains Together,1665407195,1
0.298,0.357,0.345,0.1027,How safe is lazy minting?,1665714458,1
0.259,0.741,0.0,-0.3612,Censored Ethereum Blocks Hit the 51% Threshold Over the Past 24 Hours,1665778110,-1
0.0,0.645,0.355,0.296,Join All The Blockchains Together,1665761384,1
0.0,1.0,0.0,0.0,Blockchain developer/engineer,1665697504,0
0.0,0.806,0.194,0.4767,I am in the United States and want to vote in Primaries based on candidates positions towards crypto - any recommendations?,1665599872,1
0.16,0.84,0.0,-0.2732,🎮 The SEC is going after the creators of Bored Ape Yacht Club 😲,1665592119,-1
0.0,1.0,0.0,0.0,Running solo Validator,1665681492,0
0.0,0.839,0.161,0.3612,Hypothetically how would a state change like the DAO fork be executed in a post-merge Ethereum?,1665767182,1
0.0,0.806,0.194,0.34,Amsterdam Diamond Club - first company offering to buy diamonds in eth?,1665434068,1
0.31,0.69,0.0,-0.4019,What Problem Is Crypto Trying To Solve❓,1665539824,-1
0.0,1.0,0.0,0.0,Mastercard To Turn Crypto Into Regular Payment Method,1665758088,0
0.0,1.0,0.0,0.0,Should We Continue To Downplay Our Political Counterparts?,1665398688,0
0.084,0.772,0.144,0.4019,"StoryLine: After the merge , institutions are going to rush in. Inflation will get crazy. BTC and ETH will be great inflation hedges. What happened?",1665808711,1
0.0,0.645,0.355,0.296,Join All The Blockchains Together,1665578982,1
0.0,1.0,0.0,0.0,Modular Rollup Theory Through the Lens of the OP Stack,1665793529,0
0.0,1.0,0.0,0.0,Mark mic dropping,1665535974,0
0.0,1.0,0.0,0.0,Something is Burning major amounts of Eth,1665408568,0
0.0,1.0,0.0,0.0,Crypto Influencers,1665755515,0
0.0,0.656,0.344,0.6369,Best Coins For Staking: The Ultimate List Of Five,1665410130,1
0.0,1.0,0.0,0.0,Any Markedplaces for crypto (EU),1665679948,0
0.0,1.0,0.0,0.0,Basketball Match,1665812804,0
0.0,0.755,0.245,0.3818,Google To Accept Bitcoin And Crypto For Cloud Services,1665503543,1
0.0,1.0,0.0,0.0,Where where i short ethereum? Which defi apps can i access thru metamask to short/long eth,1665536284,0
0.0,1.0,0.0,0.0,What Are Rollups and How Can They Act as a Facilitator To Achieve Greatness,1665602265,0
0.0,0.671,0.329,0.6597,I painted Vitalik in oil. Thought y’all might enjoy and wanted to share ☺️,1665642419,1
0.0,0.758,0.242,0.7501,BabyTsuka (Dwagon) are taking over and it's going to be hot because they are fully prepared to explore. Best lnvestment option 💎.,1665740829,1
0.0,1.0,0.0,0.0,DAO member input needed - 1 min survey!,1665500672,0
0.0,1.0,0.0,0.0,Consolidación criptográfica en el tercer trimestre,1665402192,0
0.0,1.0,0.0,0.0,The absolute fucking state of defi. (Robert = Founder of Compound),1665577976,0
0.231,0.769,0.0,-0.5994,Did ethereum die after the merge what is happening? Will it ever rise again,1665667369,-1
0.0,1.0,0.0,0.0,Bringing NFT into DeFi is a game changer,1665649003,0
0.0,1.0,0.0,0.0,Sassal.eth Explains The New Concept of Making Ethereum Censorship Resistant with Dapp Net,1665591902,0
0.0,1.0,0.0,0.0,How are DAOs taxed?,1665422095,0
0.0,1.0,0.0,0.0,Do I have to do anything to merge my Eth too PoS?,1665718310,0
0.0,1.0,0.0,0.0,Go check out my NFT on Open Sea,1665692724,0
0.0,1.0,0.0,0.0,syncing Etherium blockchain on my desktop.,1665746344,0
0.0,1.0,0.0,0.0,Ethereum Merge 2022: Why ethereum is going down after The Merge?,1665579836,0
0.0,0.748,0.252,0.4019,Regulatory Clarity Is Here. What's Next for Crypto Exchanges?,1665590373,1
0.0,1.0,0.0,0.0,CAN YOU GUESS WHO IS ADOPTED? 😲🤔 #shorts,1665681596,0
0.0,0.204,0.796,0.5994,beautiful scenerylandscape,1665555471,1
0.126,0.739,0.135,0.0516,A block was just mined with 112 ETH in rewards. This is out of control. It's time to activate EIP-1559.,1665546736,1
0.0,1.0,0.0,0.0,Web3 en la Semana de la Moda de París,1665401739,0
0.0,0.0,1.0,0.5859,wow,1665690279,1
0.0,1.0,0.0,0.0,Vitalik’s view on zkEVM and its impact on Ethereum’s future as a blockchain:,1665452406,0
0.0,1.0,0.0,0.0,"Do rollups need to be ""filled"" before they are posted to L1?",1665680922,0
0.0,1.0,0.0,0.0,how much you have earned/lost in last 2 years only,1665772579,0
0.0,1.0,0.0,0.0,Latest Week in Ethereum News,1665798139,0
0.0,1.0,0.0,0.0,Thoughts on crypto betting 🤔,1665825652,0
0.0,1.0,0.0,0.0,Measuring Decentralization of Ethereum Pre- and Post-Merge - Looking for Data and Literature,1665571913,0
0.18,0.82,0.0,-0.296,I am a small SHIB influencer having my doubts about the dog coin,1665470888,-1
0.0,1.0,0.0,0.0,SBSA Technologies - EDI,1665497385,0
0.0,1.0,0.0,0.0,"What is going on, at devcon6??",1665708248,0
0.0,1.0,0.0,0.0,Decentralized Lottery,1665398198,0
0.0,1.0,0.0,0.0,"ganas: A Wallet for the Inter-Chain. Write, compile, deploy EVM contracts and prototype dApps. From Mobile &amp; Web.",1665406691,0
0.0,0.649,0.351,0.4019,Seeking the help for lifesaving cause,1665494743,1
0.126,0.739,0.135,0.0516,A block was just mined with 112 ETH in rewards. This is out of control. It's time to activate EIP-1559.,1665807361,1
0.0,1.0,0.0,0.0,OMG THE REAL VITALIK CONTACTED ME!!!! ….wait a minute -.0,1665570438,0
0.0,1.0,0.0,0.0,Solidity assembly,1665695054,0
0.0,0.513,0.487,0.2263,"Okay, Wait a minute....What?",1665400647,1
0.524,0.476,0.0,-0.296,Avoid getting scammed,1665825552,-1
0.0,1.0,0.0,0.0,ENS Expiring,1665766325,0
0.0,1.0,0.0,0.0,Vitalik’s view on zkEVM and its impact on Ethereum’s future as a blockchain:,1665427379,0
0.0,1.0,0.0,0.0,How do sanctions work on Tornado Cash?,1665712706,0
0.0,1.0,0.0,0.0,Redefining INVESTMENTS and Returns,1665833277,0
0.0,1.0,0.0,0.0,Parlay Contest,1665726872,0
0.247,0.753,0.0,-0.5574,"Binance, Coinbase, Blockchain.com, Crypto.com, The Dapper, And Other Platforms To Ban Russians",1665818975,-1
0.0,0.656,0.344,0.6369,Who are the best Ethereum/Bitcoin TA accounts to follow?,1665806758,1
0.0,0.739,0.261,0.5974,"Need some test ETH on the Goerli testnet, would be highly appreciated!",1665833975,1
0.094,0.906,0.0,-0.3818,The Bank of England decides to act in an emergency and announces the continuation of quantitative easing… What impact will this have on the crypto market?,1665777837,-1
0.186,0.814,0.0,-0.5307,WARNING. Crypto.com will lock all Russian accounts at 10/15/22 06:00 am UTC. Withdraw you funds NOW!,1665803999,-1
0.0,1.0,0.0,0.0,Ethereum has a new issue that wasn’t on the horizon before - the centralization,1665778127,0
0.174,0.592,0.234,0.2265,ETH gas fees dropped! LOVE IT! But what caused the drop?,1665423615,1
0.131,0.869,0.0,-0.3724,sent ETH to an address but he does not received value and Transaction Hash Overview is not normal,1665699332,-1
0.0,1.0,0.0,0.0,Neon Rain,1665745963,0
0.0,1.0,0.0,0.0,usdt transfer without gas??,1665482827,0
0.0,1.0,0.0,0.0,Not your keys not your crypto!!,1665626327,0
0.0,1.0,0.0,0.0,How have your political views changed since you got into crypto?,1665637430,0
0.0,0.868,0.132,0.3802,"Even Vitali, the creator of Ethereum, heard the voice of the Iranian people and supported the Iranian people!",1665839266,1
0.0,1.0,0.0,0.0,Social Experiment through eth,1665470705,0
0.0,0.85,0.15,0.3182,"Supply of Ethereum in circulation drops by 4,000 ETH in 2 days; Price increase ahead?",1665484109,1
0.0,0.507,0.493,0.7783,Best Podcasts / Newsletters Focused on Business / Strategy in Crypto,1665682494,1
0.0,1.0,0.0,0.0,Libonomy Blockchain Introduction,1665759453,0
0.071,0.571,0.357,0.8402,"America's fastest loan Every day, we help people looking to secure a loan, obtain information about debt relief, credit monitoring and other solutions to meet your needs.",1665578899,1
0.0,1.0,0.0,0.0,3 strategies on how to make money with DeFi,1665815915,0
0.0,1.0,0.0,0.0,EIP-1153 Transient Storage,1665786723,0
0.0,1.0,0.0,0.0,Some tools for undestanding web3 and Solidity development,1665688747,0
0.056,0.872,0.072,0.1531,If only there was a popular decentralized platform where users and creators could connect their wallet and transact with a currency where banks have no way of meddling in people’s private lives. If only that platform existed. Hmmm 🤔,1665593207,1
0.174,0.826,0.0,-0.2755,Em nhận thiết kế logo ạ (free if you don't like it),1665489645,-1
0.0,1.0,0.0,0.0,Mark mic dropping,1665529939,0
0.0,1.0,0.0,0.0,"Hypothetically how would an ""irregular state change"" be done in a post-merge Ethereum?",1665767263,0
0.0,1.0,0.0,0.0,Eth2?,1665491918,0
0.0,0.0,0.0,0.0,D,1665551363,0
0.0,1.0,0.0,0.0,BNY Mellon Now Offering Bitcoin And Ethereum Custody Services,1665500816,0
0.0,1.0,0.0,0.0,Launching a simple wallet on your phone that replaces hardware wallets,1665598361,0
0.0,1.0,0.0,0.0,Etherium pow,1665481097,0
0.0,1.0,0.0,0.0,DeFi Protocol Bancor Voting to Burn Over 10% Of BNT Token Supply,1665479357,0
0.234,0.657,0.109,-0.4019,Legal action against DAO Maker for USDR compensation steal of funds,1665567549,-1
0.076,0.859,0.065,-0.1027,"Google now supports data on Ethereum addresses directly when searching. When searching for an Ethereum address on Google, the search engine shows the wallet's ETH balance. The data comes from the Ethereum block explorer Etherscan.",1665497570,-1
0.0,0.843,0.157,0.4404,"Made an onchain, permissionless and immutable chat. Trollbox on the blockchain. Please be careful what you post. Beta. Also Polygon for cheap gas.",1665432963,1
0.0,1.0,0.0,0.0,Ultra Sound ETH - The Daily Gwei #532,1665580276,0
0.0,0.812,0.188,0.5719,"Where can I observe the reward distribution of protocols such as LP, yield farming, etc... on ether scan?",1665424711,1
0.334,0.666,0.0,-0.7207,Will Illuvium Dominate P2E NFT Gaming or Completely FAIL? | Survival Mode Closed Beta Review,1665672518,-1
0.0,0.748,0.252,0.3321,This really puts ETH’s energy consumption in perspective.,1665517094,1
0.512,0.488,0.0,-0.2732,Cop or drop?,1665564977,-1
0.0,1.0,0.0,0.0,Ethereum addresses are now searchable on google,1665509576,0
0.085,0.667,0.248,0.5719,If anyone wants pay for my rent month that would be great £775,1665604332,1
0.0,0.864,0.136,0.7003,"For a good c. .r .y .p .t .o lnve$tment T•E•X•T••M•E ON W•H•A•T•S•A••PP +•1•2-0-6-5-5-2-9-2-0-1 for• more• guidelines on how to start up your trading account, your profit is sent 24hrs after trading is completed into your wallet address or cashapp",1665740970,1
0.0,1.0,0.0,0.0,"Now that ETH is proof of stake, can you do on chain randomization?",1665517708,0
0.0,1.0,0.0,0.0,Measuring decentralization of Ethereum Pre- and Post-Merge - Looking for Data and Literature,1665572428,0
0.0,1.0,0.0,0.0,Who can relate?,1665675628,0
0.0,0.795,0.205,0.2023,CoinCenter sues Treasury and OFAC over Tornado Cash,1665611828,1
0.0,0.847,0.153,0.4404,Keeping larger amount of USD on Kraken or in USDS in ledger wallet - Is it safe enough?,1665578195,1
0.0,1.0,0.0,0.0,Eth perp OI,1665407273,0
0.0,1.0,0.0,0.0,How much it costs to buy access to crypto influencers:,1665674777,0
0.42,0.58,0.0,-0.4404,Ethereum Block Explorers and APIs,1665667317,-1
0.0,0.843,0.157,0.4404,"Made an onchain, permissionless and immutable chat. Trollbox on the blockchain. Please be careful what you post. Beta. Also Polygon for cheap gas.",1665432984,1
0.123,0.877,0.0,-0.4215,"Doesn't the fact that we rely on so many centralized services when pertaining to Ethereum render the whole ""decentralized"" concept useless?",1665719105,-1
0.0,1.0,0.0,0.0,where is ETH going?,1665715293,0
0.0,1.0,0.0,0.0,"For the first time in my life I could purchase Ethereum directly from an ATM here in Geneva (Switzerland)! I could also purchase Bitcoin, Litecoin and Monero",1665827162,0
0.0,0.861,0.139,0.2732,Ethereum saw $15.6M in NFT sales volume from 61K TXs in the past 24H,1665478751,1
0.0,0.674,0.326,0.4404,"Libonomy - Interoperable, scalable and truly decentralized blockchain",1665760715,1
0.0,0.609,0.391,0.8402,How to create an ERC721 NFT the best way in 5minutes (with smart contracts and metadata code),1665440753,1
0.0,1.0,0.0,0.0,Thoughts??😆,1665400130,0
0.0,1.0,0.0,0.0,Appetite for Redistribution: Budgeting for All,1665442208,0
0.188,0.812,0.0,-0.4588,All the people saying ETH would pump after the merge are awful quiet now,1665591688,-1
0.15,0.709,0.142,-0.0258,50% of Ethereum (ETH) blocks are subject to US Treasury demands,1665753857,-1
0.0,1.0,0.0,0.0,Need some feedback from Ethereum developers!,1665515123,0
0.0,1.0,0.0,0.0,"Ethereum Cat Herders EIPIP, 6 Oct 2022 open meeting",1665582193,0
0.0,1.0,0.0,0.0,DAO member input needed!,1665500611,0
0.0,1.0,0.0,0.0,How to Launch a ICO in ethereum?,1665491883,0
0.0,0.746,0.254,0.5267,Own not just a piece of art but creativity: Neo Films NFT,1665589950,1
0.0,0.728,0.272,0.6249,Great news to start the week: Beamer Bridge is live on Mainnet 🎉,1665417178,1
0.0,1.0,0.0,0.0,Cross-Chain Uniswap (Uniswap x Stargate),1665507007,0
0.0,1.0,0.0,0.0,When is the ETH2 unlock date?,1665764085,0
0.0,1.0,0.0,0.0,Will all Devcon talks be available online after the conference?,1665515965,0
0.057,0.943,0.0,-0.1027,DeFi isn’t hard to learn. People simply never had to understand ROIs and APYs. The banks used to do all the work for us.,1665563239,-1
0.0,0.204,0.796,0.5994,beautiful scenerylandscape,1665835224,1
0.0,1.0,0.0,0.0,Is it Possible to Reverse Transactions on the Ethereum Network?,1665391259,0
0.0,0.68,0.32,0.5803,How is the Devcon going? Are you enjoying it?,1665544777,1
0.0,1.0,0.0,0.0,Poll: Been a while since last i heard or seen about ETH after the merge...,1665427661,0
0.0,1.0,0.0,0.0,What is the end game for Ethereum?,1666233677,0
0.0,0.508,0.492,0.4404,A truly interoperable blockchain - Libonomy,1666281762,1
0.0,0.729,0.271,0.3818,How can we protect hacks on Ethereum bridges,1665951868,1
0.0,0.828,0.172,0.3612,What do we think about Vitalik tacitly endorsing Ethereum based memecoins like $THE?,1666217033,1
0.0,1.0,0.0,0.0,Advice,1665977952,0
0.116,0.884,0.0,-0.1779,"The gas has been weird lately, I thought the merge was supposed to fix that.",1665968940,-1
0.0,1.0,0.0,0.0,Digital Platform Sells House as an NFT,1666193630,0
0.0,1.0,0.0,0.0,Czym jest Binance Simple Earn? Jak zarabiać na kryptowalutach z Binance?,1666277453,0
0.0,1.0,0.0,0.0,Everyone should buy cosmos it’s gonna go up,1665954124,0
0.0,1.0,0.0,0.0,zkEVM question?,1666260449,0
0.122,0.878,0.0,-0.2382,What if ethereum proposer block is chosen randomly but with another condition than the actual,1665969449,-1
0.0,1.0,0.0,0.0,HeyLink.me | Customer4730,1666065140,0
0.0,0.704,0.296,0.4939,"Zkapps, or zero-knowledge smart contracts, have launched on the testnet of Mina",1666131404,1
0.121,0.879,0.0,-0.4648,my dad got me an ethereum coin for my 18th birthday. i have absolutely no knowledge in stocks or whatever. what does this mean???,1666236411,-1
0.0,0.484,0.516,0.7506,Hasbro Monopoly nft mint (free) is pretty exciting,1665963083,1
0.0,0.863,0.137,0.2263,Is it okay that i need to spend 58$ to make transaction of 28$?,1665937909,1
0.0,1.0,0.0,0.0,ShrinkMe.io,1665997125,0
0.0,1.0,0.0,0.0,Digital Platform Sells House as an NFT on OpenSea,1666183743,0
