neg,neu,pos,compound,headline,time,label
0.221,0.779,0.0,-0.5267,Lessons from the Field: Threat Modeling for the Everyday Use of Digital Currency,1666644663,-1
0.0,1.0,0.0,0.0,personal project mentorship?,1666700079,0
0.0,1.0,0.0,0.0,My private keys were compromised.,1666620754,0
0.0,0.801,0.199,0.4995,realistically how long can a TX be pending if you don't have enough for gas,1666710206,1
0.487,0.513,0.0,-0.5859,Reccomendations For Tackling ETH Scams?,1666398469,-1
0.109,0.801,0.09,-0.1315,Betaverse is the gambling project that you should really looked for! For more info join in the discord 👇 🔥 https://discord.gg/5T4JmRNk 🔥 #crypto #gambling #giveaway #casino #betaverse,1666616859,-1
0.189,0.811,0.0,-0.1027,Will Shanghai Hard Fork reduce gas fees?,1666360979,-1
0.0,1.0,0.0,0.0,mx BANDANA GANG,1666435958,0
0.0,1.0,0.0,0.0,Crypto Trading Bot,1666431965,0
0.0,0.795,0.205,0.8225,"“There’s always challengers to Ethereum, but the number one challenger keeps changing,” says Ernst &amp; Young Principal and Global Innovation Leader Paul Brody. “None of them seem to be able to cross the threshold of more than ... 15% market share before at some point imploding.”",1666376446,1
0.0,1.0,0.0,0.0,تعدين ٣عملات رقمية فى وقت واحد,1666598942,0
0.0,1.0,0.0,0.0,Testing a post here,1666705275,0
0.0,0.25,0.75,0.4588,Personal improvement,1666762857,1
0.0,0.847,0.153,0.4019,What programming league do I need to know to be able to learn Solidity and Smart Contro?,1666467686,1
0.545,0.455,0.0,-0.34,Omg crazy ens,1666732596,-1
0.122,0.742,0.136,-0.128,DeFi Has a Fourth and First amendment Crisis In The Making. The US Is On a Power Trip. Non US Citizens Have a Vested Interest In Getting The US Laws Changed.,1666454326,-1
0.0,0.765,0.235,0.5574,"If 18 000 000 ethereum are being generated per year, how is my stable amount maintaining value?",1666404908,1
0.0,1.0,0.0,0.0,How ethereum’s merge made crypto mining more sustainable,1666754243,0
0.0,0.859,0.141,0.3182,Please Look us up on twitter @bbvsea. We are an NFT project with travel utility,1666667807,1
0.152,0.514,0.334,0.4155,"Not sure what happened, but I like it.",1666713464,1
0.0,1.0,0.0,0.0,The State of Ethereum L2s - An overview of L2 scaling and adoption so far,1666694872,0
0.0,1.0,0.0,0.0,How to Transfer Tether USDT to PayPal Instantly | Sell USDT for PayPal,1666526890,0
0.0,0.469,0.531,0.7783,Free instant 3-3000$ signup bonus [No deposit needed],1666585686,1
0.0,1.0,0.0,0.0,Comparison of donations for Ukraine using cryptocurrencies,1666470639,0
0.0,1.0,0.0,0.0,"Now that EIP2535 Diamonds is Final, what is next?",1666449722,0
0.0,0.734,0.266,0.4404,Does anyone know where I can find a good tokenomics calculator?,1666363344,1
0.0,0.588,0.412,0.5423,Get 6 USDT as a sign up bonus,1666348946,1
0.0,1.0,0.0,0.0,Curve Newsletter,1666702848,0
0.0,0.791,0.209,0.4404,A digital gifting platform where you can seamlessly send ETH gift via email,1666767714,1
0.0,1.0,0.0,0.0,FOLLOW ME ON OPENSEA,1666366497,0
0.0,1.0,0.0,0.0,‪Over 7 million #Python coders now have open access to #Web3 development tools.,1666463400,0
0.0,1.0,0.0,0.0,Ethereum head,1666718633,0
0.0,0.682,0.318,0.504,Are airdrops a good strategy? What do you think?,1666628959,1
0.0,1.0,0.0,0.0,Next Gamestop for next week (0xApemfers),1666440060,0
0.112,0.729,0.159,0.2732,"""The rich acquire assets, while the poor and the middle class acquire liabilities and think of them as assets"" Robert T - Kiyosaki #token #blockchain #bitcoin #crypto #cryptocurrency #ethereum #btc #nft #coin #eth #exchange #ico #investment #cryptonews #defi #cryptocu",1666576391,1
0.0,1.0,0.0,0.0,🌟📑💻WTF is Star anyway... and why do i need an omni chain domain name service?! 🚀🔥💸,1666358758,0
0.0,1.0,0.0,0.0,What is IPO ?,1666441170,0
0.0,0.639,0.361,0.4263,TOP 10 Crypto Picks For you!,1666617928,1
0.182,0.818,0.0,-0.25,US Government Concerned - Financial Regulator Shortage due to Crypto Jobs,1666751148,-1
0.0,1.0,0.0,0.0,Electronics store in Israel named after Ethereum.,1666719170,0
0.0,0.843,0.157,0.0772,Anyone want goerli ethereum in return for something?,1666447083,1
0.0,1.0,0.0,0.0,Check out this campaign I just joined,1666341232,0
0.0,1.0,0.0,0.0,🎉 20M TOKEN GIVEAWAY 🎉,1666588524,0
0.0,1.0,0.0,0.0,bear call sell #SP500 call price 3785.16 volume at call price 0 time of call 2022-10-24T18:00:01Z,1666634412,0
0.688,0.312,0.0,-0.765,"The Leaked ""DeFi Killer"" Bill",1666459048,-1
0.0,1.0,0.0,0.0,Have you seen that there's a Reddit Collectible Avatar that has an Ethereum logo?,1666383819,0
0.0,1.0,0.0,0.0,How do 64-characters ETH work? Is this valid vs. my 40-character address?,1666480881,0
0.0,1.0,0.0,0.0,What is an Ethereum Node: Clients and Network Infrastructure,1666444819,0
0.0,0.645,0.355,0.296,Join All The Blockchains Together,1666528163,1
0.0,0.866,0.134,0.4767,Sign up for the Mara Wallet waitlist and receive rewards in USD and crypto for future use on Mara Wallet https://mara.xyz/me/NQM416,1666688484,1
0.0,0.679,0.321,0.9062,GOLDEN FARM - 100% Free Passive Income! - P2E Faucet Game - Collect FREE immortal birds that lay eggs 24/7 - Sell the eggs for Bitcoin or cash! - Earn 20% of your referral's income!!!,1666469781,1
0.0,0.795,0.205,0.4767,Sign up for the Shibalearn waitlist and receive rewards in USD and crypto.,1666705561,1
0.0,1.0,0.0,0.0,Gassed,1666465292,0
0.0,1.0,0.0,0.0,Do you still believe in eth?,1666390960,0
0.0,1.0,0.0,0.0,"DeFi hacks, will they ever cease?",1666727342,0
0.0,1.0,0.0,0.0,"ganas: A Wallet for the Inter-Chain. Work in ganas Web -&gt; execute on ganas Mobile (mobile wallet execution environment), with WalletConnect v2",1666440544,0
0.133,0.678,0.189,0.2095,Not sure what’s happening…as I’m still green on all this…but I like it!,1666713382,1
0.0,1.0,0.0,0.0,crypto,1666418060,0
0.0,1.0,0.0,0.0,Why neume's only tightly-coupled dependency must be an L1,1666370838,0
0.0,1.0,0.0,0.0,will Reddit double the size of EVM users?,1666597853,0
0.0,1.0,0.0,0.0,PetZ Money | Focus to Earn | 1000x GEM | 0% Tax | Unique | Doxxed Team,1666609131,0
0.0,0.722,0.278,0.4019,A new statistic on active Dapp users per blockchain.,1666748051,1
0.0,1.0,0.0,0.0,How is crypto gambling taxed?,1666752823,0
0.0,1.0,0.0,0.0,Vitalik,1666345230,0
0.0,1.0,0.0,0.0,Viewpoints For An Interoperable Future,1666519823,0
0.0,1.0,0.0,0.0,Yield Slices are a new DeFi primitive for trading yield allocations,1666734735,0
0.147,0.853,0.0,-0.2732,Tax code section 6050I and “digital assets”: This overlooked surveillance and reporting mandate should be struck from the infrastructure bill,1666542319,-1
0.0,1.0,0.0,0.0,Anyone looking for test network ethereum?,1666435962,0
0.0,1.0,0.0,0.0,Check out this campaign I just joined,1666598622,0
0.0,1.0,0.0,0.0,Vitalik Buterin'in Övdüğü Scroll Nedir?,1666770233,0
0.0,0.78,0.22,0.4767,Sign up for the StableDao waitlist and receive rewards of $100 Airdrop,1666783966,1
0.0,1.0,0.0,0.0,Calling all Ethereum Gods,1666588977,0
0.0,1.0,0.0,0.0,Pump,1666640295,0
0.0,1.0,0.0,0.0,Working in Web3 and Living in Australia,1666427451,0
0.0,0.957,0.043,0.0772,"Suppose you want to build the following environment for the release of your own coin or token , what will be the steps you take to build the architecture : https://sweatco.in/ https://sweateconomy.com/",1666433012,1
0.0,1.0,0.0,0.0,Comparison of donations to Ukraine using cryptocurrencies,1666475128,0
0.0,1.0,0.0,0.0,Libonomy Blockchain Introduction,1666364194,0
0.0,1.0,0.0,0.0,Transaction Ordering and Payment Post-Ex,1666696208,0
0.0,0.444,0.556,0.6124,Please Help with Opera Crypto Wallet,1666765570,1
0.0,0.827,0.173,0.5267,"If by sheer luck I come to own the ""zero"" address, do I have a right legally and ethically speaking, to all the funds within it?",1666555265,1
0.0,1.0,0.0,0.0,Hexcode,1666717430,0
0.0,1.0,0.0,0.0,The new feature packed update of Libonomy OS is out NOW!,1666630115,0
0.277,0.723,0.0,-0.6808,We need a function within ETH to timeout transactions that are in pending hell,1666717245,-1
0.385,0.615,0.0,-0.7845,"This is just to Withdraw $20, what the actual fuck, this is criminal",1666470255,-1
0.0,1.0,0.0,0.0,DualChain developments on V2 | Recent Announcements,1666451480,0
0.383,0.617,0.0,-0.4767,"CARDING, SPAMMING, HACKING, LOADING AND MORE",1666418249,-1
0.0,1.0,0.0,0.0,looking to get started in cryypto?,1666691936,0
0.117,0.653,0.23,0.4712,"The Metaverse Is Failing, But This Is One Investment That Will Not Die - Forbes",1666638583,1
0.0,1.0,0.0,0.0,hey quick lay man question,1666700277,0
0.0,1.0,0.0,0.0,"""Buy-to-earn""? !",1666710993,0
0.0,1.0,0.0,0.0,I’m the creator of the most viral ETH related meme AMA,1666638994,0
0.574,0.426,0.0,-0.4019,Error in Remix,1666717502,-1
0.0,1.0,0.0,0.0,Node discovery in execution layer,1666454592,0
0.18,0.562,0.258,0.34,Non US Citizens Have a Vested Interest In Getting The US To Leave DeFi alone.,1666454888,1
0.0,1.0,0.0,0.0,Opinions?,1666740416,0
0.0,0.827,0.173,0.5267,"If by sheer luck I come to own the ""zero"" address, do I have a right legally and ethically speaking, to all the funds within it?",1666555237,1
0.135,0.675,0.19,0.1027,"I, Degen Weekly Crypto Security Round-Up 10/21/22- Alpha Hunting w/Forta Threat Intel Bots &amp; Devcon 6 Security Talks Review, &amp; More",1666540167,1
0.0,1.0,0.0,0.0,What programming language do I need to be able to learn Solidity? Python or JavaScrip,1666467842,0
0.0,0.167,0.833,0.6124,Help me please,1666698080,1
0.231,0.769,0.0,-0.5574,Turkey busts an illegal betting organization and seizes $40 million in cryptocurrency (Report),1666467108,-1
0.0,1.0,0.0,0.0,#Callisto_Network that has cold staking feature!,1666698500,0
0.35,0.65,0.0,-0.8658,"With a vicious pact, an ancient force of death is getting out of the eternal prison. The tarnished are returning to Nidar...",1666697776,-1
0.0,0.825,0.175,0.1779,Crypto bank SEBA Adds Custody Solutions for Ethereum NFTs,1666787838,1
0.048,0.862,0.09,0.278,"They are already on sale at a very low price, it came out a few days ago, and next Saturday comes the second season ..., if there is anyone interested in buying or entering the project, do not hesitate to contact me here on reddit or privately. https://opensea.io/es/collection/the-boys-season-2",1666472387,1
0.351,0.649,0.0,-0.4019,My metamask wallet has been hacked,1666342224,-1
0.0,0.738,0.262,0.4939,"Fyre Festival island to be transformed into luxe, crypto-only resort",1666346744,1
0.0,1.0,0.0,0.0,AI and the Blockchain: Are we Living Through the 4th Industrial Revolution?,1666533900,0
0.0,1.0,0.0,0.0,Ethereum now used to kickstart and presale other networks coins; Proof of Memes network,1666718686,0
0.0,1.0,0.0,0.0,Send Ethereum!,1666740777,0
0.14,0.661,0.198,0.1027,"I, Degen Weekly Crypto Security Round-Up 10/21/22 - Alpha Hunting w/Forta Threat Intel Bots, Devcon 6 Security Talks Review, &amp; More.",1666540933,1
0.0,1.0,0.0,0.0,Who is Gavin Wood? - Ethereum Founding Father,1666544528,0
0.0,0.674,0.326,0.4404,"Libonomy - Interoperable, scalable and truly decentralized blockchain",1666529019,1
0.0,0.204,0.796,0.5994,beautiful scenerylandscape,1666570424,1
0.0,0.822,0.178,0.703,Delegatecall is nothing to fear as long as you understand it and know how to use it safely. What you need to know about delegatecall is in this article.,1666569861,1
0.0,1.0,0.0,0.0,$FLR Token Distribution Event (TDE) has a new date: January 2023,1666774820,0
0.0,0.488,0.512,0.6369,Best ways to earn ETH,1666749253,1
0.0,0.674,0.326,0.4404,"Libonomy - Interoperable, scalable and truly decentralized blockchain",1666453089,1
0.0,0.769,0.231,0.34,Premium NFTs future value: Should I buy BAYC or a PUNK?,1666505460,1
0.0,1.0,0.0,0.0,Goerli eth tokens,1666564556,0
0.0,1.0,0.0,0.0,bear call sell #SP500 call price 3824.29 volume at call price 0 time of call 2022-10-26T06:00:00Z,1666764008,0
0.318,0.471,0.212,-0.2263,4 big problems to solve in crypto,1666453799,-1
0.0,1.0,0.0,0.0,A reminder to spread the hash(GET OFF WOOLYPOOLY),1666567829,0
0.0,0.674,0.326,0.4404,"Libonomy - Interoperable, scalable and truly decentralized blockchain",1666452387,1
0.0,0.775,0.225,0.4939,$YOU - a new Vitalik Inspired Token launches to take on $THE Protocol (ERC-20),1666438496,1
0.0,1.0,0.0,0.0,bear call sell #ETHUSDT call price 1457.77 volume at call price 17196.44263423 time of call 2022-10-25T23:00:00Z,1666738805,0
0.0,1.0,0.0,0.0,bear call sell #GOLD call price 1649.068 volume at call price 117566 time of call 2022-10-24T08:00:00Z,1666598405,0
0.0,1.0,0.0,0.0,Issues with regulations,1666473005,0
0.0,1.0,0.0,0.0,Upload NFT On Blockchain.,1666677400,0
0.0,1.0,0.0,0.0,weth to Coinbase,1666685181,0
0.266,0.734,0.0,-0.368,Cardano: ADA could be UNSTOPPABLE. (1 MILLION TPS),1666528913,-1
0.0,1.0,0.0,0.0,Ethereum (by Dall-E),1666641602,0
0.0,0.645,0.355,0.296,Join All The Blockchains Together,1666454118,1
0.0,0.672,0.328,0.5994,Super Protocol Test TEE token Promo Staking Event [Guide],1666705942,1
0.0,1.0,0.0,0.0,"“They announced plans to make the UK a crypto hub, and since then they’re on their fourth finance minister,” CoinDesk regulatory reporter Jack Schickler says.",1666374307,0
0.0,1.0,0.0,0.0,"Do rollups need to be ""filled"" before they are posted to L1?",1666474992,0
0.0,0.793,0.207,0.8221,#LeisureMetaverse #playNomm #BPS #Metaverse #NFT #NFTs #ETH #Ethereum #NFTCommunity #Passivelncome #Investment.This is very interesting project with big goals ahead project looks promising and there is a professional team working on ot. i believe this project has a bright future.,1666341463,1
0.371,0.337,0.292,-0.1779,DNS over HTTPS resolve failed,1666514965,-1
0.0,1.0,0.0,0.0,Frequently Asked Questions + Weekly Discussion Thread,1666591211,0
0.0,1.0,0.0,0.0,https://www.ens.vision/name/goldmidas,1666638974,0
0.0,0.645,0.355,0.296,Join All The Blockchains Together,1666704761,1
0.0,1.0,0.0,0.0,Looking for developer feedback on our new no-code blockchain filtering tool!,1666706254,0
0.041,0.87,0.089,0.4329,Will you stake your ether on an exchange and no longer have control over the keys? Or will you keep your keys by holding your bag in cold storage but give up on the staking gains?,1666473037,1
0.0,1.0,0.0,0.0,Digital collectibles aren’t the same as nfts😂😂,1666745283,0
0.0,1.0,0.0,0.0,eth 2.0 thoughts??,1666434597,0
0.0,1.0,0.0,0.0,"Mysterium NFT MINT 10/23 Ŧ๏ɭɭ๏ฬ Շђє ςɭยєร, ร๏ɭשє Շђє ๓ץรՇєгץ, ςɭคเ๓ ץ๏ยг гєฬคг๔ | ๓ץรՇєгเย๓ єאקɭคเภє๔",1666574270,0
0.0,1.0,0.0,0.0,The Small Council NFT Collection,1666622941,0
0.0,0.704,0.296,0.2732,Energy Mining Comparison Of Different Blockchains,1666528151,1
0.0,0.508,0.492,0.4404,This is a Good Idea,1666787095,1
0.0,0.957,0.043,0.0772,"Suppose you want to build the following environment for the release of your own coin or token , what will be the steps you take to build the architecture : https://sweatco.in/ https://sweateconomy.com/",1666432954,1
0.0,0.545,0.455,0.3612,like my ETH price,1666609592,1
0.0,0.912,0.088,0.5661,Burnt hair perfume. Elon the golden salesman. Rumour has it that for every order of this luxury perfume comes with a special something that will change the life of the beholder. Is it Bitcoin? A Tesla car? Doge coin? 1 million dollar?,1666506012,1
0.0,1.0,0.0,0.0,r/allmyreddit,1666567563,0
0.0,1.0,0.0,0.0,Tornado Cash usage post censorship,1666617182,0
0.0,1.0,0.0,0.0,Fat finger fuckup,1666508738,0
0.0,0.903,0.097,0.4404,Hey I have 1600$ all in eth what are some cryptos I should be spreading the 1600 into what’s a good portfolio for 1600$ or should I keep it all in eth,1666535128,1
0.0,1.0,0.0,0.0,bear call sell #DXY call price 112.072 volume at call price 0 time of call 2022-10-24T05:00:00Z,1666587609,0
0.0,1.0,0.0,0.0,Collabratz Music NFT Platform,1666576516,0
0.056,0.872,0.072,0.1531,If only there was a popular decentralized platform where users and creators could connect their wallet and transact with a currency where banks have no way of meddling in people’s private lives. If only that platform existed. Hmmm 🤔,1666395515,1
0.111,0.777,0.111,0.0,"Ugly, I have burnout issues with the resin, one day, I won’t quit my day job. Don’t mean to trigger maxis. Fun hobby, sterling silver representing electrons",1666456176,0
0.0,0.602,0.398,0.5106,any generous ethereum gods out there?,1666567140,1
0.118,0.882,0.0,-0.3412,"To quote Mihailo Bjelic: “If you can't see and verify the code, it's not safe and it's not Ethereum”",1666739340,-1
0.0,0.792,0.208,0.2732,AnchorTools: Video tutorial how to create your own token,1666738360,1
0.0,0.645,0.355,0.0258,Matter of time,1666392437,1
0.0,0.417,0.583,0.6369,Exchange The Best Cryptocurrency,1666447292,1
0.0,1.0,0.0,0.0,A Look at the First Phone-to-Phone Bitcoin Transfer Using a Nokia N900 Smartphone,1666599725,0
0.0,0.791,0.209,0.4404,"NFT Owners Have Rights That Can Be Protected, Singapore Court Ruling Shows",1666787587,1
0.0,1.0,0.0,0.0,bear call sell #DXY call price 110.981 volume at call price 0 time of call 2022-10-26T04:00:00Z,1666756807,0
0.0,1.0,0.0,0.0,Node discovery in execution layer,1666454500,0
0.0,1.0,0.0,0.0,An overview of the L2 projects and how their adoption is going,1666694781,0
0.0,0.822,0.178,0.3818,Decentralized Video Streaming Network Powered by Ethereum Experiences Fundamental Growth in 2022 Q3,1666424163,1
0.168,0.699,0.133,-0.128,Seek the fire of the spark that is already within you | YuroSako 🔥,1666584288,-1
0.0,1.0,0.0,0.0,A reminder to spread the hash(GET OFF WOOLYPOOLY),1666359026,0
0.0,1.0,0.0,0.0,Latest Week in Ethereum News,1666401645,0
0.0,0.787,0.213,0.4019,How would I initialize an array inside a struct + append values to it?,1666447741,1
0.0,0.816,0.184,0.4019,How can I find out what this contract is ? 0xb5d46E4D615acf38F31846bBbc7928a7E498BDad I think I found something interesting,1666780291,1
0.0,0.847,0.153,0.6597,How can I find out what this contract is ? 0xb5d46E4D615acf38F31846bBbc7928a7E498BDad I think I found something interesting I’m able to see the balance but the interesting part is the person that has interacted with this contract,1666780418,1
0.0,1.0,0.0,0.0,Do you think ETH could even surpass BTC?,1666368990,0
0.0,1.0,0.0,0.0,Shutter brings shielded voting to Snapshot,1666620150,0
0.0,1.0,0.0,0.0,KTO Zero Tax Buy Competition,1666699050,0
0.0,0.909,0.091,0.0258,can someone else checking if this 64 character withdrawal address makes sense?,1666479478,1
0.0,1.0,0.0,0.0,Looking for developer feedback on our new no-code blockchain filtering tool!,1666705593,0
0.0,1.0,0.0,0.0,heheh,1666705334,0
0.0,0.851,0.149,0.2732,How do people know which institution or individual is associated with a certain address?,1666641480,1
0.0,1.0,0.0,0.0,Exploring the Galaxy Of Boojabaunga Betaverse (Ethereum / GameFi / P2E / Fiat Ramp),1666718180,0
0.0,1.0,0.0,0.0,Send Ethereum,1666740698,0
0.0,1.0,0.0,0.0,"Explanation of what Proof of Stake is, in under 5 min (good for introducing others to the concept)",1666349341,0
0.0,1.0,0.0,0.0,Libonomy Blockchain Introduction,1666524106,0
0.0,0.551,0.449,0.6908,"funny street interviews, we see you XRP community lol",1666471412,1
0.0,1.0,0.0,0.0,cold storage,1666576871,0
0.0,1.0,0.0,0.0,Check out this campaign I just joined,1666598388,0
0.401,0.599,0.0,-0.7717,How and Why Mango Markets Was Able to Be Exploited by Attackers,1666382372,-1
0.0,1.0,0.0,0.0,Instant Generative Art NFTs,1666727916,0
0.0,1.0,0.0,0.0,enter the market: bull call buy #GOLD call price 1653.3 volume at call price 49619 time of call 2022-10-25T01:00:00Z,1666659605,0
0.0,0.604,0.396,0.7096,the best way to measure and compare different off-chain scaling solutions,1666445781,1
0.0,0.858,0.142,0.5848,Are you a developer with passion? 🥇 You can now Participate in the Assetmantle contributors programme to make a difference in the space! ⚙️ It is Open to both zealous artists and developers. 👉 www.atsetmantle.one,1666563258,1
0.35,0.65,0.0,-0.8658,"With a vicious pact, an ancient force of death is getting out of the eternal prison. The tarnished are returning to Nidar...",1666697851,-1
0.0,0.858,0.142,0.5848,Are you a developer with passion? 🥇 You can now Participate in the Assetmantle contributors programme to make a difference in the space! ⚙️ It is Open to both zealous artists and developers. 👉 www.assetMantle.one,1666476856,1
0.0,1.0,0.0,0.0,Who is Gavin Wood? - Polkadot CEO Steps Down,1666544394,0
0.648,0.352,0.0,-0.6739,Censorship FUD or real problem?,1666536506,-1
0.109,0.891,0.0,-0.3491,"Been building an onchain RNG with a bunch of sdks, cheaper &amp; faster than Chainlink but not sure about the use cases",1666698749,-1
0.0,0.444,0.556,0.8176,Crypto World is The best Crypto Free App,1666570217,1
0.0,1.0,0.0,0.0,Is ETH deflationary now?,1666427367,0
0.0,1.0,0.0,0.0,DCI30 REPORT: 10/25/2022,1666721327,0
0.0,1.0,0.0,0.0,Hey Guys!,1666785247,0
0.0,1.0,0.0,0.0,bear call sell #DXY call price 111.857 volume at call price 0 time of call 2022-10-25T13:00:00Z,1666702815,0
0.0,1.0,0.0,0.0,Reddit onboards more NFT users than OpenSea,1666599346,0
0.0,1.0,0.0,0.0,Under the Bridge,1666364301,0
0.122,0.742,0.136,-0.128,DeFi Has a Fourth and First amendment Crisis In The Making. The US Is On a Power Trip. Non US Citizens Have a Vested Interest In Getting The US Laws Changed.,1666454448,-1
0.0,1.0,0.0,0.0,‪Over 7 million #Python coders now have open access to #Web3 development tools.,1666463373,0
0.0,1.0,0.0,0.0,Pigeons of New York MINT,1666648884,0
0.0,1.0,0.0,0.0,Buy and sell products as the world's first authorized Web3 animation marketplace,1667056602,0
0.0,1.0,0.0,0.0,ETH gas fees and gas limits,1667123842,0
0.0,1.0,0.0,0.0,Young Sheldon 6x01 ☹️ #shorts,1667066544,0
0.0,1.0,0.0,0.0,Libonomy Blockchain Introduction,1666789889,0
0.0,0.649,0.351,0.5848,Vitalik says that cryptocurrency is superior to gold!,1667064396,1
0.0,1.0,0.0,0.0,bear call sell #SP500 call price 3791.94 volume at call price 0 time of call 2022-10-28T05:00:01Z,1666933212,0
0.0,1.0,0.0,0.0,I researched 50+ sources about decentralized identity and summarized what I learned here,1667070649,0
0.0,1.0,0.0,0.0,"Does anybody know, How to unzip tuples in Ethereum chart?",1666947645,0
0.0,1.0,0.0,0.0,"Ethereum Sets Short Liquidation Record, Wipes Out $500 Million in 2 Days",1667033472,0
0.0,1.0,0.0,0.0,"NFT Poem Collection- ""Conscious Illumination""",1667081480,0
0.0,1.0,0.0,0.0,Are Certik Skynet and Quantstamp monitoring service affordable for small project?,1666808576,0
0.0,0.712,0.288,0.8439,Get ready to share amazing Experience with the first NFT marketplace with blockchain-based identity from AssetMantle! You can do all you want to your NFTs on Get details 🚀 AssetMantle.one,1666911332,1
0.0,1.0,0.0,0.0,Any estimate what the Nakamoto Coefficient of Ethereum is?,1666957863,0
0.0,0.769,0.231,0.2732,Listed my NFT creation for sale on rarible,1667103026,1
0.168,0.754,0.078,-0.4329,"100% of DeFi Could Become Illegal, and The Bill on The Table Doesn't actually Guarantee That The CFTC Won't Try to Censor The Base Layer Of Protocols",1667052322,-1
0.0,1.0,0.0,0.0,Crypto Trading Premium Signals,1666866254,0
0.0,1.0,0.0,0.0,Learn Web3 Development @ useWeb3,1667075607,0
0.0,1.0,0.0,0.0,Libonomy Blockchain Introduction,1667042836,0
0.0,1.0,0.0,0.0,My birthday is in a few hours!,1667094946,0
0.428,0.572,0.0,-0.6408,Binance Presents an Educational Series to Combat Crypto FUD,1667044333,-1
0.0,1.0,0.0,0.0,Tim Beiko's All Core Devs call summary thread,1666908551,0
0.091,0.763,0.146,0.3761,I recently used Zksync and Starknet for testnet.. both are having too many bugs and not user friendly interface.. Ethereum is having best user interface..,1666928387,1
0.0,0.659,0.341,0.4767,What do I do with my ETH2 rewards?,1666797915,1
0.0,0.723,0.277,0.3182,Is proposer-builder-separation for sure going to happen?,1667167649,1
0.0,0.839,0.161,0.4005,The Worlds Most Secure Notebook To Store Your Recovery Phrase - Interview w/Founder @Stonekrypt &amp; @Craigorealtor,1666817028,1
0.0,1.0,0.0,0.0,ETH Staking on Wealthsimple,1667021834,0
0.0,1.0,0.0,0.0,Ques,1667044780,0
0.0,1.0,0.0,0.0,Ethereum: Understanding The Cryptocurrency Everyone Is Talking About,1667195662,0
0.0,1.0,0.0,0.0,100 Bloodlist spots available for BAGC,1666805530,0
0.0,1.0,0.0,0.0,$TWELON - NEW x100 MEMECOIN,1667078403,0
0.0,1.0,0.0,0.0,ZkSync is Developing an Ethereum Layer 3 Blockchain,1667129129,0
0.43,0.443,0.127,-0.7003,ETH merge created a new bunch of scams for abandoned miners.,1666838161,-1
0.191,0.522,0.287,0.2732,new free cloud mining application no investment https://youtu.be/mWPhq23N4g0,1666940669,1
0.0,1.0,0.0,0.0,"Incursion is a Dark Fantasy MMORPG, powered by #NFTs | Enter the lands between and explore the Nidarverse | A Gamified, Interoperable action-adventure Metaverse.",1666863835,0
0.0,1.0,0.0,0.0,Is it possible for a dapp to use L1 and L2s at the same time?,1666833323,0
0.0,1.0,0.0,0.0,Most bullish article on ETH this year,1666828457,0
0.0,1.0,0.0,0.0,Honr is on a moon mission,1666812674,0
0.73,0.27,0.0,-0.4019,Validator problem,1666969298,-1
0.0,1.0,0.0,0.0,scammed in 15k usd. options?,1667154179,0
0.0,1.0,0.0,0.0,bear call sell #DXY call price 110.734 volume at call price 0 time of call 2022-10-31T04:00:00Z,1667188805,0
0.365,0.366,0.269,-0.2003,Join the BITSCAN-ECON Discord Server!,1666804324,-1
0.306,0.694,0.0,-0.6597,Ethereum Can Be Used for Cancer Research. Here’s How It Works,1666864368,-1
0.0,1.0,0.0,0.0,How to own very expensive Ethereum NFT for mere fraction of cost?,1666877715,0
0.0,1.0,0.0,0.0,"this my node collection, what should I buy next ?",1666902879,0
0.0,1.0,0.0,0.0,bear call sell #BNBUSDT call price 301.811 volume at call price 924.7811 time of call 2022-10-29T07:00:03Z,1667026809,0
0.0,1.0,0.0,0.0,Ethereum (ETH) chart analysis,1667124334,0
0.0,1.0,0.0,0.0,Frequently Asked Questions + Weekly Discussion Thread,1667199610,0
0.0,1.0,0.0,0.0,trying to recover my 12 word wallet,1667144822,0
