neg,neu,pos,compound,headline,time,label
0.0,0.833,0.167,0.7351,I look forward to taking advantage of some of the Visa cash-back promos and would love to be able to utilize my crypto instantly with any bank's Visa card. Has anyone already tried this?,1667214951,1
0.0,0.455,0.545,0.3382,An unexpected surprise!,1667595419,1
0.0,1.0,0.0,0.0,EIPs Insight (October 2022),1667310318,0
0.0,0.8,0.2,0.4574,I made this video for class appreciate anyone who wants to check it out!,1667440283,1
0.0,0.476,0.524,0.5106,free book about Bitcoin,1667565507,1
0.0,1.0,0.0,0.0,Sign up for the Shibapaw $330 Airdrop https://launchpad.shibapaw.com/invite?ref=UD00059,1667217137,0
0.0,1.0,0.0,0.0,How to Transfer Ethereum to PayPal Instantly | Sell Ethereum for PayPal,1667330132,0
0.0,1.0,0.0,0.0,Staking on ledger.,1667231608,0
0.0,1.0,0.0,0.0,We're gonna be able to flex our avatars on Instagram,1667437679,0
0.0,1.0,0.0,0.0,One step to the Stone Age,1667242830,0
0.0,1.0,0.0,0.0,weth vs eth.,1667587835,0
0.0,1.0,0.0,0.0,I have some queries on Ethereum transaction.,1667222438,0
0.0,0.824,0.176,0.5994,"ganas Wallet: Identity Sync Part 1: Add a custom chain (Cosmos, EVM) to your mobile wallet from the web (feature preview, those interested can join testing)",1667231539,1
0.0,1.0,0.0,0.0,donation for construction bitcoin,1667598273,0
0.0,1.0,0.0,0.0,"If Ethereum allows to store arbitrary data on-chain, would it be possible to send a picture of child porn to it making it impossible to delete it?",1667298490,0
0.0,0.854,0.146,0.34,Exploring the FriesDAO Hack &amp; Other DeFi Security Issue For The Last Week of October,1667498124,1
0.0,1.0,0.0,0.0,new games,1667281615,0
0.0,0.583,0.417,0.6124,Libonomy blockchain solves these issues by making blockchain easy,1667674090,1
0.0,1.0,0.0,0.0,Why The ACIDVERSE? - It's a long one!,1667499296,0
0.0,1.0,0.0,0.0,Go Green! or Go Home! working towards a sustainable future. Stay Tuned #ReduX https://redux-technologies.com/,1667476870,0
0.0,0.256,0.744,0.4404,Thanks Blockchain,1667327953,1
0.0,1.0,0.0,0.0,MakerDAO Co-Founder Nicolai Muchgian Dies At 29,1667292438,0
0.0,1.0,0.0,0.0,What to Expect From Ethereum’s Next Big Upgrade,1667390135,0
0.0,1.0,0.0,0.0,NFT Collections Generator Pro 2023,1667349749,0
0.0,1.0,0.0,0.0,Solidity/React issue when using Ethers.js,1667609049,0
0.0,1.0,0.0,0.0,"Dan Romero: Farcaster, building a decentralized social network",1667586156,0
0.0,0.678,0.322,0.2263,how much is knowledge worth?,1667364294,1
0.0,1.0,0.0,0.0,The HOW TO OCSC DEMO,1667564755,0
0.0,1.0,0.0,0.0,Any other Brooklyn residents doing that big Ethereum Scavenger hunt?,1667251133,0
0.0,1.0,0.0,0.0,"Incursion is a story based Dark Fantasy MMORPG || Powered by #PlaytoOwn #NFTs || #Nidarverse (a gamified, interoperable action-adventure metaverse).",1667261298,0
0.062,0.762,0.176,0.5994,"Millionaire Mogs Club NFT Airdrop: 1000 Utility-Backed NFTs to give away. To claim, join the official r/millionaremogsclub subreddit and drop your ETH wallet address. Weekly competitions to win £10k🏆🥇🚀🥳🎉🎊🪅",1667304395,1
0.304,0.696,0.0,-0.3612,"65% of the blocks are censored, what are the implications?",1667307042,-1
0.0,0.756,0.244,0.6989,"/r/ethdev created a Web3/Crypto Job aggregator that collects all jobs in one place, if you want to work in the space. it's a very useful tool!",1667273662,1
0.0,1.0,0.0,0.0,We are NEO FILMS Studio.,1667405089,0
0.0,0.864,0.136,0.296,"Recently saw this interview with the person who predicted TTD, wanted to share with you.",1667460849,1
0.0,0.795,0.205,0.2023,🎙️ METACAST: Top Crypto Podcasts of October 2022,1667227028,1
0.0,0.899,0.101,0.4019,"For any projects that wish to use NFTs as tickets for their physical events, here is a side-project that I've set up to make it possible.",1667312287,1
0.0,1.0,0.0,0.0,Looking someone for a Twitter space,1667210270,0
0.0,0.645,0.355,0.5106,How do I know to trust L2 networks?,1667383203,1
0.0,0.674,0.326,0.4404,"Libonomy - Interoperable, scalable and truly decentralized blockchain",1667407964,1
0.167,0.833,0.0,-0.34,"1,000 Solana validators go offline as Hetzner blocks server access. The 12% of Ethereum nodes are also using it.",1667415647,-1
0.0,1.0,0.0,0.0,New investment community. Looking for feedback.,1667504675,0
0.0,1.0,0.0,0.0,Any other Brooklyn residents doing that big Ethereum scavenger hunt?,1667252113,0
0.0,1.0,0.0,0.0,Checkout Aravive,1667227293,0
0.0,0.543,0.457,0.6369,What’s the best mixer for ethereum?,1667520391,1
0.132,0.627,0.241,0.4098,"Wait, 1 USDC = 1.07~ DAI on couple of DEX's currently? Risk free Arb??",1667403148,1
0.0,0.674,0.326,0.4404,"Libonomy - Interoperable, scalable and truly decentralized blockchain",1667559088,1
0.0,1.0,0.0,0.0,Quick question,1667673640,0
0.0,1.0,0.0,0.0,How to generate your wallet ?,1667564600,0
0.0,0.656,0.344,0.6369,🚀 Blockchain Is The Single Greatest Revolution Of Our Time,1667502342,1
0.0,0.784,0.216,0.296,Vitalik Buterin Shares Updated Ethereum Roadmap Featuring “The Scourge”,1667607379,1
0.0,0.886,0.114,0.4019,What was that link to a tool that let you check if you had smart contracts on your address that could siphon tokens?,1667667524,1
0.0,1.0,0.0,0.0,Latest Week in Ethereum News,1667613218,0
0.0,1.0,0.0,0.0,".P. Morgan has executed its 1st *LIVE* trade on public blockchain using DeFi, Tokenized Deposits &amp; Verifiable Credentials",1667395997,0
0.0,1.0,0.0,0.0,SHOPIFY,1667256442,0
0.062,0.762,0.176,0.5994,"Millionaire Mogs Club NFT Airdrop: 1000 Utility-Backed NFTs to give away. To claim, join the official r/millionaremogsclub subreddit and drop your ETH wallet address. Weekly competitions to win £10k🏆🥇🚀🥳🎉🎊🪅",1667398803,1
0.0,1.0,0.0,0.0,Reddit Post Sentiment,1667462251,0
0.0,1.0,0.0,0.0,Is this simplified Ali Baba cave still a Zero-Knowledge proof?,1667307053,0
0.0,1.0,0.0,0.0,enter the market: bull call buy #BNBUSDT call price 321.046 volume at call price 396.8366 time of call 2022-11-03T02:00:00Z,1667440810,0
0.0,1.0,0.0,0.0,"Fred's Construction Drawings PP - More than 10,000 construction drawings and projects!",1667296502,0
0.0,0.508,0.492,0.4404,A truly interoperable blockchain - Libonomy,1667408777,1
0.0,1.0,0.0,0.0,"Breaking: Vitalik Buterin Releases ""Updated Ethereum Roadmap""",1667637618,0
0.0,1.0,0.0,0.0,Checkout Aravive https://aravive.com/,1667227364,0
0.0,1.0,0.0,0.0,The story of a web3 design studio - Crenfinite,1667338370,0
0.0,1.0,0.0,0.0,We'll crap...ETH is down again today,1667493341,0
0.084,0.79,0.125,0.223,"After not disclaiming their accepted chains Bitfinex is now requesting $500 for a ""recovery fee"" I cannot afford - can someone help?",1667228159,1
0.0,0.832,0.168,0.4263,JP Morgan Uses Polygon To Make First Decentralized Finance Trade. This is bullish for Ethereum!,1667524095,1
0.0,1.0,0.0,0.0,Staking with NFTs,1667676057,0
0.0,1.0,0.0,0.0,"Althea, global blockchain for telecom, Eth/ cosmos connectivity",1667274487,0
0.558,0.233,0.209,-0.6696,"Seeking for help, fake airdrop fraud!",1667302069,-1
0.0,1.0,0.0,0.0,Open beta for cross-chain AI NFT Animator,1667622044,0
0.118,0.882,0.0,-0.3412,Polygon (Matic) is not beneficial to Ethereum and acts as a parasitic side chain soaking up its economic bandwidth ❌❌,1667605386,-1
0.0,0.701,0.299,0.6892,Mastercard demo on the Polygon MATIC network! This is great for Ethereum!,1667613906,1
0.0,1.0,0.0,0.0,"Domain name market reappears record-breaking deal, 3W.COM was acquired for US$3 million",1667464907,0
0.0,1.0,0.0,0.0,the first MetaPhy NFT Marketplace laid on a Compliance first pedigree,1667406033,0
0.0,1.0,0.0,0.0,donation for construction bitcoin,1667397884,0
0.0,1.0,0.0,0.0,"Geth v1.10.26 - Small bugfix release around snap sync, among other things",1667494687,0
0.0,1.0,0.0,0.0,"I will give away 5 ETH in the comments randomly to everyone, 1 ETH each.",1667219651,0
0.416,0.584,0.0,-0.5514,I’m screwed. Can anyone help?: https://twitter.com/mattpre02726958/status/1588035603114991617?s=46&amp;t=TTgAsM2Q21l-KmsVx62Wig,1667462839,-1
0.198,0.679,0.123,-0.6349,"Bonkers USDC - DAI rates on certain DEXes - just paid $13k DAI for $14.4k USDC. Risk free arbs!? Well, actually Im not sure, but the exchange rate was approximately 1.08 when i tried, just bad liquidity i guess?",1667517117,-1
0.0,1.0,0.0,0.0,Need the state of every contract at a point in 2016,1667576045,0
0.084,0.79,0.125,0.223,After not disclaiming their accepted chains Bitfinex is now requesting $500 for a “recovery fee” I cannot afford - can someone help?,1667228596,1
0.0,0.625,0.375,0.6369,How to Find the Best Web3 Hackathon Ideas?,1667388305,1
0.136,0.649,0.214,0.296,"Hmm, 1 USDC = 1.08 DAI on couple of DEX's currently. Risk free Arb?",1667358109,1
0.0,0.704,0.296,0.2732,Energy Mining Comparison Of Different Blockchains,1667408328,1
0.487,0.513,0.0,-0.6908,The strange death of MakerDao co-founder Nikolai Mushegian.,1667282750,-1
0.0,0.74,0.26,0.4871,When did blockchain become popular? And what is blockchain technology?,1667337940,1
0.0,1.0,0.0,0.0,Reddit Sentiment was a Leading Indicator Yesterday,1667465185,0
0.049,0.922,0.029,-0.2244,Argentas is developing a future payment network and having some of their future global currency reserved for early adopters. This all is by invitation only and I have a limited number of invitations. Act fast as this invitation link may expire! Just click this link: https://argentas.io/users/invite.,1667503559,-1
0.0,0.618,0.382,0.8883,What is the best app to buy ETH? I keep getting different answers from different websites. Any help would be appreciated!,1667220047,1
0.0,1.0,0.0,0.0,new games,1667281267,0
0.0,0.787,0.213,0.2263,Staking on Lido worth it with a few Eth?,1667592220,1
0.0,0.53,0.47,0.7964,Crypto World App is your Free guide for a successful trading,1667312165,1
0.649,0.351,0.0,-0.5719,ETH Scam Blocker,1667363705,-1
0.0,1.0,0.0,0.0,ETH vs ETC,1667654525,0
0.0,1.0,0.0,0.0,I rickrolled the entire Eth Testnet! Try to view the data as UTF-8!,1667379297,0
0.0,1.0,0.0,0.0,Sent ETH to txn hash. Can it be recovered?,1667480984,0
0.0,0.855,0.145,0.296,100 customers join VMware Ethereum beta in 2 months. Adds Fireblocks and Web3 Labs integrations.,1667570175,1
0.151,0.64,0.209,0.2481,Attention talentless humans. Art Gobblers are now free to mint! 31.10 4.20 EDT,1667281235,1
0.075,0.856,0.068,-0.0534,Ethereum L2s Could Take Revenue From the Blockchain and Putting Pressure on the ETH Price as They Become More Competitive - Has This Aspect been Clarified and Adressed?,1667432286,-1
0.0,1.0,0.0,0.0,How to Transfer Binance Coin BNB to PayPal Instantly | Sell BNB for PayPal,1667614350,0
0.0,1.0,0.0,0.0,Cheugy Coin | Coined by Gen Z,1667249962,0
0.0,1.0,0.0,0.0,"The new unique NFTs Have Been Listed, Check it Out!",1667361941,0
0.0,1.0,0.0,0.0,Waffle 4 is out,1667239920,0
0.116,0.698,0.186,0.296,Where can i buy safely buy Ethereum without the transaction getting cancelled by my bank,1667631095,1
0.102,0.634,0.263,0.5106,Irregular stablecoin pricing on certain DEXes - just paid $13k DAI for $14k USDC. Risk free arb?,1667431568,1
0.0,1.0,0.0,0.0,Buy and sell products as the world's first authorized Web3 animation marketplace,1667554823,0
0.0,1.0,0.0,0.0,Why did (smart)people expect Yields to go up post merge?,1667292981,0
0.0,1.0,0.0,0.0,"Kind of DAO platform for decision making, public record keeping, finances for informal solidary agriculture group",1667500080,0
0.0,0.742,0.258,0.7096,"Stake the $CLO, a native coin of Callisto network using your trust wallet to get the benefits of 7% Apy.",1667584423,1
0.0,0.746,0.254,0.1779,Ethereum's Layer 2 ecosystem is undeniably growing,1667647945,1
0.0,1.0,0.0,0.0,Curve Newsletter,1667289852,0
0.0,1.0,0.0,0.0,"Bitcoin Price and Prediction â BTC to Hit $21,000 Before FOMC and Fed Rate?",1667306126,0
0.0,1.0,0.0,0.0,Instagram + NFT Community,1667433348,0
0.0,0.866,0.134,0.1779,User review of the latest cross-chain token transfer solutions: LayerZero &amp; Axelar,1667511192,1
0.0,1.0,0.0,0.0,Web3 with react native?,1667648248,0
0.0,0.645,0.355,0.296,Join All The Blockchains Together,1667494466,1
0.0,1.0,0.0,0.0,Something magical is coming from Penderyn Distillery!,1667571146,0
0.0,1.0,0.0,0.0,OEV could mean millions for DeFi dApps,1667322502,0
0.0,1.0,0.0,0.0,"Builders in the web3 ecosystem, how do you build your websites? Centralized web hosting, or decentralized?",1667302638,0
0.0,0.926,0.074,0.4019,"How to add xDai to be able to swap Weth to Eth on the gnosis chain? When I try to bridge Eth to xDai, only get the Eth to Weth option, I need help figuring this out",1667558392,1
0.0,1.0,0.0,0.0,bear call sell #SP500 call price 3818.56 volume at call price 0 time of call 2022-11-02T19:00:00Z,1667415606,0
0.0,0.676,0.324,0.34,The Scalability Trilemma: Security vs Decentralization?,1667503439,1
0.368,0.632,0.0,-0.1901,"Wallet drained, but how?",1667425536,-1
0.0,0.645,0.355,0.296,Join All The Blockchains Together,1667563552,1
0.164,0.643,0.193,0.1027,New oracle system to help DApps retrieve millions lost to MEV,1667502111,1
0.0,1.0,0.0,0.0,What're the system requirements for an archive node with an indexer for research? (without participation in PoS verification),1667597488,0
0.0,1.0,0.0,0.0,🚨NFT marketplace wizard big update! [+customizations] [+ERC1155 compatibility] 👀,1667247877,0
0.0,0.597,0.403,0.4019,How Ethereum Smart Contracts Work,1667432327,1
0.0,0.843,0.157,0.4738,Guys I just found this video and it worked!! I made .14 Eth in 30 minutes and i don’t know what’s going on. I want to share it.,1667267284,1
0.0,1.0,0.0,0.0,Casino metaverse on the Ethereum chain,1667480214,0
0.0,0.681,0.319,0.6892,Instagram is launching NFT's on Polygon! This is great for Ethereum!,1667523020,1
0.0,1.0,0.0,0.0,Polygon Working to Become ‘True Layer 2’,1667673803,0
0.0,1.0,0.0,0.0,"I will give away 5 ETH in the comments randomly to everyone, 0.5 ETH each.",1667228066,0
0.0,0.633,0.367,0.4404,Are there better alternatives to Metamask?,1667675484,1
0.158,0.842,0.0,-0.128,Essay: Reducing the barrier for crypto using Meta Transactions,1667508730,-1
0.0,0.704,0.296,0.2732,Energy Mining Comparison Of Different Blockchains,1667662367,1
0.0,1.0,0.0,0.0,Can someone tell me how to get pending transactions in go-ethereum?,1667522393,0
0.0,0.776,0.224,0.3818,Can Ethereum eventually and competitively replace credit card processing companies?,1667412644,1
0.0,0.888,0.112,0.2263,Is this Pokémon collection worth 10k and if so how much? Offered 10 k and got declined.,1667444890,1
0.0,1.0,0.0,0.0,Quick question?,1667674325,0
0.0,1.0,0.0,0.0,League of Lions is all about connecting pop culture with Web3,1667372768,0
0.0,1.0,0.0,0.0,Ethereum Merge- The Biggest Event In cCrypto World Today,1667334873,0
0.141,0.741,0.118,-0.1368,"Those Who Frequently Buy NFTs, how do you go about finding info on promising projects? Is this a difficult task?",1667464703,-1
0.0,1.0,0.0,0.0,The HOW TO OCSC DEMO,1667495736,0
0.0,1.0,0.0,0.0,bear call sell #BTCUSD call price 20397 volume at call price 67.72925695 time of call 2022-11-02T13:00:09Z,1667394019,0
0.055,0.748,0.197,0.5574,I have a question can anybody send me 10€ worth of Ethereum and I give u a paysafe card. Sounds strange but you would help me a lot 🙏,1667635020,1
0.0,1.0,0.0,0.0,"Got a Movie Idea!!, All ears to you.",1667221567,0
0.0,0.701,0.299,0.7506,Is there a way to identify in real time if the Optimism bridge is working effectively or not?,1667586705,1
0.0,1.0,0.0,0.0,looking for ethereum and bitcoin olny wallet,1667632274,0
0.0,0.656,0.344,0.6369,What's the best Ethereum monitoring platform for Desktop PELEASE?,1667401789,1
0.0,0.87,0.13,0.2023,"Top 50 Crypto Gainers - InfiniteCoinCap - Cryptocurrency Market Cap, Live Prices, Charts &amp; Ticker",1667625617,1
0.0,0.655,0.345,0.8118,Instagram is launching NFT's support with Polygon! This is great news for Ethereum. Go MATIC go!,1667523245,1
0.0,1.0,0.0,0.0,The reason gas prices have been declining for the past 4 quarters despite having over 100% gas usage,1667243410,0
0.0,1.0,0.0,0.0,Introduction to Taiko - A type-1 ZK-EVM,1667420578,0
0.0,1.0,0.0,0.0,"In 2 months, 100 customers joined VMware 's Ethereum beta",1667501134,0
0.0,1.0,0.0,0.0,"Incursion is a story-based Dark Fantasy MMORPG || Powered by #PlaytoOwn #NFTs || #Nidarverse (a gamified, interoperable action-adventure metaverse).",1667349598,0
0.0,1.0,0.0,0.0,bear call sell #ETHUSDT call price 1635.26 volume at call price 1431.6419391 time of call 2022-11-05T14:00:00Z,1667656811,0
0.0,0.69,0.31,0.4019,Is the execution of a smart contract de-centralized?,1667414235,1
0.0,1.0,0.0,0.0,What happened to ZCash on Ethereum efforts?,1667574431,0
0.0,1.0,0.0,0.0,Where can I find part-time jobs related to Ethereum and its ecosystem?,1667399137,0
0.0,1.0,0.0,0.0,bear call sell #SP500 call price 3893.99 volume at call price 0 time of call 2022-11-01T14:00:00Z,1667311212,0
0.169,0.726,0.105,-0.2023,Ethereum number of addresses sending to exchanges just hit a 5 year low,1667568923,-1
0.0,0.815,0.185,0.3612,Do you have to specify nonce in a tx sent to the mempool?,1667320633,1
0.0,1.0,0.0,0.0,Anyone here looking for NFT Artist? We are group of NFT Artist and we have done many projects and these are our current works,1667383330,0
0.132,0.627,0.241,0.4098,"Wait, 1 USDC = 1.07~ DAI on couple of DEX's currently? Risk free Arb??",1667360024,1
0.0,0.916,0.084,0.0258,The crypto market review website Elliot's Waves predicts that Dogecoin will reach $0.2.,1667389239,1
0.0,0.676,0.324,0.8625,1inch optimizes rETH swaps by directly integrating Rocket Pool’s mint/burn functions — large traders will actually be minting rETH to ensure the best rate,1667392245,1
0.0,0.817,0.183,0.2003,"ethOS, the first crypto native OS has launched V1.1!",1667467221,1
0.0,1.0,0.0,0.0,Where can I find intermediate level material that would let me write my own zk rollup ?,1667390653,0
0.0,0.833,0.167,0.25,"Ethereum is Outperforming Bitcoin, Says Raoul Pal CEO of Real Vision",1667367698,1
0.0,1.0,0.0,0.0,enter the market: bull call buy #SP500 call price 3881.81 volume at call price 0 time of call 2022-11-01T00:00:04Z,1667260818,0
0.091,0.698,0.21,0.7531,Barclays &amp; other banks are using intrusive AML type calls to veil their market research into crypto &amp; 3rd party custody demand - Just got the weirdest legit ''Fraud Prevention'' call,1667316042,1
0.116,0.698,0.186,0.296,Where can i buy safely buy Ethereum without the transaction getting cancelled by my bank,1667631186,1
0.249,0.751,0.0,-0.3919,"Ethereum Briefly Holds above $1,503 but Risks Further Decline",1667548745,-1
0.0,1.0,0.0,0.0,Why did Yuga Labs purchase Crypto Punks IP?,1667340161,0
0.06,0.9,0.041,-0.2179,"Hey, I am working on a project where you can transfer a file from one wallet address to another. Could you help me how should I approach this problem? For storing files I'll use ipfs and send the hash to other wallet, but how to do that!?",1667248957,-1
0.0,1.0,0.0,0.0,Web3 : The Emperor's New Clothes,1667442775,0
0.0,0.978,0.022,0.0258,"Ethereum (ETH) has held the $1,500 level since Tuesday despite the Fed's rate hike and hawkish stance and is currently on an upside momentum, up 3.93% so far today. As the US midterm elections will happen next week, do you think ETH will reach $1,700 or above by November 11?",1667573012,1
0.0,1.0,0.0,0.0,Why dGames don't use layer2 ?,1667796305,0
0.0,0.679,0.321,0.8176,Carmaker Porsche NFT public/free Ethereum mint now live. 1000 hand drawn sketches with tangible benefits for Porsche owners. Interesting at least.,1667932075,1
0.0,0.508,0.492,0.7003,Truly Truly Something We all Need To See,1668019805,1
0.0,0.781,0.219,0.6369,I’m hosting this NFT art exhibit. Would love if you could come take part in it.,1668025339,1
0.0,0.859,0.141,0.2023,Here are the top 20 code contributors to the ethereum ecosystem #notallheroeswearcapes,1667841760,1
0.0,0.263,0.737,0.4215,Nice job,1667846780,1
0.0,0.843,0.157,0.0772,want someone to send me some ETH? 0x627CfAa1c0c367C83F27561a2981A6845add9EEd,1667955836,1
0.0,1.0,0.0,0.0,Bug etherscan/metamask,1668068271,0
0.0,0.674,0.326,0.4404,"Libonomy - Interoperable, scalable and truly decentralized blockchain",1668022820,1
0.0,1.0,0.0,0.0,"Paiverse: More on our partners, Penderyn Distillery",1668000958,0
0.0,1.0,0.0,0.0,Exploring the Gala Games Hack,1668022595,0
0.0,0.764,0.236,0.5719,"Happy day.. Market recovering, and big news: Porshce begins Ethereum NFT public/free mniting",1668095028,1
0.061,0.774,0.165,0.4939,"Porsche nft Public Free Mint now live. Another example of boomer brands trying to stay relevant - Ill pass, but it does show how huge NFTs have become.",1667854869,1
0.0,1.0,0.0,0.0,Open up Infinite Possibilities on Paiverse by getting WL,1668101832,0
0.061,0.774,0.165,0.4939,"Porsche nft Public Free Mint has begun.. Another example of boomer brands trying to stay relevant - Ill pass, but it does show how huge NFTs have become.",1667793549,1
0.0,1.0,0.0,0.0,Do you run your own nodes ?,1667929181,0
0.0,0.847,0.153,0.8172,"Check out this platform that allows any token community, DAO or web3 creator to collaborate and govern efficiently. CharmVerse is the solution to coordinate tasks, vote on proposals, and get rewarded with bounties. The Web3 version of Notion is here and waiting for you to try out! Here is a demo",1668021929,1
0.0,0.847,0.153,0.2023,Here are the top 20 code contributors to the ethereum ecosystem,1667896854,1
0.0,1.0,0.0,0.0,Guide: How to buy extra moons for tipping,1667792210,0
0.0,1.0,0.0,0.0,How do I fix this transaction bounty $50,1668036640,0
0.0,0.783,0.217,0.3612,How is it like to work in the Ethereum Foundation?,1667744877,1
0.0,1.0,0.0,0.0,enter the market: bull call buy #DXY call price 111.096 volume at call price 0 time of call 2022-11-07T00:00:01Z,1667779224,0
0.231,0.769,0.0,-0.4019,[Blog] Blockchain Data Ingestion - Common problems for Web2.5 Tech Stacks,1667850151,-1
0.0,0.815,0.185,0.3612,Identity providers for web3. Is there something like Civic (Solana) for Ethereum?,1667861491,1
0.058,0.788,0.155,0.4939,"So, the Porsche nft Public Free Mint has begun.. Another example of boomer brands trying to stay relevant - Ill pass, but it does show how huge NFTs have become.",1667758625,1
0.0,0.679,0.321,0.8176,Carmaker Porsche NFT public/free Ethereum mint now live. 1000 hand drawn sketches with tangible benefits for Porsche owners. Interesting at least.,1667888456,1
0.0,1.0,0.0,0.0,zkIBC event tomorrow (Cosmos' IBC to Ethereum),1668007424,0
0.255,0.142,0.603,0.5983,Please Permanently Ban Me! Thanks :),1667993408,1
0.374,0.626,0.0,-0.5542,"Solana Another ETH ""Killer"" most likely failed",1668022479,-1
0.0,0.444,0.556,0.3612,Do you agree?,1668083430,1
0.254,0.696,0.05,-0.6911,"Gm sers, you might want to take a look a this, I found this recently without much hope but men I was wrong.",1668103193,-1
0.0,1.0,0.0,0.0,Why are you investigating in cryptocurrency?,1667830969,0
0.0,0.775,0.225,0.4404,is it Safe to Keep Wrapped Ethereum (PolygonChain) for long term ?,1668075240,1
0.0,0.847,0.153,0.4404,Matrix Protocol - Crypto Gaming - We Do It Better - MTX NFTs - Launching Now - Giveaway Contests Ongoing - Verified Contract.,1667890559,1
0.0,1.0,0.0,0.0,"I ""found"" a wallet with Metamask. HOW??",1667700865,0
0.0,1.0,0.0,0.0,Have you heard of the NFT lottery?,1668003730,0
0.0,0.769,0.231,0.2732,Bora Research#8-Ethereum Price Crashes strongly behind Binance-FTX deal,1667983943,1
0.0,0.741,0.259,0.4215,putinpidoras.eth Auction for Ukraine aid. Nice nft sale. https://opensea.io/sandytrade,1667690510,1
0.0,1.0,0.0,0.0,"Ethereum boffin Phil Daian made a mastodon instance for our community, also available via Tor",1667793448,0
0.0,1.0,0.0,0.0,Convert CRO to ETH,1667822087,0
0.342,0.658,0.0,-0.6369,What is stopping someone from putting illegal content directly into the blockchain?,1667838077,-1
0.464,0.536,0.0,-0.3818,Ethereum supply shock today,1667950127,-1
0.0,1.0,0.0,0.0,Crypto currency,1667901105,0
0.0,1.0,0.0,0.0,"Defi history questions. Why MakerDao is called the first defi, not pre-Ethereum dexs?",1667964222,0
0.351,0.649,0.0,-0.4019,What are the arguments against Ethereum?,1668018550,-1
0.0,1.0,0.0,0.0,putinpidoras.eth Auction for Ukraine Aid.,1667690006,0
0.0,0.679,0.321,0.8176,Carmaker Porsche NFT public/free Ethereum mint now live. 1000 hand drawn sketches with tangible benefits for Porsche owners. Interesting at least.,1667889297,1
0.0,1.0,0.0,0.0,Shopping website with 15+ million products to shop with Ethereum and other cryptocurrencies,1667830690,0
0.209,0.791,0.0,-0.5719,Signed a scam message and ETH transfer from my account was made. Is my account compromised?,1667811758,-1
0.0,0.833,0.167,0.34,Is there any correlation btw Ethereum market cap and Ethereum total value secured...,1667829730,1
0.0,0.674,0.326,0.4404,"Libonomy - Interoperable, scalable and truly decentralized blockchain",1668018166,1
0.0,1.0,0.0,0.0,crypto Keys Yacht Club Nfts https://opensea.io/collection/cryptokeysyachtclub,1667946883,0
0.0,0.645,0.355,0.296,Join now and become a Zodiac⛩,1668031039,1
0.0,1.0,0.0,0.0,THIS IS HOW THE BANKS ROBBING YOUR MONEY!! YOU HAVE TO WATCH THIS VIDEO NOW!!!,1667856666,0
0.0,0.204,0.796,0.5994,beautiful scenerylandscape,1668040823,1
0.0,0.789,0.211,0.34,"GitHub - a16z/helios: A fast, secure, and portable light client for Ethereum",1667886223,1
0.0,0.303,0.697,0.3182,Its cool,1667763287,1
0.0,1.0,0.0,0.0,Real Estate Tokenization Platform | Tokenize Residential &amp; Commercial Pr...,1668085399,0
0.0,1.0,0.0,0.0,ERC20 token enlightment,1667775131,0
0.0,0.793,0.207,0.5719,Ethereum Developer Tooling Landscape - a comprehensive list of tools that developers use when developing smart contracts on Ethereum and EVM-compatible chains.,1668087177,1
0.0,1.0,0.0,0.0,Curve Newsletter,1667984654,0
0.255,0.142,0.603,0.5983,Please permanently ban me! Thanks :),1667993338,1
0.0,0.682,0.318,0.4215,Is it true Google had consider Ether?,1667994709,1
